,School,CourseID,Descriptions
114,Northwestern,"CRDV 312-7 Engineering Projects in Service Learning (Half-Time) (0 units) Noncredit course requiring students to engage in an engineering-related, half-time community service project under the guidance of an appropriate faculty member, agency supervisor, or mentor. Prerequisite: consent of department. ","CRDV 313-1,2,3,4,5,6-GM International Engineering Research Experience (0 units) Noncredit course allowing students to maintain full-time enrollment at Northwestern while engaged in a University-based research project under the supervision of a faculty research sponsor. Offered in partnership with the Global McCormick initiative. Prerequisite: consent of department. CRDV 313-7 Engineering Research (Half-Time) (0 units) Noncredit course allowing students to maintain half-time enrollment at Northwestern while engaged full-time in a University-based research project under the supervision "
115,Northwestern,PRDV 397-0 Selected Topics in Personal Development ,(.5 units) Topics of limited scope as suggested by faculty or students and approved by the McCormick Curriculum Committee. 
116,Northwestern,EECS 110-0 Introduction to Computer Programming ,"Introduction to programming practice using a modern programming language. Analysis and formulation of problems for computer solution. Systematic design, construction, and testing of programs. Substantial programming assignments. Not to be taken for credit with or after 111. "
117,Northwestern,EECS 111-0 Fundamentals of Computer Programming ,"Introduction to principles of programming and procedural thinking. Procedural abstraction, data abstraction, modularity, object-oriented programming. Use of the Scheme programming language and computer facilities. Substantial programming assignments, including numerical and symbolic programs. Required for the computer science degree. "
118,Northwestern,EECS 130-0 Tools and Technology of the World Wide Web ,"Introduction to the theory and practice of developing sites on and technology for the web. Basics of HTML, JavaScript, ASP, and CGI programming. "
119,Northwestern,EECS 203-0 Introduction to Computer Engineering ,"Overview of computer engineering design. Number systems and Boolean algebra. Logic gates. Design of combinational circuits and simplification. Decoders, multiplexers, adders. Sequential logic and flip flops. Introduction to assembly language. Application of concepts to a computer engineering design project. "
120,Northwestern,EECS 205-0 Fundamentals of Computer System Software ,"Basics of assembly language programming. Macros. System stack and procedure calls. Techniques for writing assembly language programs. Features of INTEL 8086/88-based PC. Interfaces between C and assembly codes. Prerequisite: 110 or GEN ENG 205-1,2,3,4; 203 recommended. "
121,Northwestern,EECS 212-0 Numerical Foundations of Computer Science ,"Basic concepts of finite and structural mathematics. Sets, axiomatic systems, the propositional and predicate calculi, and graph theory. Application to computer science: sequential machines, formal grammars, and software design. Prerequisite: MATH 230. EECS 213-0 Introduction to Computer Systems The hierarchy of abstractions and implementations that make up a modern computer system; demystifying the machine and the tools used to program it; systems programming in C in the UNIX environment. Preparation for upper-level systems courses. Prerequisite: 211 or 230. EECS 214-0 Data Structures and Data Management Design, implementation, and analysis of abstract data types; data structures and their algorithms. Topics include data and procedural abstraction, linked lists, stacks, queues, binary trees, searching, and sorting. Required for the computer science degree. Prerequisite: 211 or 230. EECS 221-0 Fundamentals of Circuits Circuit analysis and network theorems; linearity and superposition; series/ parallel combinations of R, L, and C circuits; sinusoidal forcing; complex frequency and Bode plots; mutual inductance and transformers; two-port networks; Fourier analysis; response of circuits to periodic nonsinusoidal sources. Prerequisite: 202. "
122,Northwestern,EECS 222-0 Fundamentals of Signals and Systems ,"Comprehensive introduction to analysis of continuous and discrete-time signals and systems. Linear time-invariant systems, convolution. Fourier series representations of periodic signals. Continuous- and discrete-time Fourier transforms. Laplace transform; z-transform. Prerequisite: 202. "
123,Northwestern,EECS 223-0 Fundamentals of Solid-State Engineering ,"Crystalline state of matter; quantum phenomena and quantum mechanics; electrons in atoms, atoms in crystals, electrons in crystals; semiconductors; thermal properties of crystals, electrical properties of crystals and semiconductors; p-n junction. Prerequisites: 202; PHYSICS 135-3; MATH 234. "
124,Northwestern,"EECS 224-0 Fundamentals of Electromagnetics and Photonics Concepts of flux, potential, gradient, divergence, curl, and field intensity. Boundary conditions and solutions to Laplace and Poisson equations. Capacitance and inductance calculations. Conductors, insulators, and magnetic materials. Prerequisites: 202, 221; PHYSICS 135-2; MATH 234; or consent of instructor. EECS 225-0 Fundamentals of Electronics Diode, BJT, and FET circuits; design using ideal operational amplifiers; feedback; frequency response; biasing; current sources and mirrors; small-signal analysis; design of operational amplifiers. Prerequisites: 221, 223. ","EECS 230-0 Programming for Engineers Introduction to computer programming in an object-oriented language. Emphasis on applications to computer systems, computer simulation, and discrete optimization. Basic principles of software engineering. Not to be taken for credit with or after 211 or 231. Prerequisites GEN ENG 205-1,2. "
125,Northwestern,EECS 231-0 Advanced Programming for Computer Engineers ,"Object-oriented programming, classes and data hiding, dynamic object construction and destruction, derived classes and inheritance, virtual functions; file processing; introduction to UNIX; testing and test generation. Not to be taken for credit with or after 211 or 230. Prerequisite: 110 or knowledge of a programming language. EECS 250-0 Physical Electronics and Devices The physical basis of electronic and optoelectronic devices and their application in analog and digital systems. Diodes, transistors, LEDs, photodetectors, and lasers are described, and their properties explored. Prerequisites: 221; PHYSICS 135-2. EECS 270-0 Applications of Electronic Devices DC and AC networks, rectifiers, transistor amplifiers, feedback and operational amplifiers, digital electronics, and microprocessors. Not open to electrical engineering degree candidates. Prerequisites: MATH 224; PHYSICS 135-2; or equivalent. "
126,Northwestern,EECS 302-0 Probabilistic Systems and Random Signals ,"Basic concepts of probability theory and statistics, random variables, moments; multiple random variables, conditional distributions, correlation; random signals; applications to engineering systems. Prerequisite: MATH 234. EECS 303-0 Advanced Digital Logic Design Overview of digital logic design. Technology review. Delays, timing in combinational and sequential circuits, CAD tools, arithmetic units such as ALUs and multipliers. Introduction to VHDL. Prerequisite: 203. EECS 307-0 Communications Systems Analysis of analog and digital communications systems, including modulation, transmission, and demodulation of AM, FM, and TV systems. Design issues, channel distortion and loss, bandwidth limitations, additive noise. Prerequisites: 222, 302. "
127,Northwestern,EECS 308-0 Advanced Electromagnetics and Photonics ,"Electromagnetic waves, transmission lines; impedance transformation; transients on lines; electrostatics, conductors, and capacitors; magnetostatics and inductors; wave reflection and transmission; electromagnetic motor, "
128,Northwestern,EECS 317-0 Data Management and Information Processing ,"Data representation, file and record organization, linear and linked lists, and scatter storage techniques. Sorting and searching algorithms. Solving problems involving large databases. Not for computer science degree candidates. Prerequisite: 110, 111, or programming experience. EECS 321-0 Programming Languages Introduction to key parts of programming languages: syntax, semantics, and pragmatics. Implementation of a series of interpreters that show how various aspects of programming languages behave. Prerequisites: 111, 214. EECS 322-0 Compiler Construction Overview of compilers and context-free languages, top-down parsing, LL(1) parser construction, translation grammars, implementation of lexical analyzer, parser and translator, compiler optimization, error handling, and recovery. Prerequisite: 214. "
129,Northwestern,"EECS 325-1,2 Artificial Intelligence Programming ","Introduction to LISP and programming knowledge-based systems and interfaces. Strong emphasis on writing maintainable, extensible systems. Topics include semantic networks, frames, pattern matching, deductive inference rules, case-based reasoning, and discrimination trees. Project-driven. Substantial programming assignments. Prerequisite: 110, 111, or programming experience. EECS 328-0 Numerical Methods for Engineers Introduction to numerical methods; numerical differentiation, numerical integration, solution of ordinary and partial differential equations. Writing programs in FORTRAN, C, or Pascal using methods presented in class. Prerequisites: GEN ENG 205-1,2,3; MATH 220, 224, 230. EECS 329-0 Art of Multicore Concurrent Programming Concurrency disciplines and practical programming techniques for multicore processors; synchronization primitives, mutual exclusion, foundation of shared memory, lockings, nonblocking synchronizations, and transactional memory. EECS 330-0 Human-Computer Interaction Introduction to human-computer interaction and design of systems that work for people and their organizations. Understanding the manner in which humans interact with and use computers for productive work. Prerequisite: programming experience. "
130,Northwestern,EECS 331-0 Introduction to Computational Photography ,"Fundamentals of digital imaging and modern camera architectures. Hands-on experience acquiring, characterizing, and manipulating data captured using a modern camera platform. EECS 332-0 Introduction to Computer Vision Computer and biological vision systems, image formation, edge detection, image segmentation, texture, representation and analysis of two-dimensional geometric structures and of three-dimensional structures. Prerequisites: 214; IEMS 202; MATH 240. EECS 333-0 Introduction to Communication Networks Data communication basics. Telephone, cellular, cable, and computer networks. Layered network architectures, models, and protocols. Switching, routing, flow control, and congestion control. Medium access control, ARQ, and local area networks. Queuing models and network performance analysis. Prerequisite: 302; IEMS 202; MATH 320-1,2,3; or equivalent basic probability theory. "
131,Northwestern,EECS 335-0 Introduction to the Theory of Computation ,"Mathematical foundations of computation, including computability, relationships of time and space, and the P vs. NP problem. Prerequisite: 212 or consent of instructor. EECS 336-0 Design and Analysis of Algorithms Analysis techniques: solving recurrence equations. Algorithm design techniques: divide and conquer, the greedy method, backtracking, branch-and-bound, and dynamic programming. Sorting and selection algorithms, order statistics, heaps, and priority queues. Prerequisite: 111, 212, or consent of instructor. EECS 337-0 Natural Language Processing Semantics-oriented introduction to natural language processing, broadly construed. Representation of meaning and knowledge inference in story understanding, script/frame theory, plans and plan recognition, counterplanning, and thematic structures. Prerequisite: 348 or consent of instructor. "
132,Northwestern,EECS 338-0 Practicum in Intelligent Information Systems ,"A practical excursion into building intelligent information systems. Students develop a working program in information access, management, capture, or retrieval. Project definition, data collection, technology selection, implementation, and project management. EECS 339-0 Introduction to Database Systems Data models and database design. Modeling the real world: structures, constraints, and operations. The entity relationship to data modeling (including network hierarchical and object-oriented), emphasis on the relational model. Use of existing database systems for the implementation of information systems. Prerequisite: 214. EECS 340-0 Introduction to Networking A top-down exploration of networking using the five-layer model and "
133,Northwestern,EECS 347-2 Microprocessor System Projects II ,"Designing, prototyping, and testing individual projects involving microprocessors and related devices, such as PAL/FPGA and special-purpose ICs. Embedded-system tools such as special-purpose compilers and ICE (in-circuit emulation). Manufacturing issues such as PCB layout. Survey of microprocessor platforms. Prerequisite: 347-1. EECS 348-0 Introduction to Artificial Intelligence Core techniques and applications of AI. Representing, retrieving, and applying knowledge for problem solving. Hypothesis exploration. Theorem proving. Vision and neural networks. EECS 349-0 Machine Learning Study of algorithms that improve through experience. Topics typically include Bayesian learning, decision trees, genetic algorithms, neural networks, Markov models, and reinforcement learning. Assignments include programming projects and written work. Prerequisite: 348. "
134,Northwestern,EECS 352-0 Machine Perception of Music and Audio ,"Machine extraction of musical structure in audio and MIDI and score files, covering areas such as source separation and perceptual mapping of audio to machine-quantifiable measures. Prerequisite: 211, 231, GEN ENG 205-2, or prior programming experience in MATLAB. EECS 353-0 Digital Microelectronics Logic families, comparators, A/D and D/A converters, combinational systems, sequential systems, solid-state memory, large-scale integrated circuits, and design of electronic systems. Prerequisites: 203, 225. EECS 354-0 Network Penetration and Security Practical tools for vulnerability assessment and defense of computer and communication systems. Prerequisites: 213 or 205; 231; 333 or 340. EECS 355-0 Introduction to FPGA Design Overview of computer-aided design tool flow for ASIC and FPGA design. Synthesis from hardware description languages and creation of finite-state machines. Differences between FPGA and ASIC design flows. Exploration of concepts in several projects. Prerequisite: 303. "
135,Northwestern,"EECS 359-0 Digital Signal Processing Discrete-time signals and systems. Discrete-time Fourier transform, z-transform, discrete Fourier transform, digital filters. Prerequisite: 222. EECS 360-0 Introduction to Feedback Systems Linear feed  back control systems, their physical behavior, dynamical analysis, and stability. Laplace transform, frequency spectrum, and root locus methods. System design and compensation using PID and lead-lag controllers. Digital implementations of analog controllers. Not to be taken for credit with or after MECH ENG 391. Prerequisite: 222. EECS 361-0 Computer Architecture Design and understanding of the computer system as a whole unit. Performance evaluation and its role in computer system design; instruction set architecture design, datapath design and optimizations (e.g., ALU); control design; single cycle, multiple cycle, and pipeline implementations of processor. Hazard detection and forwarding; memory hierarchy design; cache memories, virtual memory, peripheral devices, and I/O. Prerequisites: 205, 303. EECS 362-0 Computer Architecture Project Quarter-long team project designing a processor for a complete instruction set. Involves ISA design, design of components, datapath, and control for a pipelined processor to implement the ISA. Use of industrial-strength design tools and VHDL as the design specification language. Designs are evaluated using benchmark programs for correctness and performance. Prerequisite: 361. EECS 363-0 Digital Filtering Recursive and nonrecursive digital filters, decimation and interpolation, A/D and D/A conversion as digital filtering problems. Implementation of nonrecursive filters via FFT, quantization problems (e.g., companding and limit cycles). Prerequisite: 359. EECS 366-0 Designing and Constructing Models Introduction to the design and evaluation of embedded systems, with emphasis on their system-level aspects. ","EECS 368-0 Programming Massively Parallel Processors with CUDA GPU architecture, CUDA programming model, parallel programming optimizations for 1000+ cores, performance analysis, OpenCL. Requires two-week mini-project on optimized histogramming on GPUs. May not receive credit for both 368 and 468. Prerequisites: 213; 211, 230, or intermediate C programming experience; or consent of instructor. EECS 369-0 Introduction to Sensor Networks Basic hardware and software platforms for sensor networks. Various algorithmic techniques for data routing, query processing, and tracking. Prerequisite: 343 or 340. EECS 370-0 Computer Game Design Plot, narrative, and character simulation for creating game worlds; artificial intelligence for synthetic characters; tuning gameplay. Substantial programming and project work. Prerequisites: 214; 1 unit of 322, 343, 348, or 351. "
136,Northwestern,EECS 371-0 Knowledge Representation and Reasoning ,"Principles and practices of knowledge representation, including logics, ontologies, common-sense knowledge, and semantic web technologies. Prerequisite: 348, 325, or equivalent experience with artificial intelligence. "
137,Northwestern,EECS 386-0 Computational Electromagnetics and Photonics ,Introduction to the finite-difference time-domain (FDTD) method in numerical modeling of electromagnetic and optical wave interactions with engineering structures. Finite differences; Maxwell’s equations; numerical dispersion and stability; free-space and waveguide field sources; absorbing boundary conditions; material dispersions and nonlinearities; modeling examples in modern electromagnetic and optical engineering. Prerequisite: 308. 
138,Northwestern,EECS 389-0 Superconductivity and Its Applications ,"Properties of materials in the superconducting state; charge flow dynamics of type II superconductors; high-Tc superconductors; applications for computers and high-frequency devices. Prerequisite: 381 or consent of instructor. EECS 390-0 Introduction to Robotics Homogeneous vectors and planes; homogeneous transformation, position and orientation transformations, kinematics and inverse kinematic solutions of robot manipulators; Jacobian and inverse Jacobian relation; robot trajectory and task planning; dynamic formulation and computation of robot manipulators; robot programming and control systems. Prerequisite: 230. EECS 391-0 CMOS VLSI Circuit Design Design of modern CMOS very large–scale integrated (VLSI) circuits. EECS 392-0 VLSI Systems Design Projects Design of a cutting-edge VLSI chip. Teams of 5 to 10 students undertake a large circuit design problem, going from specification to VLSI implementation while optimizing for speed, area, and/or power. Group collaboration and engineering design. Prerequisite: 391. "
139,Northwestern,EECS 394-0 Software Project Management and Development ,"Software development methodologies. Object-oriented analysis and design, CASE tools, software life cycle. Project management tools, programming teams. Executable specifications, automatic test generation. Prerequisite: 343 or equivalent programming experience. "
140,Northwestern,"IEMS 210-0 Methods, Standards, and Work Design ","Introduction to traditional topics in industrial engineering, including time study, work measurement, standards, and design. Enables industrial engineering students to understand and assume traditional industrial engineering roles upon graduation. Prerequisite: knowledge of probability and statistics. IEMS 225-0 Principles of Entrepreneurship Introduction to essential elements of building one’s own business, from brainstorming ideas and assessing opportunities to pitching a business idea. History of entrepreneurship and the entrepreneurial psyche. Business plan fundamentals, including strategy, finance, accounting, marketing, operations, and choosing the ideal management team. Taught with ENTREP 225; may not receive credit for both courses. May not be taken after 325. "
141,Northwestern,IEMS 295-0 Introductory Topics in Industrial Engineering ,"Topics suggested by students or faculty members and approved by the department; taught at an intermediate level. IEMS 303-0 Statistics Introduction to the foundations of statistics and statistical computing for data analysis and their applications. Descriptive statistics and statistical inference for estimation, testing, and prediction. May not receive credit for both 303 and any of 201, STAT 210, BMD ENG 220, or CHEM ENG 312. May not be taken for credit with or after STAT 320-1. Prerequisite: 202 or equivalent; EECS 111 recommended. IEMS 304-0 Statistical Learning for Data Analysis Predictive modeling of data using modern regression and classification methods. Multiple linear regression; logistic regression; pitfalls and diagnostics; nonparametric and nonlinear regression and classification such as trees, nearest neighbors, neural networks, and ensemble methods. Prerequisites: 303 and EECS 111 or equivalents. "
142,Northwestern,IEMS 305-0 Statistical Methods for Quality Improvement ,"Methods for controlling and improving industrial processes. Control charts; process capability; gage repeatability and reproducibility. Multifactor experiments; screening experiments; robust design. Homework, labs, and project. Prerequisite: 201, 303, or equivalent. IEMS 306-0 Decision Analysis Theory and practice of analyzing decisions in the public and private sectors. Multiple objectives; influence diagrams; decision trees; sensitivity analysis; probability assessment; utility; human biases. Problems, cases, and projects. Prerequisite: 202 or equivalent. "
143,Northwestern,IEMS 307-0 Quality Improvement by Experimental Design ,"Methods for designing and analyzing industrial experiments. Blocking; randomization; multiple regression; factorial and fractional factorial experiments; response surface methodology; Taguchi’s robust design; split plot experimentation. Homework, labs, and project. Prerequisite: 201, 303, or equivalent. IEMS 310-0 Operations Research Survey of operations research techniques. Linear programming, decision theory, stochastic processes, game theory. May not be taken for credit with or after 313. Prerequisites: 201 or 202; GEN ENG 205-1 or MATH 240. IEMS 313-0 Foundations of Optimization Formulation and solution of applicable optimization models, including linear, integer, nonlinear, and network problems. Efficient algorithmic methods and use of computer modeling languages and systems. Homework, exams, and project. Prerequisites: EECS 111; GEN ENG 205-1; MATH 230; sophomore standing. IEMS 315-0 Stochastic Models Fundamental concepts of probability theory; modeling and analysis of systems having random dynamics, particularly queueing systems. Prerequisites: 202 and concurrent enrollment in 303; GEN ENG 205-1. IEMS 317-0 Discrete-Event Systems Simulation Computer simulation of discrete-change systems subject to uncertainty. Choice of input distributions; development of models; design and analysis of simulation experiments. Miniprojects, exams, and computer labs. Prerequisites: 303; 310 or 315. IEMS 325-0 Engineering Entrepreneurship Overview of the entrepreneurial process from an engineering perspective. Idea generation, planning, financing, marketing, protecting, staffing, leading, growing, and harvesting. Students write startup business plans. Lectures, guest speakers, and case studies. Taught with ENTREP 325; may not receive credit for both courses. Prerequisite: 1 course in accounting or finance such as CIV ENV 205 or BUS INST 260. IEMS 340-0 Field Project Methods Use of field research methods to solve management problems. Assignments focus on individual student projects. Students define projects, design field studies and pilot tests of data collection instruments, and present results. Prerequisite: consent of instructor for students who are not degree candidates. IEMS 341-0 Social Network Analysis The use of social network analysis to understand the growing connectivity and complexity in the world around us on different scales, ranging from small groups to the World Wide Web. How we create social, economic, and technological networks, and how they enable and constrain attitudes and behaviors. IEMS 342-0 Organizational Behavior Manager’s view of tools available to recruit, develop, appraise, compensate, organize, and lead a team going through change. Application of psychological principles relating to human dynamics, motivation, teams, power, and organizational culture. "
144,Northwestern,IEMS 382-0 Production Planning and Scheduling ,"Applications of operations research methods to practical problems of production planning and inventory control. Forecasting; aggregate planning; deterministic and stochastic inventory models; MRP; JIT; variability; scheduling in production and service systems. Case studies, homework, and exams. Prerequisites: 202; 310 or 313. IEMS 383-0 Service Operations Management Exploration of service industries: cost-reduction and service-enhancement models, location planning, workforce scheduling, yield management, queuing analysis, and call-center management. Prerequisites: 313, 315. "
