,School,CourseID,Descriptions
29,Northwestern,ECON 337-0 Economics of State and Local Governments ,"Economic functions and financing of state and local governments in theory and practice; costs and demands for local public services; role of government finance in urban and regional growth. Prerequisites: 281, 310-1,2. ECON 339-0 Labor Economics Survey of economic problems growing out of employment relationships; theories and processes of wage and employment determination, income distribution, and the role of trade unions and issues of economic security. Prerequisites: 281, 310-1,2, 311. ECON 340-0 Economics of the Family Application of microeconomic theory to the analysis of family issues: marriage, cohabitation, the decision to have children, divorce, credit and insurance, and legacies. Prerequisites: 281, 310-1,2. ECON 341-0 Economics of Education The economic analysis of education, including return to schooling, education and economic growth, education production functions, school financing, vouchers, charter schools, and accountability. Prerequisites: 281, 310-1,2. ECON 342-0 Economics of Gender Analysis of gender differences in employment, earnings, and division of household labor. Family, labor market, discrimination, segregation, historical and international conditions, and antidiscrimination legislation. Prerequisites: 281, 310-1, 311. ECON 349-0 Industrial Economics Price and efficiency performance of American industries representative of various types of market structures and practices. Prerequisites: 281, 310-1,2. Students may not receive credit for completing 249 after completing 349. "
30,Northwestern,"ECON 350-0 Monopoly, Competition, and Public Policy ","Present public policy and unsettled issues with respect to structure and practices of industrial markets; concentration, vertical integration, and forms and effectiveness of competition. Prerequisites: 281, 310-1,2. ECON 351-0 Law and Economics The impact of judicial decisions and statutory enactments—including corporate law and antitrust and regulation statutes—on economic behavior and markets. Prerequisites: 281, 310-1,2. "
31,Northwestern,ECON 354-0 Issues in Urban and Regional Economics ,"Factors affecting the spatial distribution of economic activity. Applications of economic analysis to problems of urban areas such as housing markets, zoning restrictions, and racial patterns of employment and housing. Prerequisites: 281, 310-1,2. "
32,Northwestern,ECON 355-0 Transportation Economics and Public Policy ,"The demand for alternative modes by passengers and shippers. Cost of providing transportation, competition, regulation, optimal pricing, subsidies, congestion pricing, and urban transit. Prerequisites: 281, 310-1,2. ECON 359-0 Economics of Nonprofit Organizations The economic rationale for the nonprofit sector in a mixed economy. Topics include the objectives and behavior of nonprofit organizations, competition with commercial firms, volunteerism, and charitable donation. Prerequisites: 281, 310-1,2. ECON 360-1 Foundations of Corporate Finance Theory How corporations allocate resources over time as facilitated by capital markets. Theory of asset evaluation, economic analysis of uncertainty, and capital budgeting and capital structure decisions. May not receive credit for both 360 and BUS INST 304 or IEMS 326. Not for students who have previously taken KELLG FE 310. Prerequisites: 281, 310-1, 311. ECON 360-2 Investments The range of financial instruments available to investors. Optimal portfolio strategies in bonds and stocks from the perspectives of individual and institutional investors. Prerequisite: 360-1. Not for students who have taken KELLG FE 312. ECON 361-0 International Trade International and interregional trade. Factors influencing trade in goods and services between areas. Reasons for and effects of impediments to trade, such as transport costs, tariffs, quotas, and voluntary export restrictions. Prerequisites: 281, 310-1,2, 311. ECON 362-0 International Finance Determination of exchange rates, balance of payments, and international asset flows and prices; international transmission of macroeconomic disturbances. Prerequisites: 281, 310-1, 311. "
33,Northwestern,ECON 370-0 Environmental and Natural Resource Economics ,"Externalities and the role of property rights, pollution, waste disposal, common property problems, renewable resource management, nonrenewable resource use and depletion, recyclable resources, water allocation, and management of public lands. Prerequisites: 281, 310-1,2. May not receive credit for both this course and 372 or 373. ECON 371-0 Economics of Energy Analysis of the functioning and regulation of electricity, oil, and natural gas markets. Includes discussion of competition and environmental concerns. Prerequisites: 281; 310-1,2 ECON 372-0 Environmental Economics Analysis of scarcity and incentives in environmental issues such as pollution and climate change. Modeling and evaluation of public policy. Prerequisites: 281; 310-1,2. May not receive credit for both this course and 370. ECON 373-0 Natural Resource Economics Evaluation of economics models and public policy concerning natural resources such as farming, fisheries, forests, minerals, and fossil fuels. Prerequisites: 281; 310-1,2. May not receive credit for both this course and 370. ECON 380-1,2 Game Theory 1. Noncooperative game theory, with applications to industrial organization, auctions, and theories of the firm. Prerequisites: 310-1,2; MATH 224, 230. Should not be taken by students who have completed MATH 364. 2. Cooperative and noncooperative game theory and decision making under uncertainty. Prerequisite: 380-1 or consent of instructor. ECON 381-1,2 Econometrics 1. Probability and distribution theory, statistical inference, simple and multiple regression, specification error and multicollinearity, heteroskedasticity and serial correlation, measurement error, dummy variables. Prerequisites: 310-1 (281, 310-2, 311 recommended); MATH 230, 234, 240, and 314 (or equivalent). 2. Hypothesis testing, estimation with deficient data, distributed lags, panel data, simultaneous equation systems, limited dependent variables. Prerequisite: 381-1 (310-2, 311 recommended). "
34,Northwestern,HUM 101-6 First-Year Humanities Seminar HUM 102-6 First-Year Humanities Seminar HUM 210-0 Humanities in the World 1 HUM 211-0 Humanities in the World 2 ,"Other Courses HUM 105-0 The Humanities Plunge (.5 units) A half-credit course over spring break immersing students in Chicago’s cultural riches. Events and tours are introduced and contextualized by field experts. HUM 205-0 The World of Homer Introduction to the history and material culture of Iron Age Greece. Society, economy, art, and archaeology of the Greek world that gave rise to the Homeric epic. Taught with CLASSICS 210; may not receive credit for both courses. HUM 220-0 Health, Biomedicine, Culture, and Society Broad introduction to controversies surrounding health and biomedicine by analyzing culture, politics, values, and social institutions. Taught with SOCIOL 220; may not receive credit for both courses. HUM 225-0 Media Theory Comprehensive introduction from a humanistic perspective to theories about the nature of media and the role of technology in modern culture. Taught with ART HIST 375; may not receive credit for both courses. HUM 260-0 Humanities Explorations Lecture course, often team-taught, that explores social, ethical, and political big questions—e.g., the nature of love, the value of reading, relativity in science and culture, ways to model “choice” across the humanities—from different disciplinary perspectives. May be repeated for credit with change of topic. HUM 310-3,4,5,6 Global Humanities Lab Investigation of an international humanities topic through experiential learning and offsite research; focus on how different cultures process and understand the artifacts of human cultures and their values. Course number indicates distribution requirement area in which a course counts. May be repeated for credit with change of topic. HUM 325-3,4,5,6 Humanities in the Digital Age Innovative and collaborative ways to incorporate technology into humanistic study. Ways to digitize text, image, sound, and/ or video for analysis. Course number indicates distribution requirement area in which a course counts. May be repeated for credit with change of topic. HUM 370-3,4,5,6 Special Topics in the Humanities Intensive seminars in cutting-edge research on interdisciplinary issues. Course number indicates distribution requirement area in which a course counts. May be repeated for credit with change in topic. HUM 395-0 Humanities Seminar Interdisciplinary course offered by a changing roster of humanities faculty. Topics have included cities as modern utopia/dystopia in Europe, Asia, and America; the afterlife of Marxism; the politics of reputation; being animal, being human. "
35,Northwestern,LING 334-0 Introduction to Computational Linguistics ,"Hands-on introduction to computational methods in empirical linguistic analysis and natural language processing. LING 336-0 Words, Networks, and the Internet Word networks and language on the Internet. Python tools for exploring spam, search engines, and social media. Prerequisite: 330, 334, 361, or equivalent background. LING 340-0 Historical Linguistics Introduction to the study of how and why language changes. Topics include the comparative method, the regularity of sound change, syntactic change, distant genetic relationships, and language evolution. LING 341-0 Language Typology A comparison of varying and universal features of the world’s languages. Prerequisite: 250, 260, or 270. LING 342-0 Structure of Various Languages Phonological, morphological, or syntactic structure of a particular language. May be repeated for credit with change in language. "
36,Northwestern,LING 350-0 Fundamentals of Laboratory Phonology ,"Articulatory and acoustic phonetics. Syllable structure, phonotactics, prosody, and intonation. Fundamentals of experimental design and data analysis. Prerequisite: 250 or consent of instructor. "
37,Northwestern,LING 363-0 Making a Dictionary:The Northwestern Project ,"Creation of an online dictionary of Northwestern jargon, slang, etc. Learning about the connection between language, society, and identity; sociolinguistic fieldwork; lexicography; politics of dictionaries; culture and power of book form vs. digital. Taught with SLAVIC 322; may not receive credit for both courses. LING 370-0 Fundamentals of Meaning Theoretical approaches to the study of linguistic meaning. Topics include word meaning, argument and event structure, sentence meaning, truth conditions, and inference types (e.g., entailment, implicature, presupposition). Prerequisite: 270 or consent of instructor. LING 371-0 Reference Linguistic and philosophical approaches to the study of reference, focusing on the role of context in utterance production and interpretation. Topics include definiteness, genericity, deixis, and anaphora. Prerequisite: a course in linguistics or philosophy of language, or consent of instructor. LING 372-0 Pragmatics Introduction to extrasemantic meaning, focusing on the role of context in utterance production and interpretation. Topics include the semantics-pragmatics boundary, implicature, presupposition, speech acts, reference, and information structure. Prerequisite: 250, 260, or 270. LING 373-0 Implicature An interdisciplinary approach to the study of extrasemantic meaning, drawing on primary readings from linguistics, philosophy, and psychology. Topics include conversational and conventional implicature, explicature, impliciture, and the semantics-pragmatics boundary. Prerequisite: 370, 372, or consent of instructor. "
38,Northwestern,LING 380-0 Spoken English for Nonnative Speakers ,Conversational English addressing all oral language skills; primarily for international graduate students who are nonnative speakers of English. Content varies. 
39,Northwestern,LING 381-0 Written English for Nonnative Speakers ,"Written argumentation skills and all aspects of academic writing; primarily for international graduate students who are nonnative speakers of English. LING 398-0 Undergraduate Seminar in Linguistics By invitation of the department. For students of superior ability, with choice of topic left to the group. "
40,Northwestern,"MMSS 311-1,2 Quantitative Social Science for MMSS: Second Year 1. Advanced microeconomic theory. ","2. Advanced formal models in social science disciplines other than economics. MATH 385-0 Probability Theory for MMSS See Mathematics. MATH 386-1,2 Econometrics for MMSS See Mathematics. MMSS 398-1,2,3 Senior Thesis Seminar "
41,Northwestern,MATH 220-0 Differential Calculus of One-Variable Functions ,"Limits, differentiation, linear approximation, optimization, curve sketching, related rates, Newton’s method, anti-derivatives. May not receive credit for both 220 and 211 or 212. "
42,Northwestern,MATH 224-0 Integral Calculus of One-Variable Functions ,"Integrals, techniques of integration, volumes, arc length, work, sequences and series, Taylor polynomials. May not receive credit for both 224 and 213 or 214. Prerequisite: "
43,Northwestern,MATH 230-0 Differential Calculus of Multivariable Functions ,"Vector algebra, vector functions, partial derivatives, optimization, Lagrange multipliers. May not receive credit for both 230 and 281-1, 285-2, 290-2, or 291-2. Prerequisite: 214 or 224. "
44,Northwestern,MATH 234-0 Multiple Integration and Vector Calculus ,"Cylindrical and spherical coordinates, double and triple integrals, line and surface integrals. Change of variables in multiple integrals; gradient, divergence, and curl. Theorems of Green, Gauss, and Stokes. May not receive credit for both 234 and 281-1, 285-3, 290-3, or 291-3. Prerequisite: 230. MATH 240-0 Linear Algebra Basic concepts of linear algebra. Solutions of systems of linear equations; vectors and matrices; subspaces, linear independence, and bases; determinants; eigenvalues and eigenvectors; other topics and applications as time permits. May not receive credit for both 240 and 281-3, 285-1, 290-1, 291-1, or GEN ENG 205-1, 206-1. Prerequisite: 230. MATH 250-0 Elementary Differential Equations Applications of calculus and linear algebra to the solution of ordinary differential equations. May not receive credit for both 250, 281-2, or GEN ENG 205-4, 206-4. Prerequisites: 230; 240 or concurrent registration in 240; or equivalent. "
45,Northwestern,"MATH 281-1,2,3 Accelerated Mathematics for ISP: First Year ","1. Multivariable differential calculus, multiple integration and vector calculus. 2. Vector integral calculus, differential equations, infinite series. 3. Linear algebra, differential equations. Open only to students in ISP. "
46,Northwestern,"MATH 285-1,2,3 Accelerated Mathematics for MMSS: First Year 1. Linear algebra. 2. Continuation of linear algebra; multivariable differential calculus. 3. Multivariable integral calculus. Prerequisite: first-year standing in MMSS. ","MATH 290-1,2,3 MENU: Linear Algebra and Multivariable Calculus 1. Linear algebra in Euclidean space. 2. Continuation of linear algebra. Multivariable differential calculus. "
47,Northwestern,"MATH 290-1,2,3 MENU: Linear Algebra and Multivariable Calculus 1. Linear algebra in Euclidean space. 2. Continuation of linear algebra. Multivariable differential calculus. ",3. Multivariable integral calculus. Vector analysis. May not receive credit for both 240 and 290-1; 230 and 290-2; or 234 and 290-3. Prerequisites: one year of calculus (usually in high school) and consent of the department. 
48,Northwestern,MATH 306-0 Combinatorics and Discrete Mathematics ,"Discrete mathematics, inductive reasoning, counting problems, binomial coefficients and Pascal’s triangle, Fibonacci numbers, combinatorial probability, divisibility and primes, partitions, and generating functions. Prerequisite: 240 or instructor’s consent. MATH 308-0 Graph Theory Introduction to graph theory: graphs, trees, matchings, planar graphs, colorings. Additional topics as time permits. Prerequisites: 291-1, 300, 306, or equivalent. "
49,Northwestern,"MATH 310-1,2,3 Probability and Stochastic Processes ","1. Discrete probability spaces, random variables, expected value, combinatorial problems. Special distributions, independence, and conditional probability. Weak law and central limit theorem. 2. Convolution, central limit theorem, Markov processes in discrete time, recurrence, and transience. 3. Markov processes in continuous time, stationary process, second-order process, stochastic differential equations. May not receive credit for both 310-1 and 3111, 314, 385, EECS 302, IEMS 202, or STAT 320-1, 383. Corequisite for 310-1: 234. Prerequisites for 310-2: 240, 310-1. Prerequisite for 310-3: 310-2. "
50,Northwestern,MATH 314-0 Probability and Statistics for Econometrics ,"Introduction to probability theory and statistical methods, including properties of probability distributions, sampling distributions, estimation, confidence intervals, and hypothesis testing. May not receive credit for both 314 and 310-1, 311-1, 385, EECS 302, IEMS 202, or STAT 320-1, 383. Corequisite: 234. "
51,Northwestern,"MATH 336-1,2 Introduction to the Theory of Numbers ","1. Divisibility and primes, congruences, quadratic reciprocity, Diophantine problems. 2. Additional topics in analytic and algebraic number theory. Prerequisite: for 336-1: 230; for 336-2: 336-1. MATH 340-0 Geometry Axiomatics for Euclidean geometry. Non-Euclidean geometry. Projective geometry. Introduction of coordinate system from the axioms. Quadrics. Erlangen program. Introduction to plane algebraic curves. Prerequisite: 230 and 300 or equivalent. MATH 342-0 Introduction to Differential Geometry Curves and surfaces in three-dimensional space. Prerequisites: 234 and 240 or equivalent. MATH 344-1,2 Introduction to Topology 1. Basic concepts: topologies, connectedness, compactness, separation axioms. Geometric concepts, including simplicial complexes and manifolds. 2. Fundamental groups. Language of categories. Covering spaces. Prerequisite for 344-1: 320-1 or equivalent; for 344-2: 344-1 and 330-1 or equivalent. "
52,Northwestern,MATH 351-0 Fourier Analysis and Boundary Value Problems ,Expansion in orthogonal functions with emphasis on Fourier series. Applications to solution of partial differential equations arising in physics and engineering. May not receive credit for both 351 and 381 or both 351 and ESAM 311-2. Prerequisite: 250. 
53,Northwestern,"MATH 353-0 The Qualitative Theory of Differential Equations Qualitative theory of ordinary differential equations. Linear systems, phase portraits, periodic solutions, stability theory, Lyapunov functions, chaotic differential equations. Prerequisites: 240 and 250 or equivalent. MATH 354-1,2 Chaotic Dynamical Systems 1. Chaotic phenomena in deterministic discrete dynamical systems, primarily through iteration of functions of one variable. ","2. Iteration of functions of two and more variables, including the study of the horseshoe map, attractors, and the Henon map. Complex analytic dynamics, including the study of the Julia set and Mandelbrot set. Prerequisite: 240. MATH 360-1,2 MENU:Applied Analysis 1. Linear ordinary differential equations and their applications. 2. Systems of linear ordinary differential equations, qualitative analysis of ordinary differential equations, linear partial differential equations, Laplace transform, Fourier series, orthogonal functions, and applications. Prerequisite: 290-1,2,3 or 291-1,2,3. MATH 366-1 Mathematical Models in Finance Cash flow computations. Basic financial concepts (stocks, bonds, options, arbitrage, hedging) and put-call parity. Binomial tree models. Risk-neutral valuation. Random walk and Brownian motion as a tool of modeling fluctuations. Options pricing. Application of the central limit theorem. The Black-Scholes formula and partial differential equation. Numerical approximations. Prerequisites: 240 plus any 1 of 310-1, 311-1, 314, 385, IEMS 202, or ECON 381-1. Some acquaintance with basic differential equations is desirable but not required. MATH 368-0 Introduction to Optimization Methods and concepts of linear and nonlinear optimization theory, going beyond the treatment of optimization in calculus. Topics not usually covered in real analysis, including Kuhn-Tucker Theory, convexity conditions, and linear programming. Fulfills a prerequisite for the Kellogg managerial analytics certificate. Prerequisites: 285-3, 290-3, or 291-3; or both 240 and 300. MATH 370-0 Mathematical Logic Mathematical formulation and rigorous discussion of logical systems, particularly the propositional calculus and the functional calculi of first and second order. Well-formed formulae, formal languages, proofs, tautologies, effective procedures, deduction theorems, axiom schemata. Prerequisite: consent of instructor. "
54,Northwestern,MATH 382-0 Complex Analysis and Group Theory for ISP ,"Complex analysis, elements of group theory. May not receive credit for both 325 and 382. Ordinarily taken only by students in ISP; permission required otherwise. Prerequisites: 281-1,2,3; PHYSICS 125-1,2,3. MATH 385-0 Probability and Statistics for MMSS Probability theory and its social science applications. May not receive credit for both 385 and any of 310-1, 311-1, 314, or STAT 320-1, 383. Prerequisite: second-year standing in MMSS. MATH 386-1,2 Econometrics for MMSS Econometric methods. Prerequisite: second-year standing in MMSS. MATH 395-0 Undergraduate Seminar Topics of modern mathematics and relationships among different branches of mathematics. Open only to superior students by consent of department. May be taken for only 1 unit of credit at a time but may be repeated for credit with change of topic. MATH 399-0 Independent Study Open on approval of department to undergraduates who are qualified to do independent work under the direction of a faculty adviser. Students must file a plan of study with the department before enrollment in 399. "
55,Northwestern,"MENA 290-3,4,5,6 Introductory Topics in Middle East and North African Studies Content and prerequisites vary. Course number indicates distribution requirement area in which a course counts. May be repeated for credit with change of topic. ","MENA 301-1,2,3 Seminar in Middle East and North African Studies Interdisciplinary approaches to the study of the Middle East and North Africa. Content varies with annual theme. May be repeated for credit with a change in topic. Courses need not be taken in sequence. "
56,Northwestern,"MENA 301-1,2,3 Seminar in Middle East and North African Studies Interdisciplinary approaches to the study of the Middle East and North Africa. Content varies with annual theme. May be repeated for credit with a change in topic. Courses need not be taken in sequence. ","MENA 390-3,4,5,6 Advanced Topics in Middle East and North African Studies Content and prerequisites vary. Course number indicates distribution requirement area in which a course counts. May be repeated for credit with change of topic. MENA 399-0 Independent Study Reading and conferences on special subjects for advanced undergraduates. Prerequisite: consent of director of undergraduate studies and instructor. "
57,Northwestern,"MENA 390-3,4,5,6 Advanced Topics in Middle East and North African Studies Content and prerequisites vary. Course number indicates distribution requirement area in which a course counts. May be repeated for credit with change of topic. MENA 399-0 Independent Study Reading and conferences on special subjects for advanced undergraduates. Prerequisite: consent of director of undergraduate studies and instructor. ","Arabic Courses ARABIC 111-1,2,3 Arabic I Three-course introduction to modern standard Arabic primarily, along with some exposure to and familiarization with the main regional spoken varieties. Speaking, reading, listening comprehension, and basic writing skills developed. "
58,Northwestern,PHIL 253-0 Introduction to the Philosophy of Language ,"Contemporary themes and theories in the philosophy of language. Topics may include context and semantics, the semantics-pragmatics boundary, implicature, reference, presupposition, speech acts, and the role of language in shaping conceptions of social and natural reality. "
