,School,CourseID,Descriptions
2210,OregonUni,IARC 572. Interior Finishes and Design Application. 3 Credits. ,"The properties, manufacture, application, and code issues, and ecological considerations of interior finish materials. Field trips to supply sources. ARCH 570 "
2211,OregonUni,IARC 573. Working Drawings in Interior Architecture. 4 Credits. ,"Preparation of working drawings for a small, sustainable interior architecture design project. Prereq: ARCH 562, 584 or IARC 571, 572, 584. "
2212,OregonUni,IARC 584. Interior Design. 6 Credits. ,"Repeatable. A series of creative projects in interior design; intensive analysis of design; methods of problem solving; individual criticism, review of design projects; group discussion and field trips. Prereq: ARCH 681. "
2213,OregonUni,IARC 586. Furniture Design. 6 Credits. ,"Projects in design and construction of custom furniture, preparation of detailed shop drawings, shop procedure. Prereq: IARC 444/544; ARCH 484/584 or IARC 484/584. "
2214,OregonUni,IARC 587. Working Drawings. 6 Credits. ,"Focuses on the design of a small, sustainable interior architecture design project and the production of a set of working drawings. Prereq: ARCH 562, 584 or IARC 571, 572, 584; coreq: IARC 573. "
2215,OregonUni,IARC 588. Interior Design Comprehensive Project I. 8 Credits. ,Student-initiated studies in interior design for the terminal project. Emphasis on comprehensive and integrative study. Prereq: 36 credits in IARC design studios. 
2216,OregonUni,IARC 592. Electric Lighting. 3 Credits. ,"Principles of lighting with focus on integration of electric illumination and space. Design for lighting, calculations, and available systems and sources tested through models and drawings. Prereq: ARCH 484/584 or IARC 484/584; ARCH 492/592. "
2217,OregonUni,LA 227. Introduction to Landscape Architecture. 2 Credits. ,"Exploring the background and scope of the profession: its history, ethics, goals, skills, topics, achievements, and evolving challenges in making healthy, functional, and beautiful places. "
2218,OregonUni,LA 289. Landscape Architectural Design. 6 Credits. ,"Study of places, their use, and how they evolve. Fundamentals of environmental awareness, social factors, and small-scale site design; abstract design and elementary graphic techniques. Repeatable. "
2219,OregonUni,LA 326. Plants: Fall. 4 Credits. ,"Characteristics, identification, and design uses of deciduous trees, shrubs, vines, and ground covers. Emphasis on identification and appropriate use in landscape design. "
2220,OregonUni,LA 328. Spring Plants. 4 Credits. ,"Focuses on flowering plants, their identification, design use, and ecosystem services they provide. Plant identification focuses on flowering trees and shrubs, groundcovers and perennials, with the intention of understanding how flowering plants may be used in design to support both human needs and ecosystem functions. "
2221,OregonUni,LA 337. Landscape Field Work: [Topic]. 1-4 Credits. ,"Direct examination and appraisal of the function, form, content, and composition of example landscapes in relation to ecological, cultural, legal, technical, aesthetic, and economic objectives. Repeatable twice for maximum of 12 credits. "
2222,OregonUni,LA 350. Landscape Media. 2-4 Credits. ,"Development of freehand drawing and visualization skills; exercises on line, tone, texture, and color for plan, section, and perspective drawings. Repeatable. "
2223,OregonUni,LA 352. Digital Landscape Media. 2-4 Credits. ,"Introductory survey and skill development in a range of basic computer graphic tools used in landscape architecture. Includes image processing, computer drawing, modeling, and drafting. Repeatable once for maximum of 8 credits. Prereq: LA 350. "
2224,OregonUni,LA 362. Landscape Technologies I. 4 Credits. ,"Develops understanding of contours, contour manipulation, and site engineering methodologies in the design of places; fundamentals of inclusive design, stormwater management, earthwork, and design development. "
2225,OregonUni,LA 366. Landscape Technologies II. 4 Credits. ,Consideration of aesthetic and engineering properties of materials and processes of landscape construction; communication of design intent through documentation including sources and costs. Prereq: LA 362. 
2226,OregonUni,LA 390. Urban Farm. 2-4 Credits. ,Experimentation with food production in the city; rebuilding urban soils; farm animal-plant relationships; nutrient cycles. Cooperative food production and distribution; use of appropriate technologies. Repeatable. 
2227,OregonUni,LA 409. Practicum: [Topic]. 1-21 Credits. ,Supervised field laboratory work; clinical or in-service educational experience. Planned programs of activities and study with assured provisions for adequate supervision. Repeatable. 
2228,OregonUni,LA 413. Analyzing Landscape Systems. 4 Credits. ,Develops skills for collecting data and understanding how landscapes function in space and time to inform good decision-making in planning and design. Prereq: one course in geography or biology or environmental studies. 
2229,OregonUni,LA 415. Computers in Landscape Architecture. 4 Credits. ,"Repeatable. Development, application, and evaluation of computer systems for land use and site planning (e.g., geographic information systems); encoding of data, cell storage, and analysis systems. "
2230,OregonUni,LA 423. Drawing The Landscape. 4 Credits. ,"Exploration of the varied ways to represent and understand the form, cultural meaning, social content, history, natural dynamics, regional context, spiritual intentions, and technical functions of urban and rural landscapes. "
2231,OregonUni,LA 433. Japanese Garden. 4 Credits. ,"Explores the art, form, meaning, and experience of Japanese gardens. Special emphasis on their heartland in the valley of Nara and Kyoto. "
2232,OregonUni,LA 439. Landscape Architectural Design and Process. 6 Credits. ,"Intermediate problems in landscape architecture design. Relations among problem concepts, goals, design theory, communication media, and technical analysis. Repeatable four times for a total of 30 credits. Prereq: LA 289. "
2233,OregonUni,LA 440. Introduction to Landscape Planning Analysis. 4 Credits. ,"Principles of designing land- and waterscapes for human use and settlement. Ecological, social, and economic analyses of landscapes, resources, and patterns of occupancy in the Eugene-Springfield area. Prereq: LA 413. "
2234,OregonUni,LA 441. Principles of Applied Ecology. 2-6 Credits. ,"Application of ecological concepts to landscape design, planning, and management. Emphasis on spatially explicit problem-solving over a range of spatial and temporal scales. Prereq: one course in ecology. "
2235,OregonUni,LA 459. Landscape Technology Topics. 2-4 Credits. ,"Intensive study of topics in landscape construction and maintenance. Topics include irrigation, lighting, special structures, water management, and road design. Repeatable thrice for maximum of 10 credits. "
2236,OregonUni,LA 462. Professional Practice of Landscape Architecture. 2 Credits. ,"Introduces students to key aspects of professional practice, fundamental professional skills, and professional career planning. Includes licensure, legal aspects of landscape architecture, career options, business management, and project management. "
2237,OregonUni,LA 474. History of Landscape Architecture I. 4 Credits. ,First in a sequence covering the history of landscape architecture. Explores the history and theory of the designed landscape from the beginnings of human settlement to the 19th century. 
2238,OregonUni,LA 484. Landscape Perception. 4 Credits. ,"Development of the human-environment relationship as it relates to landscape perception, landscape archetypes, and the development of a theoretical base for contemporary landscape design. "
2239,OregonUni,LA 489. Site Planning and Design. 6 Credits. ,"Advanced problems in landscape architecture, cultural determinants of site planning and design, design development and natural systems and processes as indicators of carrying capacity. Repeatable. Prereq: LA 362, LA 366, LA 439. "
2240,OregonUni,LA 494. Land Planning and Design. 6 Credits. ,"Problems in landscape architecture of increased cultural complexity. Land use planning, computer-aided ecological analysis of land, environmental impact, urban and new community design. Prereq: LA 489; fifth-year standing for undergraduates. "
2241,OregonUni,LA 513. Analyzing Landscape Systems. 4 Credits. ,Develops skills for collecting data and understanding how landscapes function in space and time to inform good decision-making in planning and design. 
2242,OregonUni,LA 515. Computers in Landscape Architecture. 4 Credits. ,"Development, application, and evaluation of computer systems for land use and site planning (e.g., geographic information systems); encoding of data, cell storage, and analysis systems. Repeatable. "
2243,OregonUni,LA 523. Drawing The Landscape. 4 Credits. ,"Exploration of the varied ways to represent and understand the form, cultural meaning, social content, history, natural dynamics, regional context, spiritual intentions, and technical functions of urban and rural landscapes. "
2244,OregonUni,LA 533. Japanese Garden. 4 Credits. ,"Explores the art, form, meaning, and experience of Japanese gardens. Special emphasis on their heartland in the valley of Nara and Kyoto. "
2245,OregonUni,LA 539. Landscape Architectural Design and Process. 6 Credits. ,"Intermediate problems in landscape architecture design. Relations among problem concepts, goals, design theory, communication media, and technical analysis. Repeatable four times for a total of 30 credits. "
2246,OregonUni,LA 540. Introduction to Landscape Planning Analysis. 4 Credits. ,"Principles of designing land- and waterscapes for human use and settlement. Ecological, social, and economic analyses of landscapes, resources, and patterns of occupancy in the Eugene-Springfield area. Prereq: LA 513. "
2247,OregonUni,LA 541. Principles of Applied Ecology. 2-6 Credits. ,"Application of ecological concepts to landscape design, planning, and management. Emphasis on spatially explicit problem-solving over a range of spatial and temporal scales. Prereq: one course in the natural sciences. "
2248,OregonUni,LA 559. Landscape Technology Topics. 2-4 Credits. ,"Intensive study of topics in landscape construction and maintenance. Topics include irrigation, lighting, special structures, water management, and road design. Repeatable thrice for maximum of 10 credits. "
2249,OregonUni,LA 562. Professional Practice of Landscape Archtecture. 2 Credits. ,"Introduces students to key aspects of professional practice, fundamental professional skills, and professional career planning. Includes licensure, legal aspects of landscape architecture, career options, business management, and project management. "
2250,OregonUni,LA 574. History of Landscape Architecture I. 4 Credits. ,First in a sequence covering the history of landscape architecture. Explores the history and theory of the designed landscape from the beginnings of human settlement to the 19th century. 
2251,OregonUni,LA 584. Landscape Perception. 4 Credits. ,"Development of the human-environment relationship as it relates to landscape perception, landscape archetypes, and the development of a theoretical base for contemporary landscape design. "
2252,OregonUni,LA 589. Site Planning and Design. 6 Credits. ,"Advanced problems in landscape architecture, cultural determinants of site planning and design, design development and natural systems and processes as indicators of carrying capacity. Repeatable. Prereq: LA 539. "
2253,OregonUni,LA 594. Land Planning and Design. 6 Credits. ,"Problems in landscape architecture of increased cultural complexity. Land-use planning, computer-aided ecological analysis of land, environmental impact, urban and new community design. Prereq: LA 489/589. "
2254,OregonUni,LA 609. Practicum: [Topic]. 1-16 Credits. ,Repeatable. Supervised field laboratory work; clinical or in-service educational experience. Planned programs of activities and study with assured provisions for adequate supervision. 
2255,OregonUni,LA 620. Landscape Research Methods I. 2-4 Credits. ,"Contemporary research issues and strategies. Theories, approaches, and techniques applicable to topics and problems in landscape architecture. Sequence with LA 621. "
2256,OregonUni,LA 621. Landscape Research Methods II. 2-4 Credits. ,"Contemporary research issues and strategies. Theories, approaches, and techniques applicable to topics and problems in landscape architecture. Sequence with LA 620. Prereq: LA 620. "
2257,OregonUni,LA 699. Master's Project. 2-10 Credits. ,Student-directed and executed performance and communication of original research or project work to demonstrate advanced mastery of landscape architecture. Repeatable. 
2258,OregonUni,PPPM 205 Introduction to City Planning Maintain 4 ,3.00 GPA for admission into PPPM major. PPPM majors must take core courses for letter grades and pass them with a C– or better. Apply to the PPPM major. Applications are due by Monday of the fifth week of spring term. 
2259,OregonUni,PPPM 201. Introduction to Public Policy. 4 Credits. ,"Overview of professional public service and the planning and management of public issues. Focuses on the goals of public services within their economic, social, and political contexts. "
2260,OregonUni,PPPM 202. Healthy Communities. 4 Credits. ,"Historical relationships of public policy, planning, and public health; how public policies can promote health; relationship of planning and policies to inequalities in health outcomes. "
2261,OregonUni,PPPM 205. Introduction to City Planning. 4 Credits. ,"Introduction to planning, using urban issues as lenses to explore transportation, housing, environment, and social equity as critical elements shaping where and how people live. "
2262,OregonUni,PPPM 280. Introduction to the Nonprofit Sector. 4 Credits. ,"Overview of the nonprofit sector includes its origin, growth, oversight, and varied elements. Examines theory and research into the effectiveness of nonprofit strategies and structures. "
2263,OregonUni,PPPM 325. Community Leadership and Change. 4 Credits. ,"Explores sustainable change at the community level by examining local systems and institutions: transportation, social influences, environment, housing, and the economy. "
2264,OregonUni,PPPM 327. Global Leadership and Change. 4 Credits. ,"Explores the role of leadership in global social, economic, and ecological sustainability. Considers population, consumption, technology, diversity, scale, nonviolent change, and community. "
2265,OregonUni,PPPM 340. Climate-Change Policy. 4 Credits. ,"Overview of climate-change policy; topics include cap and trade, carbon tax, fuel efficiency standards, biofuel standards, and renewable portfolio standards. "
2266,OregonUni,PPPM 404. Internship: [Topic]. 1-12 Credits. ,"Supervised work experience that offers students opportunities to explore and clarify career goals, apply academic learning, enhance and learn new skills, gain experience, and network with professionals. Repeatable. Prereq: PPPM 412. "
2267,OregonUni,PPPM 412. Internship and Professional Development. 1 Credit. ,"Introduction to the department’s internship program and career development. Includes overview of professionalism and effective communication, resume and cover letter writing, and interviewing and networking skills. "
2268,OregonUni,PPPM 415. Policy and Planning Analysis. 4 Credits. ,Applied problem-solving in the public policy and planning process. Examines the theoretical and methodological underpinnings of policy and planning analysis. Prereq: EC 201. 
2269,OregonUni,PPPM 418. Introduction to Public Law. 4 Credits. ,"Administrative law, including introduction to legal research, for public administrators. Administrative procedures, implementation of policy through administrative law, judicial review, and practical applications in public agencies. "
2270,OregonUni,PPPM 432. Justice and Urban Revitalization. 4 Credits. ,"Examines the political, economic, institutional and social forces that affect the long-term vitality of cities and communities and how those factors relate to community redevelopment. Emphasis is given on how to revitalize low-income multicultural communities. "
2271,OregonUni,PPPM 440. Land-Use Policy. 4 Credits. ,"Planning in urban, rural, and connecting environments. Functions, distribution, relationships of land uses; social, economic, fiscal, physical consequences of alternative land use development patterns. "
2272,OregonUni,PPPM 441. Growth Management. 4 Credits. ,"Examines motivations for managing growth. Surveys regulatory and incentive-based approaches to growth management at the state, regional, and local level. Prereq: PPPM 205. "
2273,OregonUni,PPPM 442. Sustainable Urban Development. 4 Credits. ,"Introduces issues revolving around cities as the nexus for environmental challenges, including land-use planning, transportation planning, community and neighborhood design, and green buildings. "
2274,OregonUni,PPPM 443. Natural Resource Policy. 4 Credits. ,"Aspects of population and resource systems. Poses questions about population trends, policy, and optimum size; analyzes methods for determining resource availability and flows. "
2275,OregonUni,PPPM 445. Green Cities. 4 Credits. ,"Examines the history and future of the interface between urban growth and environmental concerns, and the technological, social, and political forces that continue to shape it. "
2276,OregonUni,PPPM 446. Socioeconomic Development Planning. 4 Credits. ,Planning for responsible economic and social development. Policy problems and issues in providing a stable economic base and social and economic well-being while avoiding environmental degradation. 
2277,OregonUni,PPPM 448. Collaboration. 4 Credits. ,Explores theory and practice of collaboration. Presents a variety of collaboration settings with a focus on environmental and natural resource management. 
2278,OregonUni,PPPM 452. Public Participation in Diverse Communities. 4 Credits. ,Review of community engagement strategies and tools for encouraging public participation in low income and ethnically diverse communities. Prereq: PPPM 432. 
2279,OregonUni,PPPM 480. Nonprofit Management I. 4 Credits. ,"How to manage nonprofit organizations for superior performance in a humane, responsive, and responsible manner. Distinctive characteristics of nonprofit organizations. Prereq: PPPM 280. "
2280,OregonUni,PPPM 484. Public and Nonprofit Financial Management. 4 Credits. ,"Introduction to financial management for public agencies and nonprofit organizations. Topics include budget processes, financial statements, financial resource management (taxes, donations, grants), expenditure systems, and capital project analysis. "
2281,OregonUni,PPPM 486. Philanthropy and Grant Making. 2 Credits. ,"History, economics, and practice of philanthropy and grant making in the United States. Students study philanthropy from a multidisciplinary perspective and finish the quarter by awarding a $15,000 grant to a nonprofit organization of their choice. "
2282,OregonUni,PPPM 487. Impact Philanthropy. 4 Credits. ,"Introduction to impact philanthropy and related topics. Evidence-based philanthropy, venture philanthropy, impact investing, social impact bonds, impact measurement, and policy environment. "
2283,OregonUni,PPPM 494. Practice of Leadership and Change. 4 Credits. ,"Examines the principles and practices of leadership and change in communities and organizations through discussions with community leaders and personal reflection. Prereq: major status, senior standing preferred. "
2284,OregonUni,PPPM 518. Introduction to Public Law. 4 Credits. ,"Administrative law, including introduction to legal research, for public administrators. Administrative procedures, implementation of policy through administrative law, judicial review, and practical applications in public agencies. "
2285,OregonUni,PPPM 532. Justice and Urban Revitalization. 4 Credits. ,"Examines the political, economic, institutional and social forces that affect the long-term vitality of cities and communities and how those factors relate to community redevelopment. Emphasis is given on how to revitalize low-income multicultural communities. "
2286,OregonUni,PPPM 541. Growth Management. 4 Credits. ,"Examines motivations for managing growth. Surveys regulatory and incentive-based approaches to growth management at the state, regional, and local level. "
2287,OregonUni,PPPM 542. Sustainable Urban Development. 4 Credits. ,"Introduces issues evolving around cities as the nexus for environmental challenges, including land-use planning, transportation planning, community and neighborhood design, and green buildings. "
2288,OregonUni,PPPM 543. Natural Resource Policy. 4 Credits. ,"Aspects of population and resource systems. Poses questions about population trends, policy, and optimum size; analyzes methods for determining resource availability and flows. "
2289,OregonUni,PPPM 546. Socioeconomic Development Planning. 4 Credits. ,Planning for responsible economic and social development. Policy problems and issues in providing a stable economic base and social and economic well-being while avoiding environmental degradation. 
2290,OregonUni,PPPM 548. Collaboration. 4 Credits. ,Explores theory and practice of collaboration. Presents a variety of collaboration settings with a focus on environmental and natural resource management. 
2291,OregonUni,PPPM 552. Public Participation in Diverse Communities. 4 Credits. ,Review of community engagement strategies and tools for encouraging public participation in low income and ethnically diverse communities. Prereq: PPPM 532. 
2292,OregonUni,PPPM 586. Philanthropy and Grant Making. 2 Credits. ,"History, economics, and practice of philanthropy and grant making in the United States. Students study philanthropy from a multidisciplinary perspective and finish the quarter by awarding a $15,000 grant to a nonprofit organization of their choice. "
2293,OregonUni,PPPM 587. Impact Philanthropy. 4 Credits. ,"Introduction to impact philanthropy and related topics. Evidence-based philanthropy, venture philanthropy, impact investing, social impact bonds, impact measurement, and policy environment. "
2294,OregonUni,PPPM 604. Internship: [Topic]. 1-10 Credits. ,"Supervised work experience that offers students opportunities to explore and clarify career goals, apply academic learning, enhance and learn new skills, gain experience, and network with professionals. Repeatable. "
2295,OregonUni,PPPM 611. Introduction to Planning Practice. 4 Credits. ,"Explores the concepts and functions of the planning process as they relate to the social, economic, political, and environmental aspects of communities and regions. "
2296,OregonUni,PPPM 612. Legal Issues in Planning. 4 Credits. ,"Federal and state legal relationships, the role of the courts in reviewing public sector decision-making, sources of the law, issues in land-use regulation, and basic legal research skills. "
2297,OregonUni,PPPM 613. Planning Analysis I. 5 Credits. ,"Data sources and methods of data collection including surveys; descriptive and multivariate analysis; computer applications; selected analytic models, population projections, cost-benefit analysis. "
2298,OregonUni,PPPM 625. Community Planning Workshop. 5 Credits. ,First in a two-term sequence of planning and problem-solving courses. Students working in teams conduct research and develop solutions to planning problems for a client community. Sequence with PPPM 626. 
2299,OregonUni,PPPM 626. Community Planning Workshop. 5 Credits. ,Last in a two-term sequence of planning and problem-solving courses. Students working in teams conduct research and develop solutions to planning problems for a client community. Sequence with PPPM 625. Prereq: PPPM 625. 
2300,OregonUni,PPPM 628. Public Sector Economics. 4 Credits. ,"Reasons for governmental intervention and analysis of revenue sources available to governments. Includes discussion of various taxes, intergovernmental transfer policies, and user fees. "
2301,OregonUni,PPPM 633. Public Management. 4 Credits. ,"Theory and practice of public service managment; leadership and organizational capacity building, including key management activities for developing effective public service organizations. "
2302,OregonUni,PPPM 636. Public Policy Analysis. 4 Credits. ,"Techniques in the policymaking process. Determining the impact of policies, comparing alternatives, determining the likelihood that a policy will be adopted and effectively implemented. Prereq: PPPM 628 or equivalent. "
2303,OregonUni,PPPM 637. MPA Policy Analysis Project. 1 Credit. ,Students team to produce a professionally oriented policy analysis memorandum and presentation on an assigned topic in a 48-hour period. Prereq: PPPM 636. 
2304,OregonUni,PPPM 638. MPA Capstone Applied Research Project I. 5 Credits. ,"Team prepare applied research projects for client organizations using analytical and managerial skills to solve problems in public policy analysis or public management. Sequence with PPPM 639. Prereq: PPPM 618, 629, 633, 636, 657, 684. "
2305,OregonUni,PPPM 639. MPA Capstone Applied Research Project II. 5 Credits. ,Teams prepare applied research projects for client organizations using analytical and management skills to solve problems in public policy analysis or public management. Sequence with PPPM 638. Prereq: PPPM 638. 
2306,OregonUni,PPPM 657. Research Methods in Public Policy and Management. 4 Credits. ,Survey of research methods used in the analysis of public policy issues. Emphasis is on determining the appropriate methodology for a given research question. Prereq: PPPM 656. 
