,School,CourseID,Descriptions
0,OregonUni,GEOG 360 Watershed Science and Policy 4 ,computer and information science or in a combination of the two for the GEOG 361 Global Environmental Change 4 bachelor of science degree may not also be used to fulfill the science GEOL 101 Exploring Planet Earth 4 group requirement. GEOL 102 Exploring Earth’s Environment 4 
1,OregonUni,HPHY 112 The Science of Health 4 ,"Statistics PHYS 101 Essentials of Physics 4 MATH 246 Calculus for the Biological Sciences I 4 PHYS 102 Essentials of Physics 4 MATH 247 Calculus for the Biological Sciences II 4 PHYS 152 Physics of Sound and Music 4 MATH 251 Calculus I 4 PHYS 153 Physics of Light, Color, and Vision 4 MATH 252 Calculus II 4 PHYS 155 Physics behind the Internet 4 MATH 253 Calculus III 4 PHYS 156M Scientific Revolutions 4 MATH 261 Calculus with Theory I 4 PHYS 161 Physics of Energy and Environment 4 MATH 262 Calculus with Theory II 4 PHYS 162 Solar and Other Renewable Energies 4 MATH 263 Calculus with Theory III 4 PHYS 171 The Physics of Life 4 MATH 307 Introduction to Proof 4 PHYS 181 Quantum Mechanics for Everyone 4 MATH 343 Statistical Models and Methods 4 PHYS 201 General Physics 4 PHYS 202 General Physics 4 Multicultural Requirements PHYS 203 General Physics 4 "
2,OregonUni,CAS 110. Humanities College Scholars Colloquium. 1 Credit. ,"Introduces fields in the humanities to freshman honors students. Faculty members discuss their research, the nature of their fields, and career opportunities. Repeatable twice for a maximum of 3 credits. Pre- or coreq: acceptance into the Society of College Scholars program. "
3,OregonUni,CAS 120. Science College Scholars Colloquium. 1 Credit. ,"Introduces fields in the sciences to freshman honors students. Faculty members discuss their research, the nature of their fields, and career opportunities. Repeatable twice for a maximum of 3 credits. Pre- or coreq: acceptance into the Society of College Scholars program. "
4,OregonUni,CAS 130. Social Science College Scholars Colloquium. 1 Credit. ,"Introduces fields in the social sciences to freshman honors students. Faculty members discuss their research, the nature of their fields, and career opportunities. Repeatable twice for a maximum of 3 credits. Pre- or coreq: acceptance into the Society of College Scholars program. "
5,OregonUni,AFR 215. Introduction to African Studies. 4 Credits. ,"Introduction to the interdisciplinary field of African studies. Evaluates the social, cultural, political, economic and environmental diversity of and issues affecting historical and contemporary Africa and African peoples. "
6,OregonUni,AEIS 101. Introductory Academic Oral Communication. 4 Credits. ,"Focuses on strategies to improve aural-oral academic communication through discussions, seminars, dialogue, videos, and lectures. Sequence with AEIS 102. Pre- or coreq: placement test. "
7,OregonUni,AEIS 102. Advanced Academic Oral Communication. 4 Credits. ,"Focuses on strategies to improve aural-oral academic communication through discussions, seminars, dialogue, and presentations. Sequence with AEIS 101. Pre- or coreq: placement test or AEIS 101 with a grade of C– or better. "
8,OregonUni,AEIS 107. Reading Academic Discourse. 4 Credits. ,"Focuses on interactive reading of academic text, building reading strategies for better comprehension, speed, and confidence, and developing critical reading skills. Prereq: placement test. "
9,OregonUni,AEIS 108. Advanced Reading Academic Discourse. 4 Credits. ,"Focuses on interactive reading of academic text, reading strategies for better comprehension, speed, and confidence, and further development of critical, interpretive and evaluative reading. Sequence with AEIS 107 (optional). Prereq: placement test or AEIS 107 with a grade of C– or better. "
10,OregonUni,AEIS 110. Introductory Academic Writing. 4 Credits. ,"Introduces conventions of expository essay writing. Emphasizes clear, effective written communication and development of editing skills. Covers grammar in context. Sequence with AEIS 111, 112. Prereq: placement test. "
11,OregonUni,AEIS 111. Intermediate Academic Writing. 4 Credits. ,"Intermediate writing for nonnative speakers of English. Critical analysis of academic texts leading to summary, paraphrase, essay-examination responses, and expository essays. Sequence with AEIS 110, 112. Prereq: placement test or C– or better or P in AEIS 110. "
12,OregonUni,AEIS 112. Advanced Academic Writing. 4 Credits. ,"Advanced writing for nonnative speakers of English. Critical reading of academic texts for response in various academic modes: reporting research, critical analysis, and argumentation. Sequence with AEIS 110, "
13,OregonUni,ANTH 114. Anthropology of Pirates and Piracy. 4 Credits. ,"Examines the political and economic origins and legacies of piracy through 500 years of history in the Americas, Europe, and Africa. "
14,OregonUni,ANTH 119. Anthropology and Aliens. 4 Credits. ,"Examines how anthropology and speculative fiction have mutually constituted each other historically as each explores culture and society, and what makes us human. "
15,OregonUni,ANTH 150. World Archaeology. 4 Credits. ,Introduction to prehistoric societies and cultural change through the examination of archaeological case studies from around the world. Taught once or more per academic year. 
16,OregonUni,ANTH 165. Sexuality and Culture. 4 Credits. ,"Examines sexuality through the historical, cultural, economic, and political factors that contribute to the construction of sexual identities, relationships, and institutions. "
17,OregonUni,ANTH 171. Introduction to Monkeys and Apes. 4 Credits. ,"Evolutionary biology of the primates: the fossil record and ecology in the age of mammals, primate anatomy, locomotor feeding adaptations, taxonomic relations, and primate ethology. "
18,OregonUni,ANTH 173. Evolution of Human Sexuality. 4 Credits. ,"Includes basic genetics, physiology, and behavior. Evolution of sex, of the sexes, and of the role of sex in mammal, primate, and human behavior. "
19,OregonUni,ANTH 176. Introduction to Forensic Anthropology. 4 Credits. ,"Introduction to human skeletal analysis and its application in a legal context, using biological and anthropological approaches to the recovery and identificationof human remains. "
20,OregonUni,ANTH 220. Introduction to Nutritional Anthropology. 4 Credits. ,"Human nutrition from a biocultural anthropological perspective, including the relationship of food consumption patterns to evolution, contemporary issues relating to malnutrition, and diseases of nutrition. "
21,OregonUni,ANTH 223. Anthropology of Chocolate. 4 Credits. ,This course explores the impact and meaning that chocolate has had on cultures around the world and on the human body. 
22,OregonUni,ANTH 225. Evolution of Play. 4 Credits. ,"Explores a range of human play behaviors as adaptations that evolved in a hunting-and-gathering context, functioning to develop physical, cognitive, and social capacities needed in adulthood. "
23,OregonUni,ANTH 243. Island Archaeology. 4 Credits. ,"Provides an in-depth understanding about the prehistory of various island regions in a comparative perspective as seen in the material culture and how islands help archaeologists decipher patterns of changing human behavior over time, including migration processes, settlement patterns, environmental interactions, and exchange systems. "
24,OregonUni,ANTH 250. Introduction to Middle East Studies. 4 Credits. ,"Explores national, familial, religious, and gendered identities in the Middle East as well as colonial histories, historical memory, politics, globalization, and world view. "
25,OregonUni,ANTH 270. Introduction to Biological Anthropology. 4 Credits. ,"Examines the biological aspects of the human species from comparative, ecological, and evolutionary perspectives. Explores theoretical and methodological issues in biological anthropology. "
26,OregonUni,ANTH 274. Animals and People. 4 Credits. ,"Explores contemporary and historical examples of human-animal interactions around the globe from a cross-cultural perspective. We analyze the influences of culture and biology on these interactions, explore perspectives, and engage in hypothesis testing. "
27,OregonUni,ANTH 278. Scientific Racism. 4 Credits. ,Understanding past scientific attitudes on racial variation helps place modern concepts of human diversity and racial segregation in a broader anthropological and scientific context. 
28,OregonUni,ANTH 284. Warfare in Human Evolution. 4 Credits. ,"Reviews current theories regarding when/why warfare emerged in human prehistory, examining evidence from animal behavior, cognitive psychology, and the fossil, archaeological, and ethnographic records. "
29,OregonUni,ANTH 310. Exploring Other Cultures: [Topic]. 4 Credits. ,"How anthropologists study and describe human cultures. Content varies; draws on fieldwork, famous ethnographies, specific ethnographic areas and their problems, and comparative study of selected cultures. Repeatable when topic changes. "
30,OregonUni,ANTH 314. Gender in Cross-Cultural Perspective. 4 Credits. ,"Cross-cultural exploration of women's power in relation to political, economic, social, and cultural roles. Case studies from Africa, America, Asia, Europe, and the Middle East. "
31,OregonUni,"ANTH 315. Gender, Folklore, Inequality. 4 Credits. ","Cross-cultural exploration of the expressive and artistic realm of women's lives. Topics include life-cycle rituals, religion, healing, verbal arts, crafts, and music. "
32,OregonUni,ANTH 320. Native North Americans. 4 Credits. ,"Interpretive approach to accomplishments, diversity, and survival of precontact, postcontact, and present-day American Indian peoples. Impact of Euro-American stereotypes on politics and identity. Prereq: ANTH 161. "
33,OregonUni,ANTH 322. Anthropology of the United States. 4 Credits. ,"Explores the culture and the political economy of the contemporary United States, with a particular focus on race, class, and gender relations. Pre or coreq: ANTH 161. "
34,OregonUni,ANTH 329. Immigration and Farmworkers Political Culture. 4 Credits. ,"Mexican farmworkers in the United States, their history and living and working conditions explored within the political culture of immigration. Introductory social science course recommended. "
35,OregonUni,ANTH 330. Hunters and Gatherers. 4 Credits. ,"Survey of contemporary hunter-gatherer societies. Foraging, decision-making, exchange, prestige, marriage, gender roles, parenting, history, and demography in an ecological and evolutionary perspective. "
36,OregonUni,ANTH 331. Cultures of India and South Asia. 4 Credits. ,"Survey of contemporary South Asia's religious and cultural diversity, issues of ethnic identity, gender construction, social conflict, and politics of poverty. "
37,OregonUni,ANTH 332. Human Attraction and Mating Strategies. 4 Credits. ,"Evolutionary theory, experimental and real-world data illuminate what we find attractive in others, variation in who we are attracted to, and why. "
38,OregonUni,ANTH 340. Fundamentals of Archaeology. 4 Credits. ,"Methods modern archaeology uses to reconstruct the past, including background research, field methods, laboratory analyses, and interpreting data. Prereq: ANTH 145 or ANTH 150. "
39,OregonUni,ANTH 341. Food Origins. 4 Credits. ,"Biological, ecological, and social dimensions of plant-animal domestication and the environmental impact of agriculture in the Late Pleistocene-Holocene epochs. "
40,OregonUni,ANTH 343. Pacific Islands Archaeology. 4 Credits. ,Archaeology and prehistoric cultural development of Pacific island peoples from earliest settlement through early Western contact. Emphasizes Southeast Asian cultural foundations and ecological adaptations. Prereq: ANTH 145 or 150. 
41,OregonUni,ANTH 344. Oregon Archaeology. 4 Credits. ,Native American cultural history of Oregon based on archaeological evidence. Environmental and ecological factors that condition human adaptations and contemporary cultural resource protection. 
42,OregonUni,ANTH 361. Human Evolution. 4 Credits. ,Fossil evidence of human evolution; Homo sapiens' place among the primates; variability of populations of fossil hominids. Prereq: ANTH 170 or ANTH 270. 
43,OregonUni,ANTH 362. Human Biological Variation. 4 Credits. ,"Genetic and biological structure of human populations; population dynamics and causes of diversity; analysis of genetically differentiated human populations and their geographic distribution. Prereq: one from ANTH 270, BI 213, or BI 283H. "
44,OregonUni,ANTH 365. Food and Culture. 4 Credits. ,Anthropological approach to the role of nutrients in human development (individual and group); cultural determinants and differences among populations; world food policy; applied nutritional anthropology. 
45,OregonUni,ANTH 366. Human Osteology Laboratory. 4 Credits. ,"Human and nonhuman primate osteology and osteometry; fundamentals of dissection and primate anatomy. Prereq: one from ANTH 170, 270, BI 212, or HPHY 321. "
46,OregonUni,ANTH 369. Human Growth and Development. 4 Credits. ,"Examines key issues in human and nonhuman primate growth and development; addresses genetic, social and ecological determinants of variation in growth. "
47,OregonUni,ANTH 373. Psychoactive Substances in Ancient Societies. 4 Credits. ,"Global review of psychoactive substances in past human societies, including the paraphernalia, iconography, and residues of drugs found in the archaeological record. Prereq: ANTH 145 or ANTH 150. "
48,OregonUni,ANTH 375. Primates in Ecological Communities. 4 Credits. ,How do primates interact with other species at evolutionary and ecological scales? What factors influence differences and similarities in primate communities? Prereq: ANTH 170 or 270. 
49,OregonUni,ANTH 376. Genomics and Anthropology. 4 Credits. ,"Explores how genomic data are used to address anthropological questions concerning human and nonhuman primate biological variation, health, and evolution. Prereq: one course from ANTH 175, 270, BI 211, 282H. "
50,OregonUni,"ANTH 411. Politics, Ethnicity, Nationalism. 4 Credits. ","Explores relationship between ethnicity, politics, and nationalism from historical and anthropological perspectives; addresses the way nationalism and ethnic identity construct and reproduce each other. Prereq: junior standing in a social science. "
51,OregonUni,ANTH 413. Culture and Psychology. 4 Credits. ,"Bridges anthropology and psychology to explore the relationship between the individual and culture; includes such topics as emotion, personality, mental illness, and sexuality. "
52,OregonUni,ANTH 417. Field Methods in Cultural Anthropology. 4 Credits. ,"Techniques of participant observation, community definition and extension, nondirective interviewing, and establishing rapport. Provides theoretical perspectives and emphasizes investigator's ethical responsibilities. Prereq: 8 credits of upper-division cultural anthropology. "
53,OregonUni,"ANTH 419. Performance, Politics, and Folklore. 4 Credits. ","Aesthetic, political, economic, and social dimensions of cultural performances examined in museums, heritage displays, folklore festivals, community celebrations, and tourist destinations. Pre- or coreq: 8 credits in cultural anthropology. "
54,OregonUni,"ANTH 420. Culture, Illness, and Healing. 4 Credits. ","Cultural foundations of illness and healing. Attempts to analyze illness experiences, looks at therapies cross-culturally, and examines the nature of healing. Prereq: ANTH 161. "
55,OregonUni,ANTH 424. Feminist Methods in Anthropology. 4 Credits. ,"Seminar in feminist research design and methods in three subfields of anthropology: biological, sociocultural, archaeological. Examines case studies illustrating research ethics, collaboration, and activism. Prereq: 12 credits in ANTH or WGS courses. "
56,OregonUni,ANTH 427M. Latino Roots I. 4 Credits. ,Documents Latino history in the racial history of what is now Oregon since 1500 and teaches students to conduct oral history interviews. Multilisted with J 427M/527M. Sequence with ANTH 428M/528M Latino Roots II. 
57,OregonUni,ANTH 428M. Latino Roots II. 4 Credits. ,"Continuation of Latino Roots I, designed for producing a short documentary using oral history as the story. Covers basic theory and practice of digital film-video documentary production. Multilisted with J 428M/528M. Sequence with ANTH 427M/527M. Prereq: ANTH 427M. "
58,OregonUni,ANTH 429. Jewish Folklore and Ethnology. 4 Credits. ,"Traditional expressive culture of East European Jews; includes narrative, proverbs, jokes, folk beliefs, rituals, holidays, food, customs, music, gender, and immigrant folklore in the United States. "
59,OregonUni,ANTH 431. Plants and People. 4 Credits. ,Survey of issues in and research methods for understanding the cultural roles and uses of plants in past and present human societies. 
60,OregonUni,ANTH 438. Race and Gender in Latin America. 4 Credits. ,"Examines intersecting systems of race, gender, ethnicity, and nationalism through 600 years of Latin American history, focusing on five countries in three regions. "
61,OregonUni,ANTH 440. Old World Prehistory: [Topic]. 4 Credits. ,"Archaeology of prehistoric cultures in selected regions of the Middle East, Southeast Asia, or Africa, from first human cultures to historic periods. Repeatable when topic changes for maximum of 12 credits. Prereq: ANTH 145 or 150. "
62,OregonUni,ANTH 442. Northwest Coast Archaeology. 4 Credits. ,"Archaeological and prehistoric cultural development of peoples indigenous to the Northwest Coast of North America, from Alaska to northern California, from earliest settlement through Western contact. Prereq: ANTH 145 or 150. "
63,OregonUni,ANTH 444. Seacoast and Prehistory. 4 Credits. ,Global review of the significance of coastal settlement and adaptations by humans in the ancient past. Prereq: ANTH 145 or 150. 
64,OregonUni,ANTH 449. Cultural Resource Management. 4 Credits. ,"Objectives, legal background, operational problems, ethical and scholarly considerations in the management of prehistoric and historic cultural resources. Prereq: ANTH 145 or 150. "
65,OregonUni,ANTH 459. Advanced Evolutionary Medicine. 4 Credits. ,"Explores current research in the field of evolutionary medicine. Prereq: one from ANTH 175, ANTH 270, ANTH 468, BI 131, BI 380; ANTH 175 strongly suggested. "
66,OregonUni,ANTH 462. Primate Evolution. 4 Credits. ,"The fossil record and theoretical implications of the Cenozoic primates with special reference to their various adaptations: locomotion, special senses, dentition. Prereq: ANTH 270. "
67,OregonUni,ANTH 463. Primate Behavior. 4 Credits. ,"Ecology and ethology of free-ranging primates. Classification, distribution, and ecological relationships of living primates; social structure and social organizations. Prereq: ANTH 171 or 270. "
68,OregonUni,ANTH 466. Primate Feeding and Nutrition. 4 Credits. ,"Evaluates primate feeding and foraging behavior, diet, and nutrition. Explores anatomical, physiological, and behavioral solutions to feeding challenges, both ecological and evolutionary. Prereq: ANTH 171 or 270. "
69,OregonUni,ANTH 467. Paleoecology and Human Evolution. 4 Credits. ,Relationship between ecology and comparative morphology as a basis for theories of hominid phylogeny; analysis of methods of paleoecological inference; current theories of hominid origins. Prereq: ANTH 270. 
70,OregonUni,ANTH 470. Statistical Analysis of Biological Anthropology. 4 Credits. ,"The important methods in biometry (biological statistics) and their inherent assumptions, limitations, interpretations, and common uses (and misuses) as relevant to biological anthropology. Prereq: MATH 243, 425, or equivalent. "
71,OregonUni,ANTH 471. Zooarchaeology: [Topic]. 4 Credits. ,Analysis and interpretation of bone and shell animal remains from archaeological sites. Repeatable once for a maximum of 8 credits when the topic changes. Prereq: ANTH 145 or ANTH 150. 
72,OregonUni,ANTH 472. Primate Conservation Biology. 4 Credits. ,"Evaluates the conservation status of the order Primates. Explores biological-ecological issues and social-cultural influences on primate biodiversity, distribution, and abundance. Prereq: ANTH 171 or 270. "
73,OregonUni,ANTH 473. Advanced Forensic Anthropology. 4 Credits. ,"Teaches theory and analysis of human remains for medico-legal professionals, including estimating biological parameters from skeletons and outdoor crime scene processing and testimony. Prereq: ANTH 176 with a grade of B– or better or ANTH 366 with a C– or better. "
74,OregonUni,"ANTH 479. Taphonomy: Bones, Bugs, and Burials. 4 Credits. ","Application of taphonomic studies in the fields of paleontology, archaeology, and forensic-medicolegal anthropology. Prereq: one from ANTH 170, ANTH 176, ANTH 270, ANTH 366, BI 212, or equivalent. "
75,OregonUni,ANTH 481. Principles of Evolutionary Psychology. 4 Credits. ,Investigates how understanding of our evolutionary history is used to further understanding of the human mind. Prereq: ANTH 170 or 270. 
76,OregonUni,ANTH 487. Bioanthropology Methods. 4 Credits. ,"Laboratory-based introduction to research methods in biological anthropology, with an emphasis on research among living human populations. Prereq: ANTH 270. "
77,OregonUni,ANTH 488. Foundations of Social Theory. 4 Credits. ,"Important early social theorists (Marx, Engels, Freud, Durkheim, Weber) and the historical conditions in which the study of society emerged in Western thought. "
78,OregonUni,ANTH 493. Anthropology and Popular Culture. 4 Credits. ,"Popular culture offers insights into the conditions of the reproduction of social relations through the analysis of film, sport, television, advertising, folklore, fashion, and festivals. "
79,OregonUni,"ANTH 511. Politics, Ethnicity, Nationalism. 4 Credits. ","Explores relationship between ethnicity, politics, and nationalism from historical and anthropological perspectives; addresses the way nationalism and ethnic identity construct and reproduce each other. "
80,OregonUni,ANTH 513. Culture and Psychology. 4 Credits. ,"Bridges anthropology and psychology to explore the relationship between the individual and culture; includes such topics as emotion, personality, mental illness, and sexuality. "
81,OregonUni,ANTH 517. Field Methods in Cultural Anthropology. 4 Credits. ,"Techniques of participant observation, community definition and extension, nondirective interviewing, and establishing rapport. Provides theoretical perspectives and emphasizes investigator's ethical responsibilities. "
82,OregonUni,"ANTH 519. Performance, Politics, and Folklore. 4 Credits. ","Aesthetic, political, economic, and social dimensions of cultural performances examined in museums, heritage displays, folklore festivals, community celebrations, and tourist destinations. "
83,OregonUni,"ANTH 520. Culture, Illness, and Healing. 4 Credits. ","Cultural foundations of illness and healing. Attempts to analyze illness experiences, looks at therapies cross-culturally, and examines the nature of healing. "
84,OregonUni,ANTH 524. Feminist Methods in Anthropology. 4 Credits. ,"Seminar in feminist research design and methods in three subfields of anthropology: biological, sociocultural, archaeological. Examines case studies illustrating research ethics, collaboration, and activism. "
85,OregonUni,ANTH 527M. Latino Roots I. 4 Credits. ,Documents Latino history in the racial history of what is now Oregon since 1500 and teaches students to conduct oral history interviews. Multilisted with J 427M/527M. Sequence with ANTH 428M/528M Latino Roots II. 
86,OregonUni,ANTH 528M. Latino Roots II. 4 Credits. ,"Continuation of Latino Roots I, designed for producing a short documentary using oral history as the story. Covers basic theory and practice of digital film-video documentary production. Multilisted with J 428M/528M. Sequence with ANTH 427M/527M. Prereq: ANTH 527M. "
87,OregonUni,ANTH 529. Jewish Folklore and Ethnology. 4 Credits. ,"Traditional expressive culture of East European Jews; includes narrative, proverbs, jokes, folk beliefs, rituals, holidays, food, customs, music, gender, and immigrant folklore in the United States. "
88,OregonUni,ANTH 531. Plants and People. 4 Credits. ,Survey of issues in and research methods for understanding the cultural roles and uses of plants in past and present human societies. 
89,OregonUni,ANTH 538. Race and Gender in Latin America. 4 Credits. ,"Examines intersecting systems of race, gender, ethnicity, and nationalism through 600 years of Latin American history, focusing on five countries in three regions. "
90,OregonUni,ANTH 540. Old World Prehistory: [Topic]. 4 Credits. ,"Archaeology of prehistoric cultures in selected regions of the Middle East, Southeast Asia, or Africa, from first human cultures to historic periods. Repeatable when topic changes for maximum of 12 credits. Prereq: one course in archaeology or prehistory. "
91,OregonUni,ANTH 542. Northwest Coast Archaeology. 4 Credits. ,"Archaeological and prehistoric cultural development of peoples indigenous to the Northwest Coast of North America, from Alaska to northern California, from earliest settlement through Western contact. "
92,OregonUni,ANTH 562. Primate Evolution. 4 Credits. ,"The fossil record and theoretical implications of the Cenozoic primates with special reference to their various adaptations: locomotion, special senses, dentition. "
93,OregonUni,ANTH 567. Paleoecology and Human Evolution. 4 Credits. ,Relationship between ecology and comparative morphology as a basis for theories of hominid phylogeny; analysis of methods of paleoecological inference; current theories of hominid origins. 
