,School,CourseID,Descriptions
739,OregonUni,FLR 411. Folklore and Religion. 4 Credits. ,"Explores the role of folklore in people's religious lives with particular emphasis on narrative, beliefs, rituals, celebrations, pilgrimage, and ecstatic states. "
740,OregonUni,FLR 415. Folklore and Foodways. 4 Credits. ,"Examines food traditions from a folkloristic perspective, looking at issues such as identity, performance, community, creativity, and innovation. Prereq: junior standing. Offered every second or third year. "
741,OregonUni,FLR 416. African Folklore. 4 Credits. ,"Examines folklore forms across the African continent to analyze themes of history, identity, aesthetics, gender, class, politics, and globalization. Offered alternate years. Prereq: junior standing. "
742,OregonUni,FLR 418. Folklore and Gender. 4 Credits. ,"Examines intersections of folklore and gender and the resulting issues of creativity, social dynamics, feminism, identity politics, and negotiations of power. Offered alternate years. Prereq: junior standing. "
743,OregonUni,FLR 450. Folklore in the Public Sector. 4 Credits. ,"Investigates the history of the field of public folklore as well as training students in contemporary practices including fieldwork methods, grant writing, and project development. "
744,OregonUni,FLR 483. Folklore and Mythology of the British Isles. 4 Credits. ,"Basic folk traditions in the British Isles (e.g., ballads, folktales, legends, myths) and their treatment in the written literature of major British authors. "
745,OregonUni,FLR 485. Film and Folklore. 4 Credits. ,"The developmental use of film by folklorists. Folklore genres, theories, and fieldwork methods as related to filmmakers' techniques. Analysis includes documentary and ethnodocumentary films. "
746,OregonUni,FLR 491. Anglo-American Ballad and Folk Song. 4 Credits. ,"Study of popular ballads in the Anglo-American tradition--styles, origins, forms, content, and dissemination. History and influence of popular media. "
747,OregonUni,FLR 511. Folklore and Religion. 4 Credits. ,"Explores the role of folklore in people's religious lives with particular emphasis on narrative, beliefs, rituals, celebrations, pilgrimage, and ecstatic states. "
748,OregonUni,FLR 515. Folklore and Foodways. 4 Credits. ,"Examines food traditions from a folkloristic perspective, looking at issues such as identity, performance, community, creativity, and innovation. Prereq: junior standing. Offered every second or third year. "
749,OregonUni,FLR 518. Folklore and Gender. 4 Credits. ,"Examines intersections of folklore and gender and the resulting issues of creativity, social dynamics, feminism, identity politics, and negotiations of power. Offered alternate years. "
750,OregonUni,FLR 550. Folklore in the Public Sector. 4 Credits. ,"Investigates the history of the field of public folklore as well as training students in contemporary practices including fieldwork methods, grant writing, and project development. "
751,OregonUni,FLR 583. Folklore and Mythology of the British Isles. 4 Credits. ,"Basic folk traditions in the British Isles (e.g., ballads, folktales, legends, myths) and their treatment in the written literature of major British authors. "
752,OregonUni,FLR 585. Film and Folklore. 4 Credits. ,"The developmental use of film by folklorists. Folklore genres, theories, and fieldwork methods as related to filmmakers' techniques. Analysis includes documentary and ethnodocumentary films. "
753,OregonUni,FLR 591. Anglo-American Ballad and Folk Song. 4 Credits. ,"Study of popular ballads in the Anglo-American tradition--styles, origins, forms, content, and dissemination. History and influence of popular media. "
754,OregonUni,FLR 681. History and Theory of Folklore Research. 5 Credits. ,"Examines nature of scholarly inquiry, research questions, and techniques. Historic orientation with emphasis on ideological development of folkloristics from its beginnings to the present. "
755,OregonUni,GEOG 141. The Natural Environment. 4 Credits. ,"The earth's physical landscapes, vegetation patterns, weather, and climate; emphasis on the dynamic interactions among climate, landforms, vegetation, and soils. "
756,OregonUni,GEOG 142. Human Geography. 4 Credits. ,"The spatial organization of humans and their activities on Earth’s surface. Cultural, political, and economic influences shaping places and their interconnections. "
757,OregonUni,GEOG 181. Our Digital Earth. 4 Credits. ,Exploring the emergence of geospatial data and technologies that are pervasive in our everyday lives and how they are shaping society. 
758,OregonUni,GEOG 201. World Regional Geography. 4 Credits. ,Introduction to the world's cultural regions. Study of the cultural and environmental factors that make different parts of the world distinct. 
759,OregonUni,GEOG 208. Geography of the United States and Canada. 4 Credits. ,"Historical and geographical analysis of the physical and human geography of the U.S. and Canada. Topics include physical regions, settlement patterns, economic development, and urbanization. Offered alternate years. "
760,OregonUni,GEOG 281. The World and Big Data. 4 Credits. ,"Explores technical foundations and social and economic applications of big data along the “5V” dimensions of volume, variety, velocity, veracity, and visualization. "
761,OregonUni,GEOG 321. Climatology. 4 Credits. ,"Energy and moisture in the atmosphere, atmospheric circulation, controls of regional and microclimates, applied climatology, climatic variations, past and future climates. Prereq: GEOG 141. "
762,OregonUni,GEOG 322. Geomorphology. 4 Credits. ,"Landforming processes with emphasis on mass movements, rivers, eolian, glacial, and coastal processes. Special fee. Prereq: GEOG 141 or GEOL 102 or 202. "
763,OregonUni,GEOG 323. Biogeography. 4 Credits. ,"Relation of plants and animals to the environment, distribution of individual species, historical changes in plant distribution. Prereq: one from GEOG 141, GEOL 103, 203, BI 370. "
764,OregonUni,GEOG 341. Population and Environment. 4 Credits. ,"Patterns of population growth over history and place, current policies and programs, and impacts and trends in United States and international contexts. Includes method and theory. "
765,OregonUni,GEOG 342. Geography of Globalization. 4 Credits. ,"Historical and geographical dimensions of globalization; emphasizes economic and social factors. Topics include multinationals, trade agreements, sustainability, global inequalities, and racial and gender divisions of labor. "
766,OregonUni,"GEOG 343. Society, Culture, and Place. 4 Credits. ",Examines ways in which geographical context reflects and shapes cultural and social processes. Importance of place and territory in human affairs. 
767,OregonUni,GEOG 360. Watershed Science and Policy. 4 Credits. ,"Physical and biological processes of watersheds; problems of land use, water quality, riparian zones, aquatic ecology; scientific basis of watershed management and policy. Special fee. Prereq: GEOG 141, or GEOL 102 or 202, or BI 130 or 213. "
768,OregonUni,GEOG 361. Global Environmental Change. 4 Credits. ,Natural and human-induced environmental changes and their impact on different environmental systems. Not available to those who have taken GEOG 143. Prereq: GEOG 141. 
769,OregonUni,GEOG 391. Social Science Inquiry and Research. 4 Credits. ,"Understanding scientific inquiry, the scientific method and learning to critique social science research. Readings and discussion focus on the questions, methods, conclusions and outcomes of research. "
770,OregonUni,GEOG 419. Professional Geographer. 2 Credits. ,"Explores the geographical perspective on world cultures and global issues, and prepares students how to articulate a spatial perspective and effectively communicate geographic training and skills to broader audiences. "
771,OregonUni,GEOG 423. Advanced Biogeography: [Topic]. 4 Credits. ,"Selected topics in biogeography including relation of plants and animals to their environment, historical changes in plant distribution, and palynological analysis. Special fee. Repeatable when topic changes. Prereq: GEOG 323. "
772,OregonUni,GEOG 425. Hydrology and Water Resources. 4 Credits. ,"Emphasis on surface water including precipitation, evapotranspiration, surface runoff, and stream flow. Understanding and analysis of processes. Management for water supply and quality. Special fee. Prereq: GEOG 321 or 322; MATH 111. "
773,OregonUni,GEOG 427. Fluvial Geomorphology. 4 Credits. ,"Hydraulics and hydrology of stream channels; channel morphology and processes; drainage network development; fluvial deposits and landforms; field and analytical methods. Required field trips. Special fee. Prereq: MATH 112; one from GEOG 322, GEOG 425, GEOL 334. "
774,OregonUni,GEOG 430. Long-Term Environmental Change. 4 Credits. ,"Evolution of the physical landscape during the Quaternary period. Elements of paleoclimatology, paleoecology, and geomorphology. Required field trips. Special fee. Prereq: GEOG 321, 322, or 323. "
775,OregonUni,GEOG 433. Fire and Natural Disturbances. 4 Credits. ,"Wildfire and other landscape disturbance processes, historical and current patterns of fire, use and management of fire. Offered alternate years. Prereq: BI 307 or GEOG 323 or BI 370. "
776,OregonUni,GEOG 441. Political Geography. 4 Credits. ,"Spatial perspectives on global political patterns and processes. Relationship of political territories to resources, ethnic patterns, and ideological communities. Impact of political arrangements on landscapes. Prereq: Junior standing. "
777,OregonUni,GEOG 442. Urban Geography. 4 Credits. ,"Urbanization throughout the world, the structure of urban settlements; cities as regional centers, physical places, and homes for people; geographic problems in major urban environments. Prereq: Junior standing. "
778,OregonUni,GEOG 444. Cultural Geography. 4 Credits. ,"Patterns of culture as a force in human affairs. Dynamics of identity, place, and power. The creation of culture at different scales. "
779,OregonUni,"GEOG 445. Culture, Ethnicity, and Nationalism. 4 Credits. ","Relationship of ethnic groups and nationality to landscapes, perception, and cultural geographic phenomena. Distribution of ethnic and national groups. Junior standing required. "
780,OregonUni,GEOG 461. Environmental Alteration. 4 Credits. ,"Human alterations of the earth's major ecosystems. Consequences of human activity at different times and places with respect to soils, atmosphere, vegetation, landforms, and water. Prereq: Junior standing. "
781,OregonUni,"GEOG 463. Geography, Law, and the Environment. 4 Credits. ",Values underlying American legal approaches to environmental issues; the role of laws in reflecting and shaping human understanding and use of the environment. Special fee. Prereq: Junior standing. 
782,OregonUni,GEOG 465. Environment and Development. 4 Credits. ,Critical analysis of development concepts. Economic activity and environmental impacts. Sustainable development. Development projects and landscapes in the industrializing world. Prereq: Junior standing. 
783,OregonUni,GEOG 467. International Water Policy. 4 Credits. ,"Examines problems in water policy and governance in a global context. Draws on interdisciplinary perspectives, compares case studies, and analyzes institutions. "
784,OregonUni,GEOG 468. Contemporary Food Systems. 4 Credits. ,"Explores contemporary food systems at local, national, and global scales. Emphasis on the political economy and sociocultural dynamics linking agriculture, food industries, and consumption. "
785,OregonUni,GEOG 471. North American Historical Landscapes. 4 Credits. ,"Examines the origin and evolution of cultural landscapes in North America through historical and contemporary sources, and draws upon the local region for student projects. Prereq: Junior standing. "
786,OregonUni,GEOG 475. Advanced Geography of Non-European-American Regions: [Topic]. 4 Credits. ,"Repeatable. Examination of the settlement patterns, regional economies, political organization, and character of the landscapes of selected major regions of the non-European and American world. Repeatable when region changes. "
787,OregonUni,GEOG 481. GIScience I. 4 Credits. ,"Introduction to geographic information science, geographic information systems (GIS), the current population survey (CPS), remote sensing, and cartography. Sequence with GEOG 482/582, 491/591. "
788,OregonUni,GEOG 482. GIScience II. 4 Credits. ,"Spatial data collection, spatial data models, database design, data editing, geographic information system (GIS) project management, and advanced topics in geographic information science. Sequence with GEOG 481/581, 491/591, 493/593. Prereq: GEOG 481. "
789,OregonUni,GEOG 485. Remote Sensing I. 4 Credits. ,"Introduction to remote sensing science including its physical basis, instruments, platforms, data, processing methods, and applications. Sequence with GEOG 486/586. Prereq: GEOG 481. "
790,OregonUni,GEOG 486. Remote Sensing II. 4 Credits. ,"The use of digital electromagnetic data for classification, mapping, and monitoring biologic, hydrologic, atmospheric, geologic, and human processes and environmental change. Sequence with GEOG 485/585. Prereq: GEOG 485. "
791,OregonUni,GEOG 490. GIScience: [Topic]. 4 Credits. ,"Repeatable. Advanced topics on geographic information systems science including spatial analysis and modeling, data visualization, cartography, volunteered geographic information, GIS programming. Repeatable five times for a maximum of 24 credits. Prereq: GEOG 481 or GEOG 311. "
792,OregonUni,GEOG 491. Advanced Geographic Information Systems. 4 Credits. ,"Automated processing of geospatial data using Python scripting language. Programming for spatial analysis such as 3-D and network modeling; processing of big data (satellite imagery, climate data, demographic information). Sequence with GEOG 481/581, 482/582. Prereq: GEOG 482. "
793,OregonUni,GEOG 493. Advanced Cartography. 4 Credits. ,"Map design and production methods; use of color, cartographic visualization, graphing, data graphics theory, and integration of geographic information systems (GIS) and graphics tools. Sequence with GEOG 481/581, 482/582. Prereq: GEOG 481. "
794,OregonUni,GEOG 494. Spatial Analysis. 4 Credits. ,Introduction to a variety of spatial analysis techniques that can be used for understanding and modeling geographic phenomena. Series. Prereq: GEOG 481. 
795,OregonUni,GEOG 496. Location-Aware Systems. 4 Credits. ,"Explores technical fundamentals of location-aware systems, such as location models and location-based services, as well as challenges such as user privacy. Prereq: GEOG 281. "
796,OregonUni,GEOG 497. Qualitative Methods in Geography. 4 Credits. ,"Explores conceptual and practical dimensions of qualitative research. Includes linking theory and method; research question formulation; project design; ethics; data gathering, analysis, and presentation. Prereq: GEOG 341, 342, or 343. "
797,OregonUni,GEOG 523. Advanced Biogeography: [Topic]. 4 Credits. ,"Selected topics in biogeography including relation of plants and animals to their environment, historical changes in plant distribution, and palynological analysis. Special fee. Repeatable when topic changes. "
798,OregonUni,GEOG 525. Hydrology and Water Resources. 4 Credits. ,"Emphasis on surface water including precipitation, evapotranspiration, surface runoff, and stream flow. Understanding and analysis of processes. Management for water supply and quality. Special fee. "
799,OregonUni,GEOG 527. Fluvial Geomorphology. 4 Credits. ,Hydraulics and hydrology of stream channels; channel morphology and processes; drainage network development; fluvial deposits and landforms; field and analytical methods. Required field trips. Special fee. 
800,OregonUni,GEOG 541. Political Geography. 4 Credits. ,"Spatial perspectives on global political patterns and processes. Relationship of political territories to resources, ethnic patterns, and ideological communities. Impact of political arrangements on landscapes. "
801,OregonUni,GEOG 542. Urban Geography. 4 Credits. ,"Urbanization throughout the world, the structure of urban settlements; cities as regional centers, physical places, and homes for people; geographic problems in major urban environments. "
802,OregonUni,GEOG 544. Cultural Geography. 4 Credits. ,"Patterns of culture as a force in human affairs. Dynamics of identity, place, and power. The creation of culture at different scales. "
803,OregonUni,GEOG 561. Environmental Alteration. 4 Credits. ,"Human alterations of the earth's major ecosystems. Consequences of human activity at different times and places with respect to soils, atmosphere, vegetation, landforms, and water. "
804,OregonUni,"GEOG 563. Geography, Law, and the Environment. 4 Credits. ",Values underlying American legal approaches to environmental issues; the role of laws in reflecting and shaping human understanding and use of the environment. Special fee. 
805,OregonUni,GEOG 567. International Water Policy. 4 Credits. ,"Examines problems in water policy and governance in a global context. Draws on interdisciplinary perspectives, compares case studies, and analyzes institutions. "
806,OregonUni,GEOG 568. Contemporary Food Systems. 4 Credits. ,"Explores contemporary food systems at local, national, and global scales. Emphasis on the political economy and sociocultural dynamics linking agriculture, food industries, and consumption. "
807,OregonUni,GEOG 571. North American Historical Landscapes. 4 Credits. ,"Examines the origin and evolution of cultural landscapes in North America through historical and contemporary sources, and draws upon the local region for student projects. "
808,OregonUni,GEOG 575. Advanced Geography of Non-European-American Regions: [Topic]. 4 Credits. ,"Repeatable. Examination of the settlement patterns, regional economies, political organization, and character of the landscapes of selected major regions of the non-European and American world. Repeatable when region changes. "
809,OregonUni,GEOG 581. GIScience I. 4 Credits. ,"Introduction to geographic information science, geographic information systems (GIS), the current population survey (CPS), remote sensing, and cartography. Sequence with GEOG 482/582, 491/591. "
810,OregonUni,GEOG 582. GIScience II. 4 Credits. ,"Spatial data collection, spatial data models, database design, data editing, geographic information system (GIS) project management, and advanced topics in geographic information science. Sequence with GEOG 481/581, 491/591, 493/593. Prereq: GEOG 581. "
811,OregonUni,GEOG 585. Remote Sensing I. 4 Credits. ,"Introduction to remote sensing science including its physical basis, instruments, platforms, data, processing methods, and applications. Sequence with GEOG 486/586. Prereq: GEOG 581. "
812,OregonUni,GEOG 586. Remote Sensing II. 4 Credits. ,"The use of digital electromagnetic data for classification, mapping, and monitoring biologic, hydrologic, atmospheric, geologic, and human processes and environmental change. Sequence with GEOG 485/585. Prereq: GEOG 585. "
813,OregonUni,GEOG 590. GIScience: [Topic]. 4 Credits. ,"Advanced topics on geographic information systems science including spatial analysis and modeling, data visualization, cartography, volunteered geographic information, GIS programming. Repeatable five times for a maximum of 24 credits. Prereq: GEOG 581. "
814,OregonUni,GEOG 591. Advanced Geographic Information Systems. 4 Credits. ,"Socioeconomic analysis with geographic information systems (GIS) and the U.S. census, network modeling, 3-D models of natural and urban landscapes, web-based GIS and programming. Sequence with GEOG 481/581, 482/582. Prereq: GEOG 582. "
815,OregonUni,GEOG 593. Advanced Cartography. 4 Credits. ,"Map design and production methods; use of color, cartographic visualization, graphing, data graphics theory, and integration of geographic information systems (GIS) and graphics tools. Sequence with GEOG 481/581, 482/582. Prereq: GEOG 582. "
816,OregonUni,GEOG 594. Spatial Analysis. 4 Credits. ,Introduction to a variety of spatial analysis techniques that can be used for understanding and modeling geographic phenomena. Series. Prereq: GEOG 581. 
817,OregonUni,GEOG 596. Location-Aware Systems. 4 Credits. ,"Explores technical fundamentals of location-aware systems, such as location models and location-based services, as well as challenges such as user privacy. Prereq: GEOG 581. "
818,OregonUni,GEOG 597. Qualitative Methods in Geography. 4 Credits. ,"Explores conceptual and practical dimensions of qualitative research. Includes linking theory and method; research question formulation; project design; ethics; data gathering, analysis, and presentation. "
819,OregonUni,GEOG 611. Theory and Practice of Geography I. 4 Credits. ,"Introduction to professional practice in geography and the development of geographic concepts and theories from Ancient times through the mid-twentieth century. Sequence with GEOG 612, 613. "
820,OregonUni,GEOG 612. Theory and Practice of Geography II. 4 Credits. ,The development of geographic concepts and theories from the mid-20th century to the present. Students learn to refine effective geographic research questions. Sequence with GEOG 611 and 613. Prereq: GEOG 611. 
821,OregonUni,GEOG 613. Research Design. 4 Credits. ,"Examines main components of research design, including research questions, methodological approach, institutional review boards, funding programs, proposal writing, and application. Sequence with GEOG 611 and 612. Prereq: GEOG 612. "
822,OregonUni,GEOG 631. Progress in Physical Geography. 1 Credit. ,"Recent developments in climatology, geomorphology, hydrology, and biogeography. Lectures, readings, and presentation of faculty and student works in progress. Repeatable for maximum of 12 credits. "
823,OregonUni,GEOG 632. Progress in Human Geography. 1 Credit. ,"Recent developments in cultural, economic, environmental and political geography. Lectures, readings, and presentation of faculty and student works in progress. Repeatable for maximum of 12 credits. "
824,OregonUni,GEOG 633. Progress in Geographic Information Science. 1 Credit. ,"Recent developments in cartography, GIS, remote sensing, data analysis, and visualization. Lectures, readings, and presentation of faculty and student works in progress. Repeatable for maximum of 12 credits. "
825,OregonUni,GER 101. First-Year German. 5 Credits. ,Provides a thorough grammatical foundation and an elementary reading knowledge of German as well as an understanding of the spoken language. Sequence. 
826,OregonUni,GER 102. First-Year German. 5 Credits. ,Provides a thorough grammatical foundation and an elementary reading knowledge of German as well as an understanding of the spoken language. Prereq: GER 101 or GER 104. 
827,OregonUni,GER 103. First-Year German. 5 Credits. ,Provides a thorough grammatical foundation and an elementary reading knowledge of German as well as an understanding of the spoken language. Prereq: GER 102. 
828,OregonUni,GER 206. Law in Literature. 4 Credits. ,Introduction to German literature and key concepts of Germany's legal tradition with a focus on the connection between legal codes and their representations in fiction. 
829,OregonUni,GER 220M. From Kierkegaard to Kafka. 4 Credits. ,"Survey of the existential tradition in German and Scandinavian literature, philosophy, drama, and film. Historical and conceptual developments are considered, from Kierkegaard to Kafka. Taught in English. Multilisted with SCAN 220M. "
830,OregonUni,GER 222. Voices of Dissent in Germany. 4 Credits. ,"Key debates in German culture, including the adequate representation of the Holocaust, literature in society, and the roles of ethnic and gender identities within the nation. Conducted in English. "
831,OregonUni,GER 223. Germany: A Multicultural Society. 4 Credits. ,"Examines the multiethnic complexities of German, Austrian, and/or Swiss societies through the writings of African, Turkish, or Jewish Germans. Period of focus varies. Conducted in English. "
832,OregonUni,GER 250. The Culture of Money. 4 Credits. ,"Explores ideas about money, value, and exchange in German-speaking cultures from selected moments in modern history through readings of literature, philosophy, and the arts. Series with GER 251, GER 252. "
833,OregonUni,GER 251. Sexuality. 4 Credits. ,"Examines discourses on sexuality (e.g., sexual norms, gender roles, and divergences from them) in modern German, Austrian, and Swiss-German contexts through literature, essays, and films. Series with GER 250, GER "
834,OregonUni,"GER 252. War, Violence, Trauma. 4 Credits. ","Examines works of literature, thought, art, music, and film on subjects of war, violence, and trauma in German and Austrian cultural history during one or more selected postmedieval epochs. Series with GER 250, GER "
835,OregonUni,GER 313. Intermediate Language Training. 4 Credits. ,Extensive practice in speaking and writing German; complex grammatical structures in writing. Option during 313 to take the Zertifikat Deutsch exam. Prereq: GER 312. 
836,OregonUni,GER 317. Study in Germany. 4 Credits. ,"Intensive grammar review in preparation for German exchange programs and upper-division German courses. Introduces contemporary ideas about German culture, history, architecture through journals and magazines. Pre- or coreq: GER 203 or equivalent. "
837,OregonUni,GER 340. Introduction to German Culture and Society. 4 Credits. ,"Writings by such figures as Kant, Marx, Freud, and Weber. The emergence of Germany as a cultural and political entity explored through literature, film, and art. Readings, discussion, and written assignments in German. Offered alternate years. Coreq: GER 311. "
