,School,CourseID,Descriptions
1476,OregonUni,PS 342. Politics of China. 4 Credits. ,"Survey of the politics of the People's Republic of China. Emphasis on political sociology and group conflict: elites, ideology, social change, and organization. "
1477,OregonUni,PS 345. Southeast Asian Politics. 4 Credits. ,"Surveys major themes in contemporary Southeast Asian politics, including nation-state building, economic development, authoritarianism and democracy, and religious and ethnic politics. "
1478,OregonUni,PS 346. Terrorism and Weapons Proliferation. 4 Credits. ,"Examines causes and control of terrorism, especially preventing terrorist use of weapons of mass destruction; theories and policies of nonproliferation and arms control. "
1479,OregonUni,"PS 347. Political Power, Influence, and Control. 4 Credits. ","Survey of the use of the concept of power in the social sciences, stressing diverse theoretical perspectives and empirical studies of political institutions. "
1480,OregonUni,PS 349. Mass Media and American Politics. 4 Credits. ,"The role of the mass media in contemporary American politics; the effect of the media on such institutions as political parties, elections, and the presidency. "
1481,OregonUni,PS 355. Oregon Government and Politics. 4 Credits. ,Current political issues in Oregon with particular attention to political races and ballot measures before the Oregon electorate as well as the state's major political institutions. 
1482,OregonUni,PS 368. Gender in the Law. 4 Credits. ,"Examines the role courts have played in framing and shaping policies where gender is a central feature with a focus on reproductive rights, pregnancy and abortion, domestic violence, rape, family issues, prostitution, and sexual harassment. Offered alternate years. "
1483,OregonUni,PS 371. United States Congress. 4 Credits. ,"Study of Congress as an institution: congressional elections, the committee system, and the internal distribution of influence; relations with the president and the Supreme Court. "
1484,OregonUni,"PS 375. Race, Politics, and the Law. 4 Credits. ",Examines the development and transformation of race-based domination and resistance in the United States by examining the intersection of policy and law. 
1485,OregonUni,PS 378. Games in Politics. 4 Credits. ,"Politics viewed as strategic interactions among politicians, voters, and countries; focuses on how to model these interactions using tools of game theory. "
1486,OregonUni,PS 380. Gender and Politics in Developing Countries. 4 Credits. ,"Examines gender politics in the developing world and efforts to help women. Topics include female genital cutting, violence against women, economic development, microfinance, migration, trafficking. Offered alternate years. "
1487,OregonUni,PS 386. United States Social Movements and Political Change. 4 Credits. ,"Causes and consequences of American social movements. Considers theoretical perspectives. Topics may include agrarian populism, labor movement, civil rights movement, the women's movement, and identity politics. "
1488,OregonUni,PS 390. American Indian Politics. 4 Credits. ,"Examination of the political and constitutional status of American Indian tribes in the United States, with some comparison to Canada. Focus on history, current policy, and potential futures. "
1489,OregonUni,PS 411. Honors Thesis Prospectus. 1 Credit. ,"Prepares students for writing the senior honors thesis in political science. Provides guidance in framing a suitable topic, conducting preliminary research, and writing a prospectus. Prereq: majors with honors standing. "
1490,OregonUni,PS 433. Marxism and Radical Thought. 4 Credits. ,"Surveys utopian socialist thought, anarchism, Marxism, and Leninism. Central themes include the nature of radical theory, the role of the state, human nature and the new society. "
1491,OregonUni,PS 440. Causes and Prevention of War. 4 Credits. ,"Surveys theories of causes of war; focuses on major theories of prevention; case studies from World War I, World War II, and other wars. "
1492,OregonUni,PS 445. Methods for Politics and Policy Analysis I. 4 Credits. ,"Introduction to quantitative analysis, concepts and methods of empirical research, applied statistical data analysis in political science. Methods include descriptive statistics, bivariate correlation, and regression techniques. "
1493,OregonUni,PS 446. Methods for Politics and Policy Analysis II. 4 Credits. ,"Survey of multivariate model building for political analysis. Multiple regression, discrete-variable techniques, recursive systems, and cross-level analysis. Application of these techniques to concrete political problems. Prereq: PS 445/545. "
1494,OregonUni,PS 460. Political Economy of East Asia. 4 Credits. ,"Examines the political economy of East Asia, with a focus on states, markets, and social classes during economic transformation. Offered alternate years. "
1495,OregonUni,PS 465. LGBT Rights in the Courts. 4 Credits. ,"Analyzes the role of legal advocates and the courts in advancing and curtailing lesbian, gay, bisexual, and transgender rights with a focus on relationship recognition, parenting, employment, housing, military, education, and health care. Offered alternate years. "
1496,OregonUni,PS 466. Civil Rights in Post-Warren Era. 4 Credits. ,"Analyzes development in civil rights advocacy in the United States since the heyday of the Warren Court. Focuses primarily on developments in race, gender, disability, and sexuality. Offered alternate years. "
1497,OregonUni,PS 467. The United States Presidency. 4 Credits. ,An ambivalent view of the presidency as the key institution in the United States political system: source of great good but also of great harm. 
1498,OregonUni,PS 470. Constitutional Law. 4 Credits. ,Surveys how the U.S. Constitution works as a structure for government. Addresses how the federal courts interact within the U.S. system of government. 
1499,OregonUni,PS 472. Matters of Life and Death. 4 Credits. ,"Examines the right to life from political, legal, and philosophical perspectives. Considers abortion, capital punishment, assisted suicide, just-war theory, and animal rights. "
1500,OregonUni,PS 479. U.S. Interventions in Developing Nations. 4 Credits. ,"Examines theories of intervention: security, economic imperialism, humanitarian intervention, spreading democracy, domestic politics; over thirty-seven U.S. interventions since 1898 are surveyed. "
1501,OregonUni,PS 484. United States Supreme Court. 4 Credits. ,"The Supreme Court as a political body; the judicial role in the context of the economic, political, social, and psychological factors that influence the court's decisions. "
1502,OregonUni,PS 485. Civil Rights and Civil Liberties. 4 Credits. ,Overview of the role of rights in the United States legal system. Particular emphasis on the role of freedom and equality in a federal system. 
1503,OregonUni,PS 495. United States Political Economy. 4 Credits. ,"Examines United States political-economic institutions from a comparative and historical perspective. Topics include rise and fall of mass production, labor and the law, and regional development. "
1504,OregonUni,PS 533. Marxism and Radical Thought. 4 Credits. ,"Surveys utopian socialist thought, anarchism, Marxism, and Leninism. Central themes include the nature of radical theory, the role of the state, human nature and the new society. "
1505,OregonUni,PS 540. Causes and Prevention of War. 4 Credits. ,"Surveys theories of causes of war; focuses on major theories of prevention; case studies from World War I, World War II, and other wars. "
1506,OregonUni,PS 545. Methods for Politics and Policy Analysis I. 4 Credits. ,"Introduction to quantitative analysis, concepts and methods of empirical research, applied statistical data analysis in political science. Methods include descriptive statistics, bivariate correlation, and regression techniques. "
1507,OregonUni,PS 546. Methods for Politics and Policy Analysis II. 4 Credits. ,"Survey of multivariate model building for political analysis. Multiple regression, discrete-variable techniques, recursive systems, and cross-level analysis. Application of these techniques to concrete political problems. "
1508,OregonUni,PS 565. LGBT Rights in the Courts. 4 Credits. ,"Analyzes the role of legal advocates and the courts in advancing and curtailing lesbian, gay, bisexual, and transgender rights with a focus on relationship recognition, parenting, employment, housing, military, education, and health care. Offered alternate years. "
1509,OregonUni,PS 566. Civil Rights in Post-Warren Era. 4 Credits. ,"Analyzes development in civil rights advocacy in the United States since the heyday of the Warren Court. Focuses primarily on developments in race, gender, disability, and sexuality. Offered alternate years. "
1510,OregonUni,PS 567. The United States Presidency. 4 Credits. ,An ambivalent view of the presidency as the key institution in the United States political system: source of great good but also of great harm. 
1511,OregonUni,PS 570. Constitutional Law. 4 Credits. ,Surveys how the U.S. Constitution works as a structure for government. Addresses how the federal courts interact within the U.S. system of government. 
1512,OregonUni,PS 572. Matters of Life and Death. 4 Credits. ,"Examines the right to life from political, legal, and philosophical perspectives. Considers abortion, capital punishment, assisted suicide, just-war theory, and animal rights. "
1513,OregonUni,PS 579. U.S. Interventions in Developing Nations. 4 Credits. ,"Examines theories of intervention: security, economic imperialism, humanitarian intervention, spreading democracy, domestic politics; over thirty-seven U.S. interventions since 1898 are surveyed. "
1514,OregonUni,PS 584. United States Supreme Court. 4 Credits. ,"The Supreme Court as a political body; the judicial role in the context of the economic, political, social, and psychological factors that influence the court's decisions. "
1515,OregonUni,PS 585. Civil Rights and Civil Liberties. 4 Credits. ,Overview of the role of rights in the United States legal system. Particular emphasis on the role of freedom and equality in a federal system. 
1516,OregonUni,PS 595. United States Political Economy. 4 Credits. ,"Examines United States political-economic institutions from a comparative and historical perspective. Topics include rise and fall of mass production, labor and the law, and regional development. "
1517,OregonUni,PS 612. Qualitative Methods. 5 Credits. ,Survey of rationales for qualitative methods in the social sciences and the main conceptual and practical issues raised in qualitative research. Offered alternate years. 
1518,OregonUni,PS 618. American Political Institutions. 5 Credits. ,One of three required seminars for PhD students planning to take a comprehensive examination in American politics. Explores how political science approaches the study of institutional contributions to political and policy developments. 
1519,OregonUni,PS 619. United States Political Culture. 5 Credits. ,"In this course we examine the different ways that scholars study the relationship between politics and culture, and then focus on the United States as our case. "
1520,OregonUni,PS 626. International Political Economy. 5 Credits. ,One of two required seminars for PhD students planning to take a comprehensive examination in international relations. Explores how politics and economics interact in shaping economic relations among states. 
1521,OregonUni,PS 628. States and State-Society Relations. 5 Credits. ,Examines how scholars have studied the state and its relationship to society. Students develop a comparative perspective of contentious politics ranging from peasant rebellions to revolutions to transnational social movements. 
1522,OregonUni,PS 629. Comparative Political Economy. 5 Credits. ,"Doctoral-level survey of how political factors explain variations in national or regional trajectories of economic development, including industrialization, wealth, growth, and inequality. "
1523,OregonUni,PSY 301. Scientific Thinking in Psychology. 4 Credits. ,"Fundamentals in the empirical study of human behavior, including hypothesis formation, experiment design, behavioral data basics, and critical evaluation of scientific claims. Sequence with PSY 302, PSY 303. Students may not register for PSY 301 after completing PSY 303. "
1524,OregonUni,PSY 302. Statistical Methods in Psychology. 4 Credits. ,"Probability and statistics applied in psychological research. Topics include descriptive statistics, hypothesis testing, correlation, regression, and design of experiments. With laboratory. Sequence with PSY 301, PSY 303. Prereq: MATH 243 or one from MATH 241, MATH 246, MATH 251; PSY 301, WR 121; Pre- or coreq: PSY 201, 202. "
1525,OregonUni,PSY 303. Research Methods in Psychology: [Topic]. 4 Credits. ,"Practical experience designing, conducting, analyzing, and communicating original research about human behavior. Sequence with PSY 301, PSY 302. Repeatable once for a total of 8 credits when the topic changes. Prereq: PSY 201, PSY 202, PSY 301, PSY 302; one from WR 122, WR "
1526,OregonUni,PSY 304. Biopsychology. 4 Credits. ,"Relationships between brain and endocrine activity and behavior. Topics include sensation, perception, sexual behavior, drug effects, eating, drinking, sleeping, dreaming, and learning. Prereq: PSY 201. "
1527,OregonUni,PSY 306. Social Psychology. 4 Credits. ,"Processes underlying social perception and social interaction. Topics include aggression, the self-concept, stereotyping and prejudice, conformity, persuasion, attraction, and helping. Prereq: PSY 202. "
1528,OregonUni,PSY 307. Personality. 4 Credits. ,"Theory and methods for studying human traits, including personality tests and measures. Current research in personality. Studies of age, gender, culture, and relation to emotion and motivation. Prereq: PSY 202. "
1529,OregonUni,PSY 309. Psychopathology. 4 Credits. ,"Major descriptive and theoretical approaches to etiological, developmental, and social factors in emotion and personality disorders. Includes assessment, diagnosis, treatment, and special topics. Prereq: PSY 202. "
1530,OregonUni,PSY 348. Music and the Brain. 4 Credits. ,"Explores the neural correlates of our perception of tonality, harmony, melody, and rhythm and how these relate to neurobiology, brain damage, and cognitive neuroscience. "
1531,OregonUni,PSY 380. Psychology of Gender. 4 Credits. ,"Critical analysis of evidence for sex differences, gender roles, and the effect of gender on traditional issues in psychology. Topics include parenthood, violence, and sexual orientation. "
1532,OregonUni,PSY 383. Psychoactive Drugs. 4 Credits. ,"Physiological and behavioral effects of psychoactive drugs such as alcohol, opiates, barbiturates, and excitants. The psychology of use and overuse; therapies for correcting drug problems. "
1533,OregonUni,PSY 388. Human Sexuality. 4 Credits. ,"The nature of human sexuality; hormonal, instinctual, and learned factors in sexuality; psychosexual development; sexual orientation; frequency and significance of various types of sexual behavior; sexual inadequacy; sexual deviation. "
1534,OregonUni,PSY 412. Applied Data Analysis. 4 Credits. ,"Intermediate-level practical data analysis and interpretation. Topics include experimental design, analysis of variance, multiple regression, exploratory data analysis. Extensive computer use. Honors only. Prereq: PSY 303. "
1535,OregonUni,PSY 420. Psychology and Law. 4 Credits. ,"Introduction to topics of concern to both psychology and the law. Includes eyewitness identification, legal decision-making, criminal defenses, profiling, polygraphy, and mental-health law. Prereq: PSY 303. "
1536,OregonUni,PSY 433. Learning and Memory. 4 Credits. ,"Processes underlying learning and memory, including evolution. Topics range from simple forms of behavior change to the acquisition, retention, forgetting, and retrieval of symbolic information. Prereq: PSY 303; one course from PSY 304, PSY 305. "
1537,OregonUni,PSY 436. Human Performance. 4 Credits. ,"Motor and intellectual capacities; analysis of the flow of information within the nervous system; applications of performance principles to human-machine systems. Prereq: PSY 303, PSY 305. "
1538,OregonUni,PSY 438. Perception. 4 Credits. ,"Topics covered are color, size, shape, depth, distance, and movement. Examines the relationships between stimuli and perception, stimuli and the neural response, and the neural response and perception. Prereq: PSY 303, PSY 304. "
1539,OregonUni,PSY 440. Psycholinguistics. 4 Credits. ,"Processes and structures underlying language use. Methods of studying language processing. Relationships between psycholinguistic data and observations from linguistics and neurophysiology. Prereq: PSY 303, PSY 305. "
1540,OregonUni,PSY 445. Brain Mechanisms of Behavior. 4 Credits. ,"Organization of the mammalian brain. Structure and function of the neuronal systems underlying vision, perception, motivation, coordinated movement, sleep-wakefulness, learning and memory, and affective disorders. Prereq: PSY 303, 304. "
1541,OregonUni,PSY 449. Cognitive Neuroscience. 4 Credits. ,"Integrative neural mechanisms of normal and abnormal processes in systems (e.g., selective attention, language, memory, object recognition, and emotion). Prereq: PSY 303, 304. "
1542,OregonUni,PSY 450. Hormones and Behavior. 4 Credits. ,"Relationships among the brain, endocrine systems, and behavior. Developmental effects of hormones on the brain, puberty, sexuality, aggression, stress. Prereq: PSY 303, PSY 304. "
1543,OregonUni,PSY 457. Group Dynamics. 4 Credits. ,"Topics in small-group dynamics, including decision-making, conflict, and changes over time in group structure and behavior. Prereq: PSY 303. "
1544,OregonUni,PSY 458. Decision-Making. 4 Credits. ,Psychological processes involved in judgment and decision-making. Normative theories of ideal behavior contrasted with descriptive analysis of actual behavior. Prereq: PSY 303. 
1545,OregonUni,PSY 459. Cultural Psychology. 4 Credits. ,"Examines interdependence between mind and culture in substantive domains such as social cognition, motivation, emotion, and psychopathology. Cultural pluralism, collective identities, tolerance, and diversity considered. Prereq: PSY 303. "
1546,OregonUni,PSY 472. Psychology of Trauma. 4 Credits. ,"Cognitive, neuropsychological, developmental, social, and clinical approaches to understanding trauma. Includes analysis of childhood trauma, sexual assault, domestic violence, terrorism, combat, and natural disasters. Prereq: PSY 303. "
1547,OregonUni,PSY 473. Intimate Relationships. 4 Credits. ,"Adult intimacy and love relationships. Clinical-counseling approaches: assessment, couple and family therapies, and evaluation. Models of relationship functioning and the empirical study of interpersonal relationships. Prereq: PSY 303. "
1548,OregonUni,PSY 475. Cognitive Development. 4 Credits. ,"Intellectual development in children from infancy to adolescence with a focus on early childhood. Topics covered include perception, attention, memory, reasoning, conceptual structure, social cognition. Prereq: PSY 303; one course from PSY 305, PSY 308. "
1549,OregonUni,PSY 476. Language Acquisition. 4 Credits. ,"How children acquire language from the earliest speech sounds to full sentences. Topics include babbling, first words, word combinations, the relationship between cognition and language development. Prereq: PSY 303; one course from PSY 305, PSY 308. "
1550,OregonUni,PSY 478. Social Development. 4 Credits. ,"Theoretical issues and empirical studies of social-emotional development. Topics may include attachment, temperament, moral development, family interaction, self-image, aggression, and sex-role development. Prereq: PSY 303; one course from PSY 306, PSY 307, PSY 308. "
1551,OregonUni,PSY 479. Infancy. 4 Credits. ,"Mechanisms and processes that underlie and promote rapid changes in physical, cognitive, and linguistic capabilities, from birth to 24 months. Covers innovative methodologies and cultural attitudes toward infants. Prereq: PSY 303; one course from PSY 308, PSY 376. "
1552,OregonUni,PSY 480. Development and Psychopathology. 4 Credits. ,"Biological and environmental factors that shape normal and abnormal development. Analysis of how family functioning affects psychopathology and resilience in children and adolescents. Prereq: PSY 303; one course from PSY 308, PSY 309. "
1553,OregonUni,PSY 512. Applied Data Analysis. 4 Credits. ,"Intermediate-level practical data analysis and interpretation. Topics include experimental design, analysis of variance, multiple regression, exploratory data analysis. Extensive computer use. "
1554,OregonUni,PSY 520. Psychology and Law. 4 Credits. ,"Introduction to topics of concern to both psychology and the law. Includes eyewitness identification, legal decision-making, criminal defenses, profiling, polygraphy, and mental-health law. "
1555,OregonUni,PSY 533. Learning and Memory. 4 Credits. ,"Processes underlying learning and memory, including evolution. Topics range from simple forms of behavior change to the acquisition, retention, forgetting, and retrieval of symbolic information. "
1556,OregonUni,PSY 536. Human Performance. 4 Credits. ,Motor and intellectual capacities; analysis of the flow of information within the nervous system; applications of performance principles to human-machine systems. 
1557,OregonUni,PSY 538. Perception. 4 Credits. ,"Topics covered are color, size, shape, depth, distance, and movement. Examines the relationships between stimuli and perception, stimuli and the neural response, and the neural response and perception. "
1558,OregonUni,PSY 540. Psycholinguistics. 4 Credits. ,Processes and structures underlying language use. Methods of studying language processing. Relationships between psycholinguistic data and observations from linguistics and neurophysiology. 
1559,OregonUni,PSY 545. Brain Mechanisms of Behavior. 4 Credits. ,"Organization of the mammalian brain. Structure and function of the neuronal systems underlying vision, perception, motivation, coordinated movement, sleep-wakefulness, learning and memory, and affective disorders. "
1560,OregonUni,PSY 559. Cultural Psychology. 4 Credits. ,"Examines interdependence between mind and culture in substantive domains such as social cognition, motivation, emotion, and psychopathology. Cultural pluralism, collective identities, tolerance, and diversity considered. "
1561,OregonUni,PSY 572. Psychology of Trauma. 4 Credits. ,"Cognitive, neuropsychological, developmental, social, and clinical approaches to understanding trauma. Includes analysis of childhood trauma, sexual assault, domestic violence, terrorism, combat, and natural disasters. "
1562,OregonUni,PSY 573. Intimate Relationships. 4 Credits. ,"Adult intimacy and love relationships. Clinical-counseling approaches: assessment, couple and family therapies, and evaluation. Models of relationship functioning and the empirical study of interpersonal relationships. "
1563,OregonUni,PSY 575. Cognitive Development. 4 Credits. ,"Intellectual development in children from infancy to adolescence with a focus on early childhood. Topics covered include perception, attention, memory, reasoning, conceptual structure, social cognition. "
1564,OregonUni,PSY 576. Language Acquisition. 4 Credits. ,"How children acquire language from the earliest speech sounds to full sentences. Topics include babbling, first words, word combinations, the relationship between cognition and language development. "
1565,OregonUni,PSY 578. Social Development. 4 Credits. ,"Theoretical issues and empirical studies of social-emotional development. Topics may include attachment, temperament, moral development, family interaction, self-image, aggression, and sex-role development. "
1566,OregonUni,PSY 579. Infancy. 4 Credits. ,"Mechanisms and processes that underlie and promote rapid changes in physical, cognitive, and linguistic capabilities, from birth to 24 months. Covers innovative methodologies and cultural attitudes toward infants. "
1567,OregonUni,PSY 580. Development and Psychopathology. 4 Credits. ,Biological and environmental factors that shape normal and abnormal development. Analysis of how family functioning affects psychopathology and resilience in children and adolescents. 
1568,OregonUni,PSY 611. Data Analysis I. 4 Credits. ,"Introduction to probability, hypothesis testing, and analysis of variance with applications. Includes training in the statistical analysis of data by computer. With laboratory. "
1569,OregonUni,PSY 612. Data Analysis II. 4 Credits. ,Multiple regression and advanced topics in analysis of variance. Includes training in the statistical analysis of data by computer. With laboratory. Prereq: PSY 611. 
1570,OregonUni,PSY 613. Data Analysis III. 4 Credits. ,"Multivariate techniques including MANOVA, factor analysis, principal components. Includes training in the statistical analysis of data by computer. With laboratory. Prereq: PSY 612. "
1571,OregonUni,PSY 620. Psychopathology. 3 Credits. ,"Definition, measurement, and diagnosis of deviant behavior; includes critical reviews of research on the etiology, intervention, and outcome of major mental disorders. Prereq: major standing. "
1572,OregonUni,ARB 201. Second-Year Arabic. 5 Credits. ,"Development of Arabic speaking, reading, writing and comprehension; study of short literary and cultural materials. Sequence: ARB 202, 203. Prereq: ARB 103 or equivalent. "
