,School,CourseID,Descriptions
298,Pepperdine,P MUS 111 Music Theory I (2) ,"P Music Theory I and II are to be taken in sequence. Students study and analyze melodies, intervals, rhythm, meter, primary chords and their inversions, seventh chords, non-chord tones, harmonic progressions, sequences, species counterpoint and part writing procedures in four voices. Students learn to analyze and realize harmonic progressions with Roman numerals, figured bass and lead sheet chord symbols. Composition assignments allow synthesis of theory work. Theory concepts are reinforced at the piano keyboard. MUS 113 must be taken concurrently with MUS 111. Prerequisites: MUS 101 or satisfactory performance on the Music Theory Placement Exam. "
299,Pepperdine,P MUS 113 Aural Skills I (2) ,"P This course focuses on developing aural recognition of the basic elements of music (e.g., intervals, chords, and rhythm) through a variety of exercises in music dictation and sight singing. MUS 113 must be taken concurrently with MUS 111. "
300,Pepperdine,P MUS 114 Piano Class II (2) ,P A continuation of the technique and keyboard skills covered in MUS 110 or for a beginner with less than one year of piano study. Prerequisite: MUS 110 or consent of instructor. (GE) 
301,Pepperdine,P MUS 115 Music Theory II (2) ,"P Music Theory I and II are to be taken in sequence. Students study and analyze melodies, intervals, rhythm, meter, primary chords and their inversions, seventh chords, non-chord tones, harmonic progressions, sequences, species counterpoint and part writing procedures in four voices. Students learn to analyze and realize harmonic progressions with Roman numerals, figured bass and lead sheet chord symbols. Composition assignments allow synthesis of theory work. Theory concepts are reinforced at the piano keyboard. MUS 117 must be taken concurrently with MUS 115. Prerequisites: MUS 111. "
302,Pepperdine,P MUS 117 Aural Skills II (2) ,"P This course focuses on the continuing development of aural recognition of the basic elements of music (e.g., intervals, chords, and rhythm) through a variety of exercise in music dictation and sight singing. MUS 117 must be taken concurrently with MUS 115. Prerequisite: MUS 113. "
303,Pepperdine,P MUS 118 Voice Class I (2) ,"P Designed for beginning singers, but primarily for those who have had some previous musical background. Application of vocal principles for developing singing facility required in public schools. Not required of students who satisfy the requirement through individual instruction. (GE) "
304,Pepperdine,P MUS 121 Voice Class II (2) ,P A continuation of study for those who have completed Voice Class I or its equivalent. Emphasis will be on music reading and songs in Italian and German as well as English. 
305,Pepperdine,P MUS 128 University Wind Ensemble (0–1) ,"P Audition required. The study and performance of traditional and contemporary wind band literature, requiring an advance level of performance ability. Public concert given each semester. (GE) "
306,Pepperdine,P MUS 135 Pepperdine University Symphony (0–1) ,"P The symphony provides selected students the opportunity to perform works from the standard and twentieth-century orchestral repertoire. While solo appearances are made at concerts by faculty and professional artists, students who have demonstrated outstanding performance ability may also be invited to perform as soloists. Auditions are given at the beginning of each semester. A class fee will be assessed for students taking 0 units in a music ensemble. (GE) "
307,Pepperdine,P MUS 136 String Ensemble (0–1) ,"P Provides opportunities for string players to study and perform chamber music (trios, quartets, and quintets) for standard string groupings as well as in combination with other instruments, such as piano and winds. Open to all qualified students and staff by audition. (GE) "
308,Pepperdine,P MUS 137 Brass Ensemble (0–1) ,"P Explores the music written for brass instruments from the seventeenth century to the present. From the larger ensemble, the Seaver Brass Quintet is selected. Open to all qualified students and staff by audition. (GE) "
309,Pepperdine,P MUS 138 Jazz Ensemble (0–1) ,"P A select instrumental ensemble which emphasizes the performance literature in a wide diversity of styles, as well as the study of improvisation. A variety of performance experiences is provided. Auditions are held at the beginning of each semester. (GE) "
310,Pepperdine,P MUS 139 Woodwind Ensemble (0–1) ,P Organized to read and prepare for concert music for woodwind instruments in a variety of musical styles and combinations of instruments. Open to all qualified students and staff by audition. (GE) 
311,Pepperdine,P MUS 140 Percussion Ensemble (0–1) ,P Enables students with some percussion experience to rehearse and perform repertoire for two or more players on a variety of percussion instruments owned by the college. Open to all qualified students and staff by audition. (GE) 
312,Pepperdine,P MUS 141 Chamber Singers (0–1) ,P A small group selected by audition to perform vocal music ranging from that of the early Renaissance to music in a contemporary style. A class fee will be assessed for students taking 0 units in a music ensemble. (GE) 
313,Pepperdine,P MUS 143 Collegium Musicum (0–1) ,P Open to all students by audition. Study and performance of music from the various historical periods. May include use of older instruments such as harpsichord and recorder. A class fee will be assessed for students taking 0 units in a music ensemble. (GE) 
314,Pepperdine,P MUS 144 Collaborative Piano (0–1) ,"P A multi-level course designed to develop the pianistic and musical skills necessary for accompanying and chamber music. This performance-based class will address vocal and instrumental accompanying, playing in small chamber ensembles, sight-reading, issues of balance, pedaling, and voicing, score preparation, and, where appropriate, translation of texts. Prerequisite: consent of instructor. "
315,Pepperdine,P MUS 145 Performance Skills for Classical Guitar (1) ,"P This course is a performance-based study of guitar transcription, sightreading, and other necessary skills for classical guitarists. The class is open to students with intermediate or advanced classical guitar experience. (GE) "
316,Pepperdine,P MUS 150 Guitar Ensemble (0–1) ,"P Provides opportunities for guitar players to study and perform chamber music for standard ensembles such as guitar duo, guitar trio, and quartet, as well as in combination with other instruments such as flute, voice, and strings. "
317,Pepperdine,P MUS 184 Opera Workshop (0–1) ,"P Open to all students by audition. Provides an opportunity for the student to participate in the production and performance of ensembles and scenes from operas and musical theatre, as well as the presentation of complete works. (GE) "
318,Pepperdine,P MUS 189 Pep Band (0–1) ,P This course is open to all students and provides an opportunity to study and perform music for athletic events. Cr/NC grading. May be repeated for a maximum of three units. 
319,Pepperdine,P MUS 200 Music Appreciation (3) ,"P An introductory survey that examines the history and theory of music in which students attend lectures, read texts, listen to music, and experience live performances. (GE) "
320,Pepperdine,P MUS 201 Introduction to Music Technology (2) ,"P In the music technology lab, students are guided through a series of projects as a basic introduction to recording and studio techniques as well as industry-standard software (notation, sequencing and digital editing). Music studio fee will be assessed. Prerequisite: MUS 115 "
321,Pepperdine,P MUS 204 IPA and English and Latin Diction for Singers (1) ,P Designed to acquaint the singer and the accompanist/coach with the International Phonetic Alphabet and the pronunciation of English and Latin for singing. 
322,Pepperdine,P MUS 205 Italian Diction for Singers (1) ,P Designed to acquaint the singer and the accompanist/coach with the pronunciation of Italian in operatic and song literature. Prerequisite: MUS 204 or consent of instructor. 
323,Pepperdine,P MUS 206 German Diction for Singers (1) ,P Designed to acquaint the singer and the accompanist/coach with the pronunciation of German in operatic and song literature. Prerequisite: MUS 204 or consent of instructor. 
324,Pepperdine,P MUS 207 French Diction for Singers (1) ,P Designed to acquaint the singer and the accompanist/coach with the pronunciation of French in operatic and song literature. Prerequisite: MUS 204 or consent of instructor. 
325,Pepperdine,P MUS 211 Music Theory III (2) ,"P Music Theory III and IV are to be taken in sequence. Students study and analyze chromatic harmony and modulation techniques; part writing and composition assignments synthesize the students’ knowledge of diatonic harmony and counterpoint. Formal analysis, church modes, and twenty-first century techniques are also studied. Theory concepts are reinforced at the piano keyboard. MUS 213 must be taken concurrently with MUS 211. Prerequisite: MUS 115 "
326,Pepperdine,P MUS 213 Aural Skills III (2) ,P Advanced dictation and practice singing modulating melodies and chromatic nonharmonic tones. MUS 213 must be taken concurrently with MUS 211. Prerequisite: MUS 117. 
327,Pepperdine,P MUS 215 Music Theory IV (2) ,"P Music Theory III and IV are to be taken in sequence. Students study and analyze chromatic harmony and modulation techniques; part writing and composition assignments synthesize the students’ knowledge of diatonic harmony and counterpoint. Formal analysis, church modes, and twenty-first century techniques are also studied. Theory concepts are reinforced at the piano keyboard. MUS 217 must be taken concurrently with MUS 215. Prerequisites: MUS 211. "
328,Pepperdine,P MUS 217 Aural Skills IV (2) ,P Advanced dictation and practice singing modulating melodies and chromatic nonharmonic tones. MUS 217 concurrently with MUS 215. Prerequisite: MUS 213. 
329,Pepperdine,P MUS 220 Concert Attendance (0) ,"P Required of all music majors each semester of residence. The course provides an opportunity for music students to perform for each other and to increase exposure to varied music literature. This weekly performance and the series of required concerts and recitals are designed to provide this experience. The weekly meeting also affords a platform for the appearance of guest artists and lecturers, and a convenient time for the dissemination of current pertinent information from the music faculty. Attendance at off-campus concerts may be required to make up for missed on-campus events. Cr/NC grading. "
330,Pepperdine,P MUS 230 Counterpoint of the 16th and 18th Centuries (3) ,P A study of vocal and instrumental counterpoint and contrapuntal forms of the 16th and the 18th centuries. Representative works are analyzed and synthesis is gained through a series of contrapuntal projects. Prerequisite: MUS 115. 
331,Pepperdine,P MUS 232 Instrumentation and Orchestration (3) ,"P The study of orchestral instruments and how to write for them effectively and idiomatically. Students learn about each instrument’s tone production, range, and transposition. Playing techniques and coloristic effects are also studied, and students learn to score for a variety of standard chamber groups and learn how to properly prepare instrument parts. Prerequisite: MUS 115. "
332,Pepperdine,P MUS 250 Business of Music (2) ,"P A workshop designed to enable performing arts majors to enter and find employment within the music industry. Focus is primarily on developing careers in music: solo, chamber, orchestral, and operatic. "
333,Pepperdine,P MUS 280 Introduction To Music (4) ,P A study of the fundamentals of music coupled with a survey tracing the historical development of music from the Greeks to the twenty-first century. Examples of music from each period will be studied through listening and scores. An introductory course for nonmusic majors only. (GE) MUS 292 Special Topics (1–4) MUS 299 Directed Studies (1–4) 
334,Pepperdine,P MUS 302 Private Instruction (1) ,P Half-hour private instruction is available in guitar and piano only. Students enrolled for one unit of applied music receive one half-hour of instruction per week. Lessons will not be made up if they fall on legal or special holidays. Lessons otherwise missed will not be made up unless the instructor is notified 24 hours in advance of the scheduled time. The first four semesters of private instruction will be taken at the 100 level. Students who have completed four semesters of private instruction may register for the 300 level section. A course fee is charged for all private music instruction. 
335,Pepperdine,P MUS 303 Private Instruction (2) ,P Private instruction is available in: 
336,Pepperdine,P MUS 303L Private Instruction Lab--Studio Class for Music Majors and Minors (0) ,P Students pursuing degrees in performance and composition are required to enroll in this lab (studio class) concurrently with the appropriate private lessons. Studio classes will meet one hour per week. Taken concurrently with MUS 303. 
337,Pepperdine,P MUS 305 Pepperdine University Concert Choir (0–1) ,P A large group chosen by audition at the beginning of the school year to perform traditional and contemporary choral literature. The group represents the University at many civic and local college functions. A class fee will be assessed for students taking 0 units in a music ensemble. (GE) 
338,Pepperdine,P MUS 328 University Wind Ensemble (0–1) ,"P Audition required. The study and performance of traditional and contemporary wind band literature, requiring an advance level of performance ability. Public concert given each semester. (GE) "
339,Pepperdine,P MUS 335 Pepperdine University Symphony (0–1) ,"P The symphony provides selected students the opportunity to perform works from the standard and twentieth-century orchestral repertoire. While solo appearances are made at concerts by faculty and professional artists, students who have demonstrated outstanding performance ability may also be invited to perform as soloists. Auditions are given at the beginning of each semester. A class fee will be assessed for students taking 0 units in a music ensemble. (GE) "
340,Pepperdine,P MUS 336 String Ensemble (0–1) ,"P Provides opportunities for string players to study and perform chamber music (trios, quartets, and quintets) for standard string groupings as well as in combination with other instruments, such as piano and winds. Open to all qualified students and staff by audition. (GE) "
341,Pepperdine,P MUS 337 Brass Ensemble (0–1) ,"P Explores the music written for brass instruments from the seventeenth century to the present. From the larger ensemble, the Seaver Brass Quintet is selected. Open to all qualified students and staff by audition. (GE) "
342,Pepperdine,P MUS 338 Jazz Ensemble (0–1) ,"P A select instrumental ensemble which emphasizes the performance literature in a wide diversity of styles, as well as the study of improvisation. A variety of performance experiences is provided. Auditions are held at the beginning of each semester. (GE) "
343,Pepperdine,P MUS 339 Woodwind Ensemble (0–1) ,P Organized to read and prepare for concert music for woodwind instruments in a variety of musical styles and combinations of instruments. Open to all qualified students and staff by audition. (GE) 
344,Pepperdine,P MUS 340 Percussion Ensemble (0–1) ,P Enables students with some percussion experience to rehearse and perform repertoire for two or more players on a variety of percussion instruments owned by the college. Open to all qualified students and staff by audition. (GE) 
345,Pepperdine,P MUS 341 Chamber Singers (0–1) ,P A small group selected by audition to perform vocal music ranging from that of the early Renaissance to music in a contemporary style. A class fee will be assessed for students taking 0 units in a music ensemble. (GE) 
346,Pepperdine,P MUS 343 Collegium Musicum (0–1) ,P Open to all students by audition. Study and performance of music from the various historical periods. May include use of older instruments such as harpsichord and recorder. A class fee will be assessed for students taking 0 units in a music ensemble. (GE) 
347,Pepperdine,P MUS 344 Collaborative Piano (0–1) ,"P A multi-level course designed to develop the pianistic and musical skills necessary for accompanying and chamber music. This performance-based class will address vocal and instrumental accompanying, playing in small chamber ensembles, sight-reading, issues of balance, pedaling, and voicing, score preparation, and, where appropriate, translation of texts. Prerequisite: consent of instructor. "
348,Pepperdine,P MUS 345 Advanced Performance Skills for Classical Guitar (1) ,"P Upper-division level course of MUS 145 offered for the MUS 303 students in guitar who have an emphasis in applied performance and have taken 4 sections of MUS 145. Focus will shift from performing and presentation to transcribing/arranging, recording and multi-faceted preparation for the concert stage. Prerequisite: MUS 145 "
349,Pepperdine,P MUS 350 Guitar Ensemble (0–1) ,"P Provides opportunities for guitar players to study and perform chamber music for standard ensembles such as guitar duo, guitar trio, and quartet, as well as in combination with other instruments such as flute, voice, and strings. "
350,Pepperdine,P MUS 354 Music History and Literature I (4) ,"P A study of the history of music from the Greek period through the Baroque Era. Special emphasis is placed upon the evolution of forms, style, and media of music under consideration. Guided listening of representative examples is required. Consent of instructor required. Prerequisite: MUS 215. (RM, WI) "
351,Pepperdine,P MUS 355 Music History and Literature II (4) ,"P A study of the history of music from the Classical period to the present. Special emphasis is placed upon the evolution of forms, style, and media of music under consideration. Guided listening of representative examples is required. Consent of instructor required. Prerequisite: MUS 215. (RM, WI) "
352,Pepperdine,P MUS 384 Opera Workshop (0–1) ,"P Open to all students by audition. Provides an opportunity for the student to participate in the production and performance of ensembles and scenes from operas and musical theatre, as well as the presentation of complete works. (GE) "
353,Pepperdine,P MUS 392 Recital I (0) ,"P Supervised by their private teachers, students will select and perform music appropriate to their level of achievement in a public recital of approximately thirty minutes in length. Program notes on the composers and works performed are required, and students are responsible for the preparation and printing of recital programs. Requires consent of the music faculty. Written application must be submitted at least two months prior to the event. The recital must be performed for a faculty committee at least two weeks prior to the public performance. The committee must approve this pre-recital, including the written program notes, before the recital is presented to the public. A class fee will be assessed. Cr/NC grading only. (PS, RM, WI) "
354,Pepperdine,P MUS 406 Medieval & Renaissance Music (4) ,P Studies chief musical developments in Western music from the early fourteenth century to the end of the sixteenth century. Prerequisite: MUS 354. 
355,Pepperdine,P MUS 409 Music in the Classical Period (4) ,"P A comprehensive study of the composers and compositions of the Classical Era, focusing primarily on the music of Haydn, Mozart, and Beethoven. Prerequisite: MUS 355. "
356,Pepperdine,P MUS 410 Music of the Baroque Era (4) ,"P A comprehensive study of the composers and compositions of the Baroque Era, including styles and forms. Prerequisite: MUS 354. "
357,Pepperdine,P MUS 412 Music of the Twentieth and Twenty-First Centuries (4) ,"P A comprehensive study and analysis of the important disciplines and styles of music since the turn of the twentieth century, beginning with Debussy and ending with composers of the current century. Prerequisite: MUS 215 "
358,Pepperdine,P MUS 413 Romantic Music (4) ,P Stylistic and structural studies of the late eighteenth century through the nineteenth century. Prerequisite: MUS 355. 
359,Pepperdine,P MUS 415 Analytical Techniques (4) ,"P A study in the technique of harmonic, contrapuntal, and formal analysis of the motive, phrase, and period; the binary, ternary, rondo, sonata, and larger forms. Representative scores to be studied will range from the seventeenth to the twenty-first centuries. Prerequisite: MUS 215. "
360,Pepperdine,P MUS 456 The Spirit of Mozart (4) ,"P An intimate look at the life and music of one of humankind’s greatest treasures: Wolfgang Amadeus Mozart. This course will focus on family correspondence and Mozart’s mature operas. (Typically offered in alternate summers at the Summer Music Program in Heidelberg, Germany.) "
361,Pepperdine,P MUS 460 Music In Secondary Schools (4) ,P Designed to help students formulate a theory of music education while dealing with the most common instructional and administrative problems encountered by the teacher. Special attention will be given to the cultural diversity found in the public schools in Southern California. 
362,Pepperdine,P MUS 464 Piano Literature (4) ,"P A survey of piano literature from the early 17th century through the 21st century. Literature of each period will be studied for style, compositional techniques, performance practices, and instruments of the period. "
363,Pepperdine,P MUS 465 Symphonic Literature (4) ,"P A survey of the standard symphonic repertoire from its inception to the present, focusing on the symphony. Representative works will be analyzed and studied through recordings and concert attendance. "
364,Pepperdine,P MUS 466 Vocal Literature (4) ,"P The study of solo vocal literature from the Baroque Cantata to the Art Song of the present. The Lied, Melodie and orchestrated song are examined. Scores and recordings will be provided. Concert attendance is required. Prerequisite: MUS 303 or permission of instructor. "
365,Pepperdine,P MUS 467 History of Sacred Music (4) ,P A study of the history of music during ancient Biblical times to the present and of how history has shaped music in modern-day worship. The course will deal with the significance of music in the church and its influence upon the worship service. (GE) 
366,Pepperdine,P MUS 468 Multicultural Music in America: Eye on Los Angeles (3) ,P A survey of multicultural music in America with a particular emphasis on Los Angeles and the contributions of various ethnic groups to its artistic milieu. (GE) 
367,Pepperdine,P MUS 475 Conducting (4) ,"P A study of conducting fundamentals, including manual techniques and expressive gestures, the mechanics and interpretation of choral and instrumental scores, and rehearsal procedures. Prerequisite: MUS 415. MUS 491 Selected Topics (1–4) MUS 492 Recital II (0) "
368,Pepperdine,P MUS 493 Composition Recital (0) ,P Students with an emphasis in composition coordinate student performances of their original music. Intended for music majors with an emphasis in Composition only. Cr/NC grading only. A composition recital fee will be assessed. (PS) 
369,Pepperdine,P MUS 499 Directed Studies (1–4) ,P Consent of divisional dean is required. 
370,Pepperdine,P THEA 150 Theatre Ensemble (0–2) ,"P Participation in Theatre Program productions. A maximum of four units may be counted toward graduation requirements. If taken in partial fulfillment of fine arts general education requirements, must be taken for at least 1 unit credit with a letter grade. (GE) "
371,Pepperdine,P THEA 200 Theatre Appreciation (3) ,"P An introductory survey that examines the history and theory of theatre in which students attend lectures, read texts, and experience live performances. (GE) "
372,Pepperdine,P THEA 201 Introduction to Theatre Research (4) ,"P An introduction to scholarly and artistic methods of research integral to theatrical practice, to include dramaturgy, script analysis, visual research, and the formation of directorial concepts. "
373,Pepperdine,P THEA 210 Acting I: Introduction to Acting (4) ,P A practical introduction to basic acting skills. (GE) 
374,Pepperdine,P THEA 215 Audition Practicum (0) ,"P Required of all theatre majors with an emphasis in acting. The course provides a weekly opportunity for theatre students to practice performing audition monologues for each other and for members of the theatre faculty, with an opportunity for peer-to-peer mentoring and faculty feedback. Cr/NC grading only. "
375,Pepperdine,P THEA 220 Introduction to Movement/Voice (4) ,"P An introduction to the technical and practical skills needed for the mastery of stage movement and voice for the actor. This course examines how the body and voice extend through articulators, objects, and environments into story. Prerequisites: THEA 210 or instructor’s consent. "
376,Pepperdine,P THEA 226 Dance for Music Theatre (2) ,P A practical class studying a particular style of dance for music theatre. (GE) 
377,Pepperdine,P THEA 227 Stage Dance I (4) ,"P A practical class for developing the performer’s technique in dance for the stage, learning combinations involved in production, and developing style. (GE) "
378,Pepperdine,P THEA 240 Stagecraft I (4) ,"P An introductory study of the technical aspects of theatre, including lectures and labs. "
