,School,CourseID,Descriptions
0,Pepperdine,"P FA 313 Materials, Techniques, and Skills in Music..............................70 ","P FA 314 Materials, Techniques, and Skills in Art.................................70 "
1,Pepperdine,"P FA 314 Materials, Techniques, and Skills in Art.................................70 ",P MUS 392 Recital I......................................................................300 
2,Pepperdine,P MUS 392 Recital I......................................................................300 ,P MUS 492 Recital II.....................................................................350 
3,Pepperdine,P MUS 492 Recital II.....................................................................350 ,P MUS 493 Composition Recital......................................................125 
4,Pepperdine,P MUS 493 Composition Recital......................................................125 ,P THEA 243 Stage Makeup...............................................................95 
5,Pepperdine,P THEA 243 Stage Makeup...............................................................95 ,P THEA 440 Scene Painting...........................................................125 
6,Pepperdine,P THEA 440 Scene Painting...........................................................125 ,P Certain other courses have fees that are listed with the course description in the Schedule of Classes. All course/departmental fees are nonrefundable. 
7,Pepperdine,"P SPAN 430 (PS, RM), SPAN 440 or SPAN 450 (RM, WI), ","P SPAN 470 (PS, RM, WI) History: HIST 200, 480, and 481 (PS, RM, WI) Integrated Marketing Communication: BA 352 (WI), COM 490 (RM) International Business: BA 366 (WI), BA 497 (RM), BA 498 (PS) International Studies: INTS 514 and INTS 497 (PS, RM, WI) Italian Studies: ITAL 341 (WI), ITAL 450 (RM, WI), ITAL 462 (PS, WI) Journalism: COM 300 (RM, WI), JOUR 445 (PS) Liberal Arts for Education: EDUC 490 (PS, RM, WI) Mathematics: MATH 320 (PS, RM, WI) Mathematics Education: MATH 320 (PS, RM, WI) Music: MUS 392 and MUS 492 (PS, RM, WI), MUS 354 and MUS 355 (RM, "
8,Pepperdine,"P SPAN 470 (PS, RM, WI) History: HIST 200, 480, and 481 (PS, RM, WI) Integrated Marketing Communication: BA 352 (WI), COM 490 (RM) International Business: BA 366 (WI), BA 497 (RM), BA 498 (PS) International Studies: INTS 514 and INTS 497 (PS, RM, WI) Italian Studies: ITAL 341 (WI), ITAL 450 (RM, WI), ITAL 462 (PS, WI) Journalism: COM 300 (RM, WI), JOUR 445 (PS) Liberal Arts for Education: EDUC 490 (PS, RM, WI) Mathematics: MATH 320 (PS, RM, WI) Mathematics Education: MATH 320 (PS, RM, WI) Music: MUS 392 and MUS 492 (PS, RM, WI), MUS 354 and MUS 355 (RM, ","P WI), MUS 493 (PS) Nutritional Science: NUTR 440 (WI), MATH 317 (PS, RM) Philosophy: PHIL 480 (PS, RM, WI) Physics: PHYS 201 (PS), PHYS 380 (RM, WI) Political Science: POSC 311, or 344, or 353 (WI), "
9,Pepperdine,"P POSC 250 or 310 or 460 (PS, RM) Psychology: PSYC 310 (PS, RM, WI) Public Relations: COM 300 (RM, WI), PR 555 (PS) Religion: REL 302, 502 (PS, RM, WI) Screen Arts: COM 300, 301, 302, 303 (RM, WI), SART 497 (PS) ","P Sociology: SOC 310 (PS, RM, WI) Sport Administration: BA 352 (WI), COM 302 or 303 (RM, WI), SPAD 480 (PS) Sports Medicine: MATH 317 (PS, RM) SPME 250 (RM, PS, WI), "
10,Pepperdine,P IPIN 295L International Programs’ Internship II (1–3) ,P Designed to accompany IPIN 295 in cases where a student seeks additional internship units. Offered only in International Programs. To be taken concurrently with IPIN 295. Cr/NC grading only. 
11,Pepperdine,P IPIN 495 International Programs’ Internship (1) ,"P A supervised academic internship in a student’s area of interest overseas in an international program. Internships may be with a non-profit, government agency, political, religious, educational, business or humanitarian organization. The student is required to maintain a regular schedule of on-duty hours each week and attend the internship seminar. Offered only in International Programs. "
12,Pepperdine,P IPIN 495L International Programs’ Internship II (1–3) ,P Designed to accompany IPIN 495 in cases where a student seeks additional internship units. Offered only in International Programs. To be taken concurrently with IPIN 495. Cr/NC grading only. 
13,Pepperdine,"P AC 224 Financial Accounting....................................................(4) BA 210 Introduction to Microeconomics (GE).............................. (3) BA 212 Business Computing Applications................................... (2) BA 216 Statistical Analysis for Business Decisions.........................(4) ECON 211 Introduction to Macroeconomics (GE)............................. (3) MATH 140 Calculus for Business and Economics (GE)........................(4) MATH 141 Probability, Linear Systems, and ",P Multivariable Optimization (GE).....................................(4) 
14,Pepperdine,"P AC 310 Intermediate Accounting I..............................................(4) AC 311 Intermediate Accounting II............................................(4) AC 312 Advanced Accounting...................................................(4) AC 313 Cost Analysis.............................................................. (3) AC 314 Advanced Cost Analysis and Systems.............................. (3) AC 422 Income Tax Accounting.................................................(4) AC 425 Auditing.....................................................................(4) AC 429 Seminar in Accounting Theory...................................... (3) or AC 501 Ethics for Accounting....................................................(4) or AC 540 Accounting Theory: Research and Policy..........................(4) BA 321 Financial Management..................................................(4) BA 355 Principles of Marketing................................................. (3) BA 358 Legal and Regulatory Environment of Business................. (3) BA 366 Organizational Behavior (WI)........................................ (3) BA 497 Business Policy, Strategy, and Ethics (RM).........................(4) BA 498 Service Leadership Project (PS).......................................(4) ",P Bachelor of Science in Business Administration 
15,Pepperdine,P AC 224 Financial Accounting....................................................(4) AC 225 Managerial Accounting................................................. (3) BA 210 Introduction to Microeconomics (GE).............................. (3) ,"P BA 212 Business Computing Applications................................... (2) BA 216 Statistical Analysis for Business Decisions.........................(4) ECON 211 Introduction to Macroeconomics (GE)............................. (3) MATH 140 Calculus for Business and Economics (GE)........................(4) MATH 141 Probability, Linear Systems, and "
16,Pepperdine,"P BA 212 Business Computing Applications................................... (2) BA 216 Statistical Analysis for Business Decisions.........................(4) ECON 211 Introduction to Macroeconomics (GE)............................. (3) MATH 140 Calculus for Business and Economics (GE)........................(4) MATH 141 Probability, Linear Systems, and ",P Multivariable Optimization (GE).....................................(4) 
17,Pepperdine,"P BA 321 Financial Management..................................................(4) BA 352 Management Theory and Practice (WI)............................ (3) or BA 366 Organizational Behavior (WI)........................................ (3) BA 355 Principles of Marketing................................................. (3) BA 358 Legal and Regulatory Environment of Business................. (3) BA 445 Managerial Economics.................................................. (3) BA 451 Operations Management............................................... (3) BA 452 Quantitative Analysis................................................... (3) BA 497 Business Policy, Strategy, and Ethics (RM).........................(4) BA 498 Service Leadership Project (PS).......................................(4) ",P One upper-division business elective course also required (3–4 units). 
18,Pepperdine,"P AC 224 Financial Accounting....................................................(4) AC 225 Managerial Accounting................................................. (3) BA 210 Introduction to Microeconomics (GE).............................. (3) BA 212 Business Computing Applications................................... (2) BA 216 Statistical Analysis for Business Decisions.........................(4) ECON 211 Introduction to Macroeconomics (GE)............................. (3) MATH 140 Calculus for Business and Economics (GE)........................(4) MATH 141 Probability, Linear Systems, and ",P Multivariable Optimization (GE).....................................(4) 
19,Pepperdine,"P BA 321 Financial Management..................................................(4) BA 355 Principles of Marketing................................................. (3) BA 358 Legal and Regulatory Environment of Business................. (3) BA 366 Organizational Behavior (WI)........................................ (3) BA 447 International Finance................................................... (3) BA 451 Operations Management............................................... (3) or BA 452 Quantitative Analysis................................................... (3) BA 457 The Legal Environment of International Business.............. (3) BA 474 International Marketing................................................ (3) BA 497 Business Policy, Strategy, and Ethics (RM).........................(4) BA 498 Service Leadership Project (PS).......................................(4) ","P In addition to the lower- and upper-division core courses, the student must "
20,Pepperdine,P BA 355 Principles of Marketing ................................................ (3) ,P BA 470 Marketing Research......................................................(4) 
21,Pepperdine,P BA 470 Marketing Research......................................................(4) ,P (Prerequisites: BA 355 and one of the following: 
22,Pepperdine,"P BA 216, POSC 250, SOC 250, COM 240, ",P or ECON310 or consent of instructor) BA 471 Marketing Strategy (prerequisite BA 355)......................... (3) BA 474 International Marketing (prerequisite BA 355).................. (3) 
23,Pepperdine,P ECON 200 Economic Principles (GE)..............................................(4) or BA 210 Introduction to Microeconomics..................................... (3) BA 352 Management Theory and Practice................................... (3),P  or BA 366 Organizational Behavior............................................... (3) BA 355 Principles of Marketing BA 470 Marketing Research......................................................(4) 
24,Pepperdine,"P AC 314, AC 429, or AC 501, or AC 540, BA 358, BA 366, BA 497 ",P Business Administration Major: 
25,Pepperdine,"P BA 358, BA 457, BA 497, Two Upper-Division, International Business Electives ","P See the Graziadio Business School catalog for specific details of the five-year program: 
"
26,Pepperdine,P AC 225 Managerial Accounting (3) ,P Management use of accounting data for planning and control; theories and practices of cost accounting and analysis of data for management decision-making. This course is intended for non-accounting majors. Prerequisite: Completion of AC 224 with a grade of C- or higher. AC 292 Special Topics (1–4) AC 310 Intermediate Accounting I (4) 
27,Pepperdine,P AC 311 Intermediate Accounting II (4) ,"P A continuation of AC 310. Emphasis in this course is on accounting for pensions, leases, income tax allocations, price changes, and stockholders’ equity. Prerequisites: Full admittance as an accounting major, or a C- or higher in AC 310 and permission of the instructor. "
28,Pepperdine,P AC 312 Advanced Accounting (4) ,"P The application of accounting theory to various forms of organizations, partnerships, corporations, consolidations, and mergers. Prerequisites: AC 311 and full admittance as an accounting major. "
29,Pepperdine,P AC 313 Cost Analysis (3) ,"P A study of cost accounting theory and practice, including such topics as inventory costing, standard costs, cost/volume profit relationships, incremental profit analysis, capital budgeting, and pricing decisions. Prerequisites: Completion of both AC 224 and BA 216 with a grade of C- or higher. "
30,Pepperdine,P AC 314 Advanced Cost Analysis and Systems (3) ,"P A discussion of systems analysis, design, and implementation; management control systems and current manufacturing control systems; and advanced cost analysis, including quantitative applications. Topics are discussed in the context of management decision-making tools. Prerequisite: AC 313. "
31,Pepperdine,P AC 422 Income Tax Accounting (4) ,"P A comprehensive study of the federal income tax structure as related to individuals, including problems intended to provide a thorough understanding of the law. Some attention is also directed to the determination of the tax liability of corporations. Prerequisite: AC 224. "
32,Pepperdine,P AC 425 Auditing (4) ,"P A consideration of the auditing standards and procedures associated with accounting investigations, balance sheet audits, and detailed audits performed by professional public accountants. Prerequisites: AC 311 and full admittance as an accounting major. "
33,Pepperdine,P AC 429 Seminar in Accounting Theory (3) ,"P An investigation of the underlying concepts of accounting, income determination, and asset valuation. Contributions to accounting thought by individual theorists are examined, and current official pronouncements by the Financial Accounting Standards Board and other professional organizations are reviewed. Prerequisites: AC 312, AC 313, AC 425, and full admittance as an accounting major. AC 492 Selected Topics (1–4) AC 495 Experiential Learning for Accounting (1–4) "
34,Pepperdine,P AC 499 Directed Studies (1–4) ,P Consent of divisional dean is required. 
35,Pepperdine,P AC 501 Ethics for Accounting (4) ,"P This course provides an in-depth study of professional and regulatory ethics and of the foundations of accounting ethical standards and practices. The course includes topics such as permissible financial interests, the regulations surrounding provision of non-audit services, the standards relating to independence and conflicts of interest, and various approaches to ethical reasoning. Prerequisites: Graduate student status, or full admission as an accounting major and senior status, or permission of instructor. "
36,Pepperdine,P AC 506 Advanced Taxation and Ethics (4) ,"P This course introduces students to the federal tax concepts applicable to business entities and to the code of ethics for tax professionals. Emphasis is placed on differences between tax and financial accounting concepts. Additionally, students are exposed to tax planning, ethical standards for tax professionals, and tax research. Special topics, such as the accounting for gifts, estates, trusts, and exempt entities, as well as multistate corporate taxation, may be covered. Prerequisites: Graduate student status or permission of instructor. "
37,Pepperdine,P AC 511 Accounting for Nonbusiness Organizations (4) ,"P This course covers the accounting principles and theory underlying the accounting for governments and other not-for-profit entities. The course focuses on preparation, analysis and interpretation of nonbusiness organizations’ financial reports. Prerequisite: Graduate student status or permission of instructor. "
38,Pepperdine,P AC 517 Financial Statement Analysis (4) ,"P This course focuses on methods used when performing financial analyses related to a company’s profitability, risk, liquidity, and market value, and demonstrates the techniques employed to forecast future earnings and cash flows based on past performance. The course also discusses the influence that financial reporting and disclosure policies have on managerial decision-making. Topics of current interest, especially those related to financial statement fraud and corporate governance, may also be discussed. Prerequisites: Graduate student status or permission of instructor. "
39,Pepperdine,P AC 524 Advanced Auditing (4) ,"P This course covers auditing and assurance topics in depth from professional and research perspectives. Topics covered include audit research, fraud, going concern judgments, professional ethics and litigation issues. Concepts and principles governing independence are examined. Topics of current interest, especially those related to assurance services in an e-business environment and the development of international auditing standards, may also be covered. Prerequisites: Graduate student status or permission of instructor. "
40,Pepperdine,P AC 540 Accounting Theory: Research and Policy (4) ,"P This course examines the conceptual framework for accounting, as well as the rationales underlying topics related to income determination, asset valuation and other complex and emerging accounting issues. Contributions to accounting thought are studied from both normative and positive perspectives. The course seeks to develop an appreciation for the impact of accounting theory on practice and policy. The course also addresses international financial reporting issues and the issues surrounding the development of a global set of accounting standards. Prerequisites: Graduate student status, or full admission as an accounting major and senior status, or permission of instructor. "
41,Pepperdine,P BA 212 Business Computing Applications (2) ,"P An introduction to the fundamental business concepts of problem solving, data analysis, and reporting. The course will target mastery of these concepts via office suite applications. Strong focus on data analysis and problem solving with Microsoft Office Excel and creating robust business reports with Microsoft Office Word. Platform: Windows PC. "
42,Pepperdine,P BA 216 Statistical Analysis for Business Decisions (4) ,"P A study of statistical techniques for business decisions, including descriptive and inferential statistics. Topics include tabulation and presentation of data, probability distributions, hypothesis testing, estimation, the impact of sample size, linear regression, and correlation. Prerequisites: MATH 141 and BA 212 with a grade of C- or better. "
43,Pepperdine,P BA 220 Accounting and Finance for Non-Business Majors (4) ,"P This course is a study of the basic principles of accounting and finance. It covers the interrelationship between the financial markets and business organizations. Also, the course introduces the practice, preparation, and interpretation of general-purpose financial statements with emphasis on external reporting responsibilities of the corporation. Topics include the preparation of budgets, methods and costs of borrowing, the impact of credit, interest rates, business risk, and financial investment. Not open to business majors. BA 292 Special Topics (1–4) BA 320 Personal Finance (4) "
44,Pepperdine,P BA 321 Financial Management (4) ,"P A study of market-driven theories for analyzing business investment opportunities, working capital management, financing decisions, and dividend distribution decisions that lead to maximization of shareholder value. Topics include financial markets and the efficient markets hypothesis, portfolio theory, capital budgeting models, cost of capital and capital structure theory, valuation of debt and equity securities, and dividend policy. Prerequisite: full admittance as a major within the division. "
45,Pepperdine,P BA 352 Management Theory and Practice (3) ,"P A study of the basic concepts of management built on an understanding of organizational theory. Equal emphasis is placed on theoretical and operational aspects of the manager’s role in organizations. The course deals with management issues: planning and controlling, structuring and staffing, directing and leading, and business and society with a special emphasis on managerial ethics. Prerequisite: ENG 101 or equivalent. (WI) "
46,Pepperdine,P BA 354 Human Resources Management (4) ,"P Through selected readings and case analysis, students study employer/ employee relationships, personnel policies, operations and training, techniques of personnel administration, recruitment, inductions, communication, and discipline. "
47,Pepperdine,P BA 355 Principles of Marketing (3) ,"P An in-depth investigation of marketing principles and practices. Content areas are segment identification, product concept and design, distribution practices, promotion strategies, and pricing decisions. There is an emphasis on understanding consumer behavior through modern research techniques. Students meet individually with marketing executives and create a marketing plan. "
48,Pepperdine,P BA 358 Legal and Regulatory Environment of Business (3) ,"P An examination of the political, legal, ethical, and regulatory processes pertaining to profit and nonprofit organizations and management decisions. Emphasis is given to negotiating legally enforceable contracts, managing to avoid legal disputes, resolving legal disputes cost-effectively, understanding the various forms of business organizations, and enabling the student to appreciate the legal and regulatory systems influencing business. "
49,Pepperdine,P BA 366 Organizational Behavior (3) ,"P An integrated and interdisciplinary study of behavioral science for management. The course attempts to integrate the psychological and sociological aspects of human behavior as they relate to management. Focus is on individual, group, and organizational behavior. Topics include communication, motivation, group dynamics, leadership, power, reward systems, organizational structure, and managing conflict and change. Prerequisite: ENG 101 or equivalent. (WI) "
50,Pepperdine,P BA 400 Venture Initiation (4) ,"P This course is primarily designed for those who want to start their own businesses. Focus is on new venture initiation and the preparation of a sound business plan. In-depth coverage is given to characteristics of successful entrepreneurs, organizing a management team, obtaining venture capital, market potential analysis, and identification of business opportunities. "
51,Pepperdine,P BA 410 Business Ethics (4) ,P The primary aim of this course is to help students acquire skills in the analysis of ethical problems in the business world. (BA 410 is equivalent to PHIL 410.) 
52,Pepperdine,P BA 440 Real Estate Investment (4) ,"P A general overview of the concepts, theories, principles, and terminology of real estate investment analysis, with special emphasis placed upon the study of real estate markets and the use of market feasibility analysis. Other topics include real estate finance, market valuation techniques, and the legal aspects of real estate transactions. Prerequisite: BA 321 or BA 220. "
53,Pepperdine,P BA 442 Financial Markets and Institutions (4) ,"P Finance theory and economic theory are utilized to study the markets for financial assets. The market for loanable funds, including the role of financial intermediaries, is analyzed. The nature of, and interrelationship between, the money market and the markets for equity and debt instruments are also investigated. Prerequisite: BA 321. "
54,Pepperdine,P BA 445 Managerial Economics (3) ,"P An exposition of theoretical and quantitative tools of economics that are useful in managerial decision making. Special emphasis will be placed upon the following topics: demand analysis and short-range forecasting, resource formulation, and benefit/cost analysis. Prerequisite: Full admittance as a major within the division. "
55,Pepperdine,P BA 447 International Finance (3) ,"P An analysis of international financial transactions. Special emphasis will be given to the unique opportunities and practical problems created by investing and borrowing across borders. Topics include the reasons for increased international financial activity, the differences in financial institutions, exchange rate risk, strategies to reduce exchange rate risk, and the international markets for debt and equity. Prerequisite: BA 321. "
56,Pepperdine,P BA 448 Investments (4) ,"P A study of the types of investment media centering attention on stocks for investment and speculation; technical approach to analysis of price patterns, trends, and turning points. Also emphasized are objectives, risks, and valuation typical in investment and the development of a rational investment philosophy. Prerequisites: BA 216 and BA 321. This course must be taken for a letter grade. "
57,Pepperdine,P BA 449 Portfolio Management (3) ,"P The main objective of this course is to provide students with the opportunity to apply financial theories and models in making real investment decisions and managing a portfolio of financial assets and thus gain valuable hands-on experience in investments, asset allocation, and portfolio management. Course requirements will include designing investment strategies, preparing and presenting security research reports, implementing investment decisions, monitoring portfolio performance and compliance with investment guidelines, making decisions regarding portfolio adjustments, record keeping, and portfolio performance evaluations. Prerequisite: BA 448 or consent of instructor. "
