,School,CourseID,Descriptions
833,Pepperdine,P CHEM 310L Organic Chemistry I Laboratory (1) ,"P Three hours of laboratory per week. Practical application of techniques in organic chemistry, including the syntheses and analyses of organic compounds. Concurrent enrollment in a one-hour pre-laboratory course (CHEM 310P) is a requirement to enroll in this course. Designed to accompany CHEM 310. Tier II laboratory fee will be assessed. "
834,Pepperdine,P CHEM 311 Organic Chemistry II (3) ,P A continuation of Organic Chemistry I. Includes both aliphatic and aromatic compounds and spectral analysis. Three lectures per week. Prerequisite: C- or better in CHEM 310. To be taken concurrently with CHEM 311L. 
835,Pepperdine,P CHEM 311L Organic Chemistry II Laboratory (1) ,P Three hours of laboratory per week. Continuation of CHEM 310L. Synthesis and spectroscopy of organic compounds. Concurrent enrollment in a one-hour pre-laboratory course (CHEM 311P) is a requirement to enroll in this course. Designed to accompany CHEM 311. Tier II laboratory fee will be assessed. 
836,Pepperdine,P CHEM 320 Physiological Chemistry (4) ,"P A study of human biochemistry encompassing bioenergetics; carbohydrate, protein, and lipid metabolism; the roles of vitamins and minerals in metabolism; endocrinology; and regulation of metabolic pathways. Three lectures and one three-hour laboratory per week. Prerequisite: CHEM 311. Tier II laboratory fee will be assessed. "
837,Pepperdine,P CHEM 330 Cellular Biochemistry (3) ,"P A study of cell growth and ultrastructure, chemistry of water, cellular macromolecules, enzyme mechanisms and kinetics, coenzymes and vitamins, bioenergetics, glycolysis, fermentation, electron transport, Krebs’ cycle and related catabolic pathways, introduction to photosynthesis. Three lectures per week. To be taken concurrently with CHEM 330L. Prerequisite: CHEM 310 with a C- or better. "
838,Pepperdine,P CHEM 330L Cellular Biochemistry Laboratory (1) ,"P Three hours of laboratory per week. Students will learn practical laboratory biochemical techniques such as protein purification, enzyme kinetics, and bioinformatics through hands-on application of these methods. Concurrent enrollment in a one-hour pre-laboratory lecture (CHEM 330P) is a requirement to enroll in this course. Designed to accompany CHEM 330. Prerequisite: CHEM 310 with a C- or better. Tier II laboratory fee will be assessed. CHEM 330P Chemistry 330 Pre-Lab (0) CHEM 331 Advanced Cellular Biochemistry (4) "
839,Pepperdine,P CHEM 340 Quantitative Chemistry (3) ,"P A study of the principles and techniques of quantitative analytical chemistry. Emphasis is placed on chemical equilibrium, classical volumetric and gravimetric analysis, and electrochemistry and spectroscopy. Three lectures per week. Prerequisite: CHEM 121 with a C- or better. To be taken concurrently with CHEM 340L. (WI) "
840,Pepperdine,P CHEM 340L Quantitative Analysis Laboratory (1) ,"P Four hours laboratory per week. Laboratory consists of an introduction to classical and modern methods of volumetric, gravimetric, and electrochemical analyses. Designed to accompany CHEM 340. Tier II laboratory fee will be assessed. (WI) "
841,Pepperdine,P CHEM 341 Instrumental Analysis (3) ,P A study of the theory and applications of modern instrumental methods of chemical analysis. Three lectures per week. Prerequisites: C- or better in CHEM 310 and CHEM 340 or consent of instructor. 
842,Pepperdine,P CHEM 341L Instrumental Analysis Laboratory (1) ,"P Four hours laboratory per week. Emphasis is placed on spectroscopy, nuclear magnetic resonance, gas and liquid chromatography, atomic absorbance, and other instrumental techniques. Designed to accompany CHEM 341. Tier II laboratory fee will be assessed. (PS, RM) "
843,Pepperdine,P CHEM 370 Physical Chemistry I (3) ,"P Studies physical and chemical properties of matter in the gaseous, liquid, and solid states. Topics include classical thermodynamics, statistical mechanics, electrochemistry, and the structure of matter. To be taken concurrently with CHEM 370L. Three lectures per week. Prerequisites: C- or better in CHEM 341, MATH 250, and PHYS 211. "
844,Pepperdine,P CHEM 370L Physical Chemistry I Laboratory (1) ,"P Four hours laboratory per week. Laboratory experiments will involve the study of fundamentals of thermodynamics, electrochemistry, statistical analysis, and data processing. Designed to accompany CHEM 370. Tier II laboratory fee will be assessed. (PS, RM) "
845,Pepperdine,P CHEM 371 Physical Chemistry II (3) ,"P A continuation of Physical Chemistry I. Topics include quantum mechanics, structure, spectroscopy, statistical mechanics, and chemical kinetics. To be taken concurrently with CHEM 371L. Three lectures per week. Prerequisite: C- or better in CHEM 370. "
846,Pepperdine,P CHEM 371L Physical Chemistry II Laboratory (1) ,P Four hours laboratory per week. A continuation of Physical Chemistry 
847,Pepperdine,P CHEM 390 Inorganic Chemistry (3) ,"P Examines the properties, structures, bonding, and reactions of compounds made up of metals, non-metals, and metalloids. The course is organized around the different segments of the periodic table with emphasis on the transition elements and their compounds. To be taken concurrently with CHEM 390L. Three lectures per week. Prerequisite: C- or better in CHEM 311. "
848,Pepperdine,P CHEM 390L Inorganic Chemistry Laboratory (1) ,"P Four hours laboratory per week. Laboratory involves inorganic synthesis and characterization using magnetic spectroscopic, analytical, and electrochemical methods. Designed to accompany CHEM 390. Tier II laboratory fee will be assessed. (PS, RM) "
849,Pepperdine,P CHEM 400 Environmental Chemistry (3) ,"P A study of the chemical processes in the environment: topics include photochemical smog, stratospheric ozone depletion, global warming, the pollution and purification of water, and alternative energy. Introduces the student majoring in chemistry to the chemistry research library and literature searching techniques through environmental topics. Students will read a collection of sources from the primary and secondary chemical literature and gain expertise in speaking about chemistry research topics through the presentation of formal seminars. Prerequisites: C- or better in CHEM 310 and CHEM 340. (PS, RM) "
850,Pepperdine,P CHEM 430 Bio-Organic Chemistry (3) ,P A study of the classes of organic functional groups found in biological systems. Three lectures per week. Prerequisite: C- or better in CHEM 311. 
851,Pepperdine,P CHEM 440 Advanced Analytical Chemistry (3) ,P A continued study of the theoretical principles of analytical instrumentation with an emphasis on chemical separations and spectroscopy. Three lectures per week; laboratory in conjunction with some lectures. Prerequisites: C- or better in CHEM 340 and CHEM 341. Tier II laboratory fee will be assessed. 
852,Pepperdine,P CHEM 490 Research In Chemistry (1–4) ,P Original or classical research in the field of chemistry. Taken only with consent of a selected faculty member. A complete written report of work is required. 
853,Pepperdine,P CHEM 492 Selected Topics (1–4) ,P The Tier I or Tier II laboratory fee will be assessed if the course is offered with a required laboratory component. 
854,Pepperdine,P CHEM 499 Directed Studies (1–4) ,P Consent of the divisional dean is required. The Tier I or Tier II laboratory fee will be assessed if the course is offered with a required laboratory component. 
855,Pepperdine,P COSC 105 Programming Principles I with R (3) ,"P Introduction to programming with the R language. Data types: numeric, character, and logical. File input/output. Programing constructs: sequential, conditional, iterative, nested conditional, nested iterative. Run time analysis. Functions: parameter passing mechanisms, function libraries. Data structures: vectors, matrices, lists, data frames. "
856,Pepperdine,P COSC 121 Programming Principles II (3) ,"P Introduction to object-oriented programming with the C++ Language. Recursion -- basic algorithms, array searching and sorting. Dynamic storage allocation -- pointer types, linked lists and binary search trees as abstract data types. Classes -- objects, abstract classes, inheritance and polymorphism, linked lists and binary trees as classes. Prerequisites: C- or better in COSC 101 or COSC 105. "
857,Pepperdine,P COSC 292 Special Topics (1–4) COSC 299 Directed Studies (1–4) ,P Consent of divisional dean is required. 
858,Pepperdine,P COSC 320 Data Structures (4) ,"P Data structures and design patterns with the C++ language. Analysis of algorithms. Sorting algorithms -- insertion sort, merge sort, heapsort, quicksort. Linear data structures -- stacks, queues, linked lists. Dictionaries. Hash tables. Trees -- binary search trees, red-black trees, B-trees. Graphs -- search algorithms. Design patterns--iterator, composite, state, visitor. Prerequisite: C- or better in COSC 121 and MATH 221 or concurrent enrollment. "
859,Pepperdine,P COSC 330 Computer Systems (3) ,"P A study of computers as multi-level systems. The machine level: binary representations, instruction sets, von Neumann machines. The assembly level: addressing modes, compiling to the assembly level, language translation principles. The operating system level: loaders, interrupts. Prerequisite: C- or better in COSC 121 "
860,Pepperdine,P COSC 425 Computer Organization (3) ,"P Hardware organization and design. The logic gate level: combinational and sequential circuits and devices. The microprogramming level: microarchitecture, microprograms. The machine level: CPU designs, instruction formats, addressing modes, floating point formats. Parallel architectures. Occasional laboratory sessions. Prerequisite: C- or better in COSC 330. "
861,Pepperdine,P COSC 450 Programming Paradigms (4) ,"P A study of three programming paradigms and their associated languages: the functional paradigm with Scheme, the logical/declarative paradigm with Prolog, and the concurrent processing paradigm with Java. Prerequisite: C- or better in COSC 121 and MATH 221 or concurrent enrollment. "
862,Pepperdine,P COSC 465 Operating Systems (3) ,"P Operating systems design and implementation: process management, device management, memory management, file management, protection and security. Prerequisites: C- or better in COSC 330 and COSC 450. "
863,Pepperdine,P COSC 475 Computer Networks (4) ,"P The theory of computer networks and its applications. Network layers and protocols for the OSI reference model. TCP/IP and the internet. Network programming using the Java language. Rudiments of queuing theory. Prerequisites: COSC 330, COSC 450 or concurrent enrollment. "
864,Pepperdine,P COSC 490 Senior Capstone (4) ,"P A large software team project based on a topic that may vary from year to year and which builds on one or more of the prerequisites. Possible topics include but are not limited to database, computer graphics, artificial intelligence, compiler construction, distributed computing. Oral presentation required. Prerequisites: COSC 450, COSC 475, MATH 260, and MATH 365. (PS, RM, WI) "
865,Pepperdine,P COSC 492 Selected Topics (1–4) COSC 495 Internship in Computing (1–4) ,"P A supervised internship in a computing environment. Placement will be in a business, industry, service organization, or government institution. In addition to frequent consultation with the instructor on campus, the student will submit written reports of activities and will make an oral presentation to the computer science/math faculty at the conclusion of the work experience. Prerequisites: completion of at least 90 units with a minimum 3.0 grade point average and approval of the Computer Science/Math Internship Committee. "
866,Pepperdine,P COSC 497 Research in Computer Science (1–4) ,P Research in the field of computer science. May be taken with the consent of a selected faculty member. The student will be required to submit a written research paper to the faculty member. 
867,Pepperdine,P COSC 499 Directed Studies (1–4) ,P Consent of the divisional dean is required. 
868,Pepperdine,P GSNS 199 First-Year Seminar (3) ,P MATHEMATICS MATH 99 Intermediate Algebra (4) 
869,Pepperdine,P MATH 103 College Algebra (3) ,"P A study of the real number system, equations and inequalities, polynomial and rational functions, exponential and logarithmic functions, complex numbers, systems of linear and nonlinear equations and inequalities, matrices, and introduction to analytic geometry. The emphasis of this course will be on logical implications and the basic concepts rather than on symbol manipulations. Prerequisite: C- or better in MATH 099 or appropriate score on math placement exam. "
870,Pepperdine,P MATH 104 Trigonometry (2) ,"P Trigonometric functions, functional relations, solution of right and oblique triangles with applications, identities, inverse functions, trigonometric equations, and vectors. Prerequisite: MATH 103 or concurrent enrollment. "
871,Pepperdine,P MATH 120 The Nature of Mathematics (3) ,"P An exploration of the vibrant, evolutionary, creative, practical, historical, and artistic nature of mathematics, while focusing on developing reasoning ability and problem-solving skills, Core material includes logic, probability/statistics, and modeling, with additional topics chosen from other areas of modern mathematics. (GE) "
872,Pepperdine,P MATH 130 Colloquium for Mathematics (1) ,P Designed to introduce entering math majors to the rich field of study available in mathematics. Required for all math majors during their first year at Pepperdine. One lecture period per week. Cr/NC grading only. 
873,Pepperdine,P MATH 140 Calculus for Business and Economics (4) ,"P Derivatives: definition using limits, interpretations and applications such as optimization. Basic integrals and the fundamental theorem of calculus. Business and economic applications such as marginal cost, revenue and profit, and compound interest are stressed. Prerequisites: C- or better in MATH 103 or appropriate score on math placement exam. (GE) "
874,Pepperdine,"P MATH 141 Probability, Linear Systems, and Multivariable Optimization (4) ","P Functions of several variables, partial derivatives, multivariable optimization, matrices, systems of linear equations, discrete probability theory, conditional probability, Bayes’ Theorem, random variables, expected value, variance, normal distributions. Business and economic applications stressed. Prerequisite: C- or better in MATH 140 or MATH 150 or equivalent (AP Calculus AB or BC). (GE) "
875,Pepperdine,P MATH 150 Calculus I (4) ,"P Limits of function and their associated geometry, parametric equations, derivatives of algebraic and transcendental functions, and applications of differentiation. The definite integral and basic applications; the fundamental theorem of calculus. Prerequisite: C- or better in MATH 103 and MATH 104 or equivalent, or appropriate score on math placement exam. (GE) "
876,Pepperdine,P MATH 151 Calculus II (4) ,"P Integration techniques, improper integrals; additional applications of integration; an introduction to differential equations; infinite sequences and series; an introduction to vector algebra. Prerequisite: C- or better in MATH 150 or equivalent (AP Calculus AB). (GE) "
877,Pepperdine,P MATH 220 Formal Methods (3) ,"P Formal logic as a tool for mathematical proofs. Propositional calculus: Boolean expressions, logic connectives, axioms, and theorems. Predicate calculus: universal and existential quantification, modeling English propositions. Application to computer program specification, verification, and derivation. Prerequisite: C- or better in MATH 103 and MATH 104 or equivalent, or appropriate score on math placement exam. (GE) "
878,Pepperdine,P MATH 221 Discrete Structures (3) ,"P Application of formal methods to discrete analysis mathematical induction, the correctness of loops, relations and functions, combinatorics, analysis of algorithms. Application of formal methods to the modeling of discrete structures of computer science sets, binary trees. Prerequisite: C- or better in MATH 220. "
879,Pepperdine,P MATH 250 Calculus III (4) ,"P Vectors, analytic geometry and calculus of curves and surfaces in three-dimensional space, functions of several variables, partial derivatives, gradient, multiple integration. Vector calculus, including fields, line and surface integrals, Green’s, Stokes’, and Divergence Theorems. Prerequisite: C- or better in MATH 151 or equivalent (AP Calculus BC). (GE) "
880,Pepperdine,P MATH 260 Linear Algebra (4) ,"P Systems of linear equations and linear transformations; matrix determinant, inverse, rank, eigenvalues, eigenvectors, factorizations, diagonalization, singular value, decomposition; linear independence, vector spaces and subspaces, bases, dimensions; inner products and norms, orthogonal projection, Gram-Schmidt process, least squares; applications; numerical methods, as time follows. Prerequisite: C- or better in MATH 250 or concurrent enrollment. "
881,Pepperdine,P MATH 270 Foundations of Elementary Mathematics I (4) ,"P This course is intended for liberal arts for education majors, who are multiple-subject teacher candidates. It addresses the foundational understandings and pedagogical content knowledge for mathematics up through grade five including the state-adopted academic content and practice standards in mathematics. Topics include counting and cardinality; number sense; base 10 place value; operations and connections to early algebra; the relationship between addition, subtraction, multiplication, and division; number theory topics, including prime factorization, GCD and LCM; fractions as part of whole and ratio; as well as operations on fractions. Students will apply and develop the standards for mathematical practice by considering children’s mathematical thinking and learning trajectories related to these concepts, as well as by engaging the above topics through their own mathematical explorations. This course meets the GE math requirement for liberal arts for education majors. "
882,Pepperdine,P MATH 271 Foundations of Elementary Mathematics II (3) ,"P This course is intended for liberal arts for education majors who are multiple subject teacher candidates. It addresses the foundational understandings and pedagogical content knowledge for mathematics up through grade five, including the state-adopted academic content and practice standards in mathematics. Topics include geometry, probability, statistics, and measurement. Students will apply and develop the standards for mathematical practice by considering children’s mathematical thinking and learning trajectories related to these concepts, as well as by engaging the above topics through their own mathematical explorations. Prerequisite: C-or better in MATH 270. "
883,Pepperdine,P MATH 292 Special Topics (1–4) MATH 299 Directed Studies (1–4) ,P Consent of divisional dean is required. 
884,Pepperdine,P MATH 316 Biostatistics (3) ,"P Statistics for the biological sciences. Random sampling; measures of central tendency; dispersion and variability; probability; normal distribution; hypothesis testing (one-sample, two-sample, and paired-sample) and confidence intervals; multi-sample hypotheses and the one- and two-factor analysis of variance; linear and multiple regression and correlation; other chi-square tests; nonparametric statistics. Prerequisite: C- or better in MATH 150 or permission of instructor. (GE) "
885,Pepperdine,P MATH 317 Statistics and Research Methods Laboratory (1) ,"P A study of the application of statistics and research methods in the areas of biology, sports medicine, and/or nutrition. The course stresses critical thinking ability, analysis of primary research literature, and application of research methodology and statistics through assignments and course projects. Also emphasized are skills in experimental design, data collection, data reduction, and computer-aided statistical analyses. One two-hour session per week. Corequisite: MATH 316 or consent of instructor. (PS, RM) "
886,Pepperdine,P MATH 320 Transition to Abstract Mathematics (4) ,"P Bridges the gap between the usual topics in elementary algebra, geometry, and calculus and the more advanced topics in upper-division mathematics courses. Basic topics covered include logic, divisibility, the Division Algorithm, sets, an introduction to mathematical proof, mathematical induction and properties of functions. In addition, elementary topics from real analysis will be covered including least upper bounds, the Archimedean property, open and closed sets, the interior, exterior and boundary of sets, and the closure of sets. Prerequisite: C- or better in MATH 151. (PS, RM, WI) "
887,Pepperdine,P MATH 325 Mathematics for Secondary Education (4) ,"P Covers the development of mathematical topics in the K-12 curriculum from a historical perspective. Begins with ancient history and concludes with the dawn of modern mathematics and the development of calculus. Considers contributions from the Hindu-Arabic, Chinese, Indian, Egyptian, Mayan, Babylonian and Greek people. Topics include number systems, different number bases, the Pythagorean Theorem, algebraic identities, figurate numbers, polygons and polyhedral, geometric constructions, the Division Algorithm, conic sections and number sequences. Course also covers the NCTM standards for K-12 content instruction and how to build mathematical understanding into a K-12 curriculum. Prerequisite: C- or better in MATH 320 or concurrent enrollment. "
888,Pepperdine,P MATH 335 Combinatorics (4) ,"P Topics include basic counting methods and theorems for combinations, selections, arrangements, and permutations, including the Pigeonhole Principle, standard and exponential generating functions, partitions, writing and solving linear, homogenous and inhomogeneous recurrence relations and the principle of inclusion-exclusion. In addition, the course will cover basic graph theory, including basic definitions, Eulerian and Hamiltonian circuits and graph coloring theorems. Throughout the course, learning to write clear and concise combinatorial proofs will be stressed. Prerequisites: C- or better in MATH 151 and MATH 320 or concurrent enrollment in MATH 320 or consent of the instructor. "
889,Pepperdine,P MATH 340 Differential Equations (4) ,"P A study of ordinary differential equations, including linear, separable, and exact first order differential equations; linear second order and nth order differential equations; linear and nonlinear systems of equations; Laplace transforms and power series methods; existence and uniqueness properties, growth and decay models, logistic models and population dynamics; Euler’s method, Runge-Kutta methods if time allows. Prerequisite: C- or better in MATH 260. "
890,Pepperdine,P MATH 345 Numerical Methods (4) ,"P Numerical methods and error analysis; methods for finding roots of single-variable functions; interpolation and extrapolation; numerical differentiation and integration; iterative methods for linear and nonlinear systems; approximation of general functions with polynomials or trigonometric functions; methods for initial-value problems for ordinary differential equations; finite difference methods for boundary value problems including ordinary and partial differential equations, as time allows. Prerequisite: C- or better in MATH 260. "
891,Pepperdine,P MATH 350 Mathematical Probability (4) ,"P The theory of probability from counting and from axioms, conditional probability, independence, random variables, important discrete and continuous distributions, properties of expected value and variance, moment generating functions, law of large numbers, and central limit theorem. Other topics may include stochastic processes, random walks, hazard functions, Shannon entropy and information theory, game theory, expected time complexity of algorithms, probabilistic proofs, empirical versus Bayesian interpretations of probability, risk analysis, and applications to genetics, statistics, economics, and queuing theory. Prerequisites: C- or better in MATH 250 and either MATH 221 or MATH 320. "
892,Pepperdine,P MATH 355 Complex Variables (4) ,"P An introduction to the theory and applications of complex numbers and complex-valued functions. Topics include the complex number system, Cauchy-Riemann conditions, analytic functions and their properties, complex integration, Cauchy’s theorem, Laurent series, conformal mapping and the calculus of residues. Prerequisites: C- or better in MATH 250 and MATH 320 or concurrent enrollment in MATH 320 or consent of the instructor. "
893,Pepperdine,P MATH 365 Automata Theory (3) ,"P Theoretical models of computation. Finite automata: regular expressions, Kleene’s theorem, regular and nonregular languages. Pushdown automata: context-free grammars, Chomsky normal form, parsing. Turing machines: the halting problem. NP-complete problems. Prerequisite: C- or better in MATH 221 or MATH 320. "
894,Pepperdine,P MATH 370 Real Analysis I (4) ,"P Rigorous treatment of the foundations of real analysis; metric space topology, including compactness, completeness and connectedness; sequences, limits, and continuity in metric spaces; differentiation, including the main theorems of differential calculus; the Riemann integral and the fundamental theorem of calculus; sequences of functions and uniform convergence. Prerequisites: C- or better in MATH 250 and MATH 320 or consent of instructor. "
895,Pepperdine,P MATH 380 Algebraic Structures I (4) ,"P The fundamental properties of groups and subgroups; factor groups and homomorphism theorems; direct products and finite abelian groups; permutation groups; rings, domains, and ideals; introduction to quotient rings, polynomial rings and fields. Prerequisites: C- or better in MATH 260 and MATH 320. "
