,School,CourseID,Descriptions
0,WilliamJewellSUPERTRIMMED,CTI 100 The Responsible Self	(4 cr. hrs.),"This is a humanities based, introductory course required of all students in their first year of study at the College. The organizing questions of the course are those of epistemology, ontology and ethics: What can we know? What is real? How should we live? Students will wrestle with these questions from several distinct cultural and ideological perspectives. (A text-based course including literature and primary texts in religion and philosophy)"
1,WilliamJewellSUPERTRIMMED,CTI 102 Written Communication	(4 cr. hrs.),"Develops student skills in academic writing, including research skills and critical use of sources in argumentation. Through writing and revising, students explore the role of audience and context in shaping written communication, and learn to demonstrate logical reasoning, adequate factual support, clarity and appropriate language choices."
2,WilliamJewellSUPERTRIMMED,CTI 103 College Algebra 	(4 cr. hrs.),"This course develops the foundational skills of mathematics and their applications. Topics include functions, inverses and graphs; polynomial, rational, radical, exponential and logarithmic functions; systems of equations; applications."
3,WilliamJewellSUPERTRIMMED,CTI 105 Math for the Liberal Arts 	(4 cr. hrs.),"This course helps students learn how to apply fundamental mathematical techniques (which includes algebraic and statistical techniques) and abstract concepts to practical, real-life situations. Topics will include finite mathematics, statistics and other selected topics that may include: voting theory; apportionment; graph theory; circuits and networking; population models; geometry and fractals; and probability theory."
4,WilliamJewellSUPERTRIMMED,CTI 107 Precalculus 	(4 cr. hrs.),"This course provides an in-depth study of college algebra and trigonometry to prepare students for calculus. Topics include functions, inverse functions, polynomial and rational functions, trigonometric functions, exponential and logarithmic functions, graphs of functions and applications, with emphasis on the concepts and skills central to calculus. Prerequisite: Placement in CTI 107 via the William Jewell College mathematics placement exam. Students who have successfully completed CTI 107 will not be permitted to count credit earned subsequently in CTI 103 or 105 toward graduation."
5,WilliamJewellSUPERTRIMMED,CTI 109 Calculus I 	(4 cr. hrs.),"This course is designed for students majoring or minoring in the mathematical and physical sciences. It will cover the following topics of differential and integral calculus: limits; continuity; the derivative and applications; extrema; the definite integral; the fundamental theorem of calculus; L’Hôpital’s rule; the method of substitution. Pre-requisite: CTI 107 or high school courses covering equivalent material and a passing score on the mathematics placement exam. Students who have successfully completed CTI 109 will not be permitted to count credit earned subsequently in CTI 103, 105 or 107 toward graduation."
6,WilliamJewellSUPERTRIMMED,CTI 120 Advanced Written Communication 	(4 cr. hrs.),Advanced expository writing is for students with superior writing skills. The course stresses development of the student’s voice as a writer through study of literary texts from several cultural or ideological perspectives and practice in various expository genres. Students may not count credit for both CTI 102 and CTI 120 toward graduation. Prerequisite: A score of 28 or higher on the English section of the ACT test.
7,WilliamJewellSUPERTRIMMED,CTI 150 Identity and Society	(2 cr. hrs.),"An introductory course in how to interact with others through the creation and perception of personal identities. Students will reflect on how they enact their own ideological, cultural and contextual assumptions regarding their relational perceptions of self and others, while learning how to engage in constructive, authentic communication."
8,WilliamJewellSUPERTRIMMED,CTI 200 United States Pluralism 	(4 cr. hrs.),"This course provides an examination of racial, ethnic, gender and other types of diversity in American society with the aim of increasing understanding of American pluralism and culture. Through significant written and oral exercises students will evaluate these topics in works of history, ethnography, sociology, autobiography, literature and film. (Interdisciplinary humanities course)"
9,WilliamJewellSUPERTRIMMED,"CTI 201 Divas, Death and Dementia","on the Operatic Stage	 (4 cr. hrs.)This course offers an introduction to the ways in which gender roles, the act of dying and madness have determined and influenced operatic discourse from about 1600 to the present. Chiefly through aural and visual experiences, as well as longer written projects, students will evaluate how these traditions have both accommodated and forced men and women into a variety of social and cultural roles. (Interdisciplinary humanities course)"
10,WilliamJewellSUPERTRIMMED,CTI 202 Performance Studies	(4 cr. hrs.),"This course trains students to read aloud a printed work in such a way that they effectively communicate to their audience the meanings and the rich complexities of the text at hand. On the premise that each academic discipline is like a subculture, students will research and analyze in writing the disciplinary cultures and methodologies their chosen text will represent in performance. Students also will analyze the conversations between cultures presented in texts and their own cultures. (Interdisciplinary humanities course) "
11,WilliamJewellSUPERTRIMMED,CTI 204 Cultural Values and Visual Art 	(4 cr. hrs.),"This course is an introduction to the study of visual imagery as a medium through which core cultural values find expression. Through class discussion, essay examinations and an extended research paper, students will demonstrate a clear grasp of the fundamental beliefs and values of several different worldviews. (Interdisciplinary humanities course)"
12,WilliamJewellSUPERTRIMMED,CTI 205 La Doulce France 	(4 cr. hrs.),"A broad perspective on France including geography, history (particularly from the 17th Century to the present), literature (in translation), art, music, government and implicit culture designed to lead students to an appreciation of French culture. Attention will be drawn to French contributions to the United States and to cultural comparisons. (Interdisciplinary humanities course)"
13,WilliamJewellSUPERTRIMMED,CTI 206 The Latina/o Experience	(4 cr. hrs.),"This course will trace the history of the Latina/Latino presence in the United States from the period of Spanish colonization, through the Mexican- American war and up to the present. The student will examine writings in the disciplines of history, literature and sociology in order to gain an understanding of the current and historical issues in the Latina/o community. The major questions addressed will be those of identity and the struggle for place, recognition and justice in the society at large. (Interdisciplinary humanities course)"
14,WilliamJewellSUPERTRIMMED,CTI 207 The Harriman-Jewell Series	 (4 cr. hrs.),"This course is a study that puts the events of the Harriman-Jewell Series into the context of the curriculum: the experiences of the performances are the subject, and readings and class sessions will provide enhancement background for them. The interdisciplinary features of the course include observation and listening to musical and dance performances, study of performance traditions, biographical study and cultural and performance history. (Interdisciplinary humanities course)"
15,WilliamJewellSUPERTRIMMED,CTI 208 Women Writers of World Literature 	(4 cr. hrs.),"An introduction to women’s literature (literature by women about women), specifically to the novel of the twentieth century, from various world perspectives. The history, geography and culture (including such topics as religion, social norms, economy, racial and ethnic concerns and political events) of specific countries and regions of the world will add to a greater understanding of women’s experience of these novels and their search for identity, fulfillment and self-expression. Brief discussion of theory concerning women’s writing will add to the students’ appreciation of the act of writing as a mode of self-expression and self-exploration as well as an act of communication. (Interdisciplinary humanities course)"
16,WilliamJewellSUPERTRIMMED,CTI 210 Film Worlds 	(4 cr. hrs.),"This course uses films as texts in order to explore the social, historical and cultural contexts the films depict. Interdisciplinarity is sought in the methods roughly analogous to those used in literary and historical investigation. The course will introduce students to new ways of seeing; they will watch a film against a complex matrix of interdisciplinarity that will confront their own cultural assumptions. Any particular focus of the course during a particular semester will be indicated in the class schedule. (Interdisciplinary humanities course)"
17,WilliamJewellSUPERTRIMMED,"CTI 214 Bioethics, Ethical Traditions,","and the Variety of Health Care Choices 	(4 cr. hrs.)Students will compare ethical judgments that are framed by Western bioethics with those framed by global ethics and other cultural and moral traditions. Students will critically appraise healthcare practices through case studies that illustrate selected life transitions, and challenges in healthcare management and public health. This course draws upon philosophy, anthropology and nursing/healthcare disciplines. (Interdisciplinary humanities course)"
18,WilliamJewellSUPERTRIMMED,"CTI 215 Trust, Betrayal and Forgiveness 	(4 cr. hrs.)","The course will inquire into the nature and value of trust, betrayal and forgiveness or, more generally, in the field of personal relationships, relation, perturbation and reconciliation. It will approach these topics through philosophical analysis and literary methods. Students will read and develop philosophical analyses of the key concepts and write scenarios (biographical, autobiographical, historical and/or imaginative) that implicate the three main themes. The scenarios will be critiqued for their adequacy in light of the demands of philosophical coherence, and the philosophical analyses will be critiqued in light of their capacity to deal with the nuances of the scenarios. This approach will be extended through reading and analyzing selected works of literature. Students will also consider the nature of relations of the methods, philosophical and literary, that are used for understanding and appreciating human relations. (Interdisciplinary humanities course)"
19,WilliamJewellSUPERTRIMMED,CTI 216 Wagner: Lord of the Ring	(4 cr. hrs.),"The development of modern mass media and the synthesis of art and entertainment both have their genesis in Richard Wagner’s operas, especially in his epic “Der Ring des Nibelungen.” This course will explore the context and content of the 15-hour cycle, Wagner’s influence on 20th century art, politics, and the complexity of multi-media expression in cultural formation. The ways in which his thematic materials are made manifest in cinema will also be investigated. Particular attention will be given to answering the questions: Why (and how) do artistic expressions cause controversy? How does art contribute to cultural formation and ideology? When does art become entertainment and entertainment become art? (Interdisciplinary humanities course)"
20,WilliamJewellSUPERTRIMMED,CTI 217 The Digital Community	(4 cr. hrs.),"Combining classic and contemporary critical theory with cultural analysis, this course examines the way new means of communication and virtual representation remap (if not reconstruct) reality and the way these re-mappings affect our identities, frames of thinking, values, relations, labor and material conditions of life–our community and the way we understand its boundaries. (Interdisciplinary humanities course) "
21,WilliamJewellSUPERTRIMMED,CTI 219 Intercultural Communication	(4 cr. hrs.) ,"A course designed to introduce students to such concepts as cultural differences, cultural belief systems, culture shock and acculturation, language of culture and multicultural nonverbal messages. (Interdisciplinary humanities course)"
22,WilliamJewellSUPERTRIMMED,CTI 220 Literary Topics 	(4 cr. hrs.),"A study in comparative themes and topics found in significant literary works from more than one literary or cultural tradition. Examples include revenge literature, sexuality in literature, literature in religion, literary utopias and dystopias. The focus of any particular semester’s course will be indicated in the class schedule. (Interdisciplinary humanities course)"
23,WilliamJewellSUPERTRIMMED,CTI 226 Religion and Meaning	 (4 cr. hrs.),"This class will explore how religion, particularly the religion of the biblical tradition, serves to guide people in the creation of meaning for understanding both the world they live in and its ethical structures. Using biblical texts and secondary readings from the discipline of sociology, students will explore specifically the secularizing effects of modernization on religion and ways that various religious traditions have responded to the problem of secularism. (Interdisciplinary humanities/religion course)"
24,WilliamJewellSUPERTRIMMED,CTI 229 Christianity and Tyranny 	(4 cr. hrs.),"Using the disciplines of literature and theology, this course addresses the question of how one can live under a repressive regime. Through close reading, class discussion and the presentation of a position paper, students will apply biblical principles to the ethical dilemmas raised by this question of responding to tyranny. (Interdisciplinary humanities/religion course)"
25,WilliamJewellSUPERTRIMMED,"CTI 232 Relationships: Psychological, Religious and Societal Perspectives 	(4 cr. hrs.)","This course will examine the diverse ways in which human beings form, maintain and dissolve relationships with each other and with the divine. Students will demonstrate their engagement with class discussions, readings and lectures through weekly in-class writing exercises and application exercises (such as debates or simulations). (Interdisciplinary humanities/religion course)"
26,WilliamJewellSUPERTRIMMED,"CTI 233 Songs, Symbols and 
Services of Christian Worship 	(4 cr. hrs.)","An historical survey of Christian hymnody, liturgies and other worship practices, including devotional texts, musical styles, symbols and building design, from their Jewish antecedents to the present day. Students engage with the material through course readings, textual analysis and singing of hymn texts, worship service design, participation in worship services representing a variety of denominations, reflection papers, presentations and class discussions. Assignments require limited travel to off-campus sites for weekend worship services. "
27,WilliamJewellSUPERTRIMMED,"CTI 236 Magic, Science and Religion 	(4 cr. hrs.)","This course studies the distinctions that emerge between magic, science and religion when seeking to understand whether and how a civilization’s reasons for confidence in science differ from those that support its belief in religion. The course will be structured around the categories, often applied to religion, of mystery, salvation, causation and theodicy as they apply to all three topics (magic, science and religion). (Interdisciplinary humanities/religion course)"
28,WilliamJewellSUPERTRIMMED,CTI 238 Religion in the Modern Age 	(4 cr. hrs.),"This course studies significant shapers of modern religious studies, and students explore how human communities create and maintain worlds of meaning in response to experiences of the sacred. The ongoing significance of religion in the American, including African-American, context is given focused attention. Generally offered every semester. (Interdisciplinary humanities/religion course)"
29,WilliamJewellSUPERTRIMMED,"CTI 239 Judaism, Christianity and Islam 	(4 cr. hrs.)","The course offers a comparative overview of Judaism, Christianity and Islam in their comparative histories, varying theological and ethical centers and scriptures. While the course examines all three religions from a single disciplinary perspective (i.e. religious studies), the comparative method invites questions that may only be appreciated by imposing methods and assumptions from other disciplinary (i.e., non-religious studies) perspectives. (Interdisciplinary humanities/religion course)"
30,WilliamJewellSUPERTRIMMED,CTI 240 Reading the Bible: Then and Now	 (4 cr. hrs.),"This course explores the reading of the Bible in the context of the history of Christianity. After surveying various ways of reading the Bible throughout Christian history, special attention is given to modern and post-modern modes of biblical interpretation. Students will learn how such contemporary modes of reading take place in conversation with other academic disciplines: cultural anthropology, narrative criticism and reader response criticism. (Interdisciplinary humanities/religion course)"
31,WilliamJewellSUPERTRIMMED,CTI 244 The Epics of Heaven and Hell 	(4 cr. hrs.),A study of two significant works of world literature: The Divine Comedy and Paradise Lost. Students will appreciate two examples of the heroic epic and understand how each author reads and reinterprets earlier epic literature and the Christian tradition. They will explore the two cultural worlds represented by the poems (high middle ages and early modern) and reflect on how the works provide two different readings of the Christian theological tradition and the Bible (Thomist Roman Catholic and Protestant). (Interdisciplinary humanities/religion course) 
32,WilliamJewellSUPERTRIMMED,CTI 245 Evil and Suffering in,"Religious and Literary Traditions	(4 cr. hrs.)This course considers how the distinct issues of evil and suffering have been addressed by thinkers who represent significant religious (Christian and Jewish) theological perspectives: From classical theism, to modern philosophical theism, to modern and contemporary theologies of liberation and compassion. Throughout the course, in order to provide a richer, more grounded context for reflecting on evil and suffering, theological and literary texts will be considered. The course ends with a particular literary account of suffering that calls into question various theological responses, in order to stretch the questions of the course even further: What does religion genuinely have to offer us when we are faced with evil and suffering? (Interdisciplinary humanities/religion course)"
33,WilliamJewellSUPERTRIMMED,"CTI 246 God, Nature and Science 	(4 cr. hrs.)","Students will learn essential features of the neo-Darwinian theory of evolution, as well as religious, primarily Christian, arguments both challenging and affirming the theory. Evolution grounds human existence interdependently with nature, not over and above nature, a status that religion can either endorse or challenge. The course explores biblical responses to the issue of human ecological responsibility, including the study of both “green-friendly” and “not-so-green-friendly” texts. "
34,WilliamJewellSUPERTRIMMED,CTI 251 The Science of Forensics 	(4 cr. hrs.),"This course is focused on the application of scientific techniques to the collection and analysis of evidence used for investigating criminal cases. In the context of investigating criminal cases students will gain an understanding of scientific methodology, analytical thought and techniques used in the analysis of hair and fiber evidence, drugs and toxic substances, arson and explosion, firearms and tools and biological specimens. The legal and ethical issues surrounding scientific integrity in the collection, handling and analysis of evidence will also be explored. CTI 251 will meet a teaching certification requirement for a physical laboratory science. (Interdisciplinary science course) This course includes an integrated laboratory/experiential learning component."
35,WilliamJewellSUPERTRIMMED,CTI 253 Energy and Society	(4 cr. hrs.),"A science course approaching the topic of energy from the discipline of physics but involving, at the application level, the larger considerations of individual and societal responsibility, which transcend the paradigms and boundaries of conventional physics courses. CTI 253 will meet a teaching certification requirement for a physical laboratory science. (Interdisciplinary science course) This course includes an integrated laboratory/experiential learning component."
36,WilliamJewellSUPERTRIMMED,CTI 255 Sports Science:,"Physics Applications and Ethical Issues	(4 cr. hrs.)This course investigates various sports-related activities in terms of the physical principles that govern them and analyzes athletic performance from the viewpoint of a physical scientist. In addition, the role that technology plays in the improvement of athletic performance is addressed along with ethical questions related to how athletes attempt to enhance athletic performance. CTI 255 will meet a teaching certification requirement for a physical laboratory science. (Interdisciplinary science course) This course includes an integrated laboratory/experiential learning component."
37,WilliamJewellSUPERTRIMMED,CTI 256 The Science of Sight and Sound 	(4 cr. hrs.),"The nature of sound and light is addressed in the context of our auditory and visual senses. Physics of sound, anatomy and physiology of the ear and the pathway to the cerebral cortex, and the psychology of perception are drawn upon to understand the functioning of musical instruments as well as our perception of music. The richness of color sensation in nature and art is addressed by similarly drawing on the physics of light, as well as the anatomy, physiology and psychology of vision. Technological approaches to correcting ocular and auditory defects are addressed as well as means of enhancing or extending the senses of sight and hearing. CTI 256 will meet a teaching certification requirement for a physical laboratory science. (Interdisciplinary science course) This course includes an integrated laboratory/experiential learning component."
38,WilliamJewellSUPERTRIMMED,CTI 257 Emerging and Re-emerging Infectious ,"Diseases: Local and Global Issues 	(4 cr. hrs.)Infectious diseases are undergoing a global resurgence due to factors such as human population demographics and behavior, antibiotic resistance, environmental degradation, political and economic decisions and public health policies. Diseases such as tuberculosis, malaria, measles and polio continue to be of global concern, while other diseases such as Ebola, “Mad Cow” disease and Hantavirus pulmonary syndrome make their appearance. CTI 257 will meet a teaching certification requirement for a biological laboratory science. (Interdisciplinary science course) This course includes an integrated laboratory/ experiential learning component."
39,WilliamJewellSUPERTRIMMED,CTI 258 Astronomy and Cosmology: ,Observations and Theories of the Universe	(4 cr. hrs.)An interdisciplinary examination of how our conception of the universe has evolved from that of selected early societies to the modern worldview based on observations and the theories that explain them. CTI 258 will meet a teaching certification requirement for a physical laboratory science. (Interdisciplinary science course) This course includes an integrated laboratory/experiential learning component.
40,WilliamJewellSUPERTRIMMED,CTI 259 The Ecology of Food 	(4 cr. hrs.),"The Ecology of Food is an exploration of food from the following perspectives: the importance of food (requirements for human health, supply and demand) the distribution of starvation and abundance, the ecological and economic reasons for this distribution, the amount and sources of energy involved in food production, the role of food production in sustainability issues (water, energy and soil/nutrient supply), the economics of food and food production, various forms of agriculture used to produce food, and, finally, food security in a global marketplace in an age of terrorism. CTI 259 will meet a teaching certification requirement for a biological laboratory science. (Interdisciplinary science course) This course includes an integrated laboratory/experiential learning component."
41,WilliamJewellSUPERTRIMMED,"CTI 260 Sustainability and the 
World’s Resources	(4 cr. hrs.)","This course is an exploration into the scientific and public policy issues surrounding the effects of global development on the world’s natural resources. Resources to be investigated include the air we breathe, sources of energy, the world’s water supply and the extraction of virgin materials such as metal ores. The recycling of metals, plastics and other materials will also be considered. Relevant scientific concepts will be explored, as well as available sustainable practices for utilization of these natural resources. CTI 260 will meet a teaching certification requirement for a physical laboratory science. (Interdisciplinary science course) This course includes an integrated laboratory/experiential learning component."
