,School,CourseID,Descriptions
42,WilliamJewellSUPERTRIMMED,CTI 261 Ethnobotany	(4 cr. hrs.),"Ethnobotany is the study of the interactions between humans and plants, focusing on how plants are used every day by humans for food, medicine, recreation, housing, clothing, etc. This class explores the cultural, religious and historical importance of plants to humans as well as focusing on the study of plant biology. The course will interweave exploration of plant biology with the understanding of how plants are used by humans and have, in turn, impacted human history and culture. CTI 261 will meet a teaching certification requirement for a biological laboratory science. (Interdisciplinary science course.) This course includes an integrated laboratory/experiential learning component."
43,WilliamJewellSUPERTRIMMED,CTI 262 Astrobiology	(4 cr. hrs.),"Astrobiology is the study of the origin, evolution and distribution of life in the universe. It uses interdisciplinary science at the intersection of biology, geology and astronomy to discover where and under what conditions life arises and exists in the universe. This course examines the origin and evolution of life on Earth, what conditions are necessary for a habitable planet, which planets and moons in our solar system could harbor life, and the search for habitable extra-solar planets. CTI 262 will meet a teaching certification requirement for a physical laboratory science. (Interdisciplinary science course.) This course includes an integrated laboratory/experiential learning component.Power and Justice in Society: Interdisciplinary Courses in the Social Sciences"
44,WilliamJewellSUPERTRIMMED,CTI 275 Communities and Social Problems 	(4 cr. hrs.),"This course focuses on various expressions of inequality from sociological, economic, historical and psychological perspectives. Students will present oral and written reports of analyses of various social problems. There is a Service-Learning component in this course. (Interdisciplinary social science course)"
45,WilliamJewellSUPERTRIMMED,CTI 277 Deviance and Discipline: Crime ,"and Punishment in Historical Perspective	 (4 cr. hrs.)This course asks students to study and apply the content and methods of history, sociology, literature and art history to the topic of criminal justice in eighteenth and nineteenth century England. Through their reading and written assignments students will grapple with a variety of materials, including statistical studies of crime, social theories of deviance, literature such as the play The Beggar’s Opera and the fiction of Charles Dickens, and the paintings of William Hogarth. (Interdisciplinary social science course)"
46,WilliamJewellSUPERTRIMMED,CTI 280 The Second World War	(4 cr. hrs.),"The course examines the military, political and social history of World War II, as well as the conflict’s origins and the causes of Allied victory. Students will consider ethical questions such as those related to the rise of fascist dictatorships in Germany and Japan; targeting civilian populations during a “total war”; the Holocaust; Japanese war-crimes in Asia; Japanese internment in the United States; racism in the Pacific War; the fire-bombing of German and Japanese cities and the use of atomic bombs; and the Nuremberg trials. (Interdisciplinary social science course)"
47,WilliamJewellSUPERTRIMMED,"CTI 281 Medicine, Money and Morals	 (4 cr. hrs.)","This course explores issues in the area of biomedical ethics. The interdisciplinary origin of biomedical ethics facilitates investigation into the societal impact of medicine, morality and economics. Students explore competing power structures within the healthcare industry from both an historical and contemporary perspective. Students analyze justice within existing and ideal healthcare structures with particular attention to justice for the vulnerable. (Interdisciplinary social science course)"
48,WilliamJewellSUPERTRIMMED,CTI 284 School and Society,"in the United States	(4 cr. hrs.)This course examines the development of American schooling within the context of social history. The course focuses on four themes: the differing (often conflicting) concepts about schooling held by leading educational thinkers, the public and public policy makers; the changing relationships among schools and other education entities such as church and family; the societal and policy issues that have shaped the American educational system; and public schooling as a promised or real agent of social change. Students in this course are expected to analyze these forces from all perspectives and to critically discern how and why the current school system evolved. Students will also be expected to identify the origins of current educational issues, be able to analyze and critically discuss those issues and formulate a personal position and/or plan of action based on that understanding. Specific lenses for analysis will include race, class, ethnicity, gender, religion and the intersection of these factors in the construction of power and justice in/through schooling in the United States. (Interdisciplinary social science course)"
49,WilliamJewellSUPERTRIMMED,CTI 285 Comparative Revolutions 	(4 cr. hrs.),"We often label significant moments of change ‘revolutions.’ Such moments in time often reveal the significant differences between competing ideas and the reality of power and justice. This course will guide students through a comparative study of at least two revolutions, for example the French Revolution of 1789, the Russian Revolution of 1917, the Scientific Revolution of the 17th century, the American Revolution, the Industrial Revolution of the 18th century, etc. Some of the key questions involved in this course will include: How do we define revolution? What causes them? What influences their outcomes? Are revolutions primarily political events or must they also involve social and/or economic change? Who participates in revolution and why? Are some revolutions failures and others successful? "
50,WilliamJewellSUPERTRIMMED,"CTI 286 Gender, Power and Justice 	(4 cr. hrs.)","Gender, like race and class, is one of the fundamental categories that have affected, if not determined, one’s experience of power and justice. This course looks in particular at the experiences of women and men from the 18th century to the present. It examines both the theory and reality of women’s roles in the family, the work place and the state and how those have changed over time. (Interdisciplinary social science course)"
51,WilliamJewellSUPERTRIMMED,CTI 287 Slavery and Abolition,"in the Modern World	(4 cr. hrs.)This course examines present-day slavery and human trafficking—and antislavery campaigns seeking to end them—in historical perspective. After a brief introduction to slavery in the ancient and medieval eras, the first section of the course surveys the rise and fall of slavery in the Atlantic world from the 16th century to the 19th. The second section adopts a more global focus and concentrates on the late 20th century and early 21st century, exploring why forced labor and human trafficking continue to thrive and what steps are being taken to reverse that trend. Students will draw on disciplines including history, economics, political science, literature and law. Close attention will be paid to how inequalities of power in the global economy have fueled the expansion of slavery and how globalization and technology have provided tools for anti-slavery activists to combat slavery and seek justice for its victims. (Interdisciplinary social science course)"
52,WilliamJewellSUPERTRIMMED,"CTI 288 Philosophy of Power, Sex and Gender	(4 cr. hrs.)","This course is an introduction to contemporary feminist theory, taught in a seminar format. We will consider the philosophical implications of claims made in other fields, including anthropology, political science, sociology, psychology and biology. Questions we will consider include: What is the relationship between sex and gender? How has the discipline of philosophy generally understood women, and presupposed a particular attitude toward gender? What are liberal feminism, radical feminism, Marxist feminism, multicultural feminism, post-modern feminism and how do they differ from one another? What are some important arguments made by feminist ethicists and feminist epistemologists? How are contemporary feminist philosophers contributing to the debate on micro-inequities and implicit bias? Students will gain familiarity with current feminist philosophical scholarship while developing their own scholarly abilities and skills of critical analysis. (Interdisciplinary social science course)"
53,WilliamJewellSUPERTRIMMED,CTI 289 Today’s American Political Debate	(4 cr. hrs.),"This course examines major current controversies in the national political conversation of the United States. It focuses on questions of economic policy as well as controversies over social questions. Readings reflect a diversity of political perspectives. Attention will also focus on how specific political debates are shaped by the contending world views of the participants. Among the matters covered are economic and social stratification and inequality, the condition of social capital, and the dividing line between public and private. (Interdisciplinary social science course)"
54,WilliamJewellSUPERTRIMMED,CTI 401 Birth by Any Means? 	(4 cr. hrs.),"In the United States today, Assisted Reproductive Technology (ART) is a virtually unregulated field of medical practice. In this capstone course, students will consider competing ethical frameworks on the technological creation of life. Students will also develop careful proposals on whether and how to regulate ART in a variety of settings, from the law and public funding to counseling briefs for hospitals."
55,WilliamJewellSUPERTRIMMED,CTI 402 Capitalism and Democracy: ,"What is a Good Society? 	(4 cr. hrs.)This course examines the challenges, the dilemmas and the fundamental issues at stake in creating democratic political systems with market economies. It also explores the stresses placed by globalization on developed capitalist democracies today."
56,WilliamJewellSUPERTRIMMED,"CTI 403 Plague, Piety and Public Policy 	(4 cr. hrs.)","This course will examine social and ethical responses to pandemic diseases, specifically the bubonic plague of the 14th century and AIDS. After exploring biological, ethical and social aspects of plague, students will offer recommendations and debate the appropriate policy response to AIDS. "
57,WilliamJewellSUPERTRIMMED,CTI 404 State and Society 	(4 cr. hrs.),"This course will focus on current debates over the proper scope of the public sector in American life. Students will examine contending perspectives on where and how to draw the line between the public and the private. The contending perspectives might include libertarianism and social justice liberalism, as well as Roman Catholic and Calvinist views of “natural law.” Students will then consider two current public questions: the regulation of tobacco and school vouchers."
58,WilliamJewellSUPERTRIMMED,CTI 405 Endangerment:,"Species, Languages and Cultures	 (4 cr. hrs.)This course will explore biological and ethnolinguistic diversity and endangerment. It will explore the following questions: What are the mechanisms by which species and ethnolinguistic groups have come into being and how can we know this? To what degree are these underlying mechanisms similar or not? What are the causes of biological and ethnolinguistic endangerment and are they similar or not? What are the ethical foundations for conservation of both species and ethnolinguistic groups? What should our responses to biological and ethnolinguistic endangerment be given the answers to the above questions? The class will explore these questions through the primary literature and independent research on the relationship between biological and ethnolinguistic diversity."
59,WilliamJewellSUPERTRIMMED,CTI 406 Death by Any Means? 	(4 cr. hrs.),"This course will examine the current debate surrounding capital punishment. Students in this course will examine arguments in favor of and against the death penalty in the United States, and will also investigate the differing religious opinions, both Christian and non-Christian, that exist concerning this topic. Finally students will learn about the role that scientific evidence, specifically DNA testing, plays in this debate, and will also learn about the social justice issues that are imperative to understanding this topic."
60,WilliamJewellSUPERTRIMMED,CTI 407 The Economics of Well-Being	(4 cr. hrs.),"This course explores the economic, philosophical and religious implications of “wellbeing” by analyzing Mark Anielski’s five categories of capital (human capital, social capital, natural capital, built capital and financial capital) from his book, The Economics of Happiness, as they relate to both local (Liberty, Missouri and Kansas City, Missouri) and global applications (Bhutan’s “Gross National Happiness”)."
61,WilliamJewellSUPERTRIMMED,CTI 408 Health Care at Any Cost? 	(4 cr. hrs.),"As health care costs stretch our national resources, we are faced with choices about personal and societal health. In this course, students will explore the current U.S. healthcare system and how health values are shaped by and shape consumerism. We examine justice in healthcare and how current trends will impact future healthcare delivery. Students will critically appraise selected issues relating to healthcare and use a research process for analyzing cost in managed health care situations."
62,WilliamJewellSUPERTRIMMED,CTI 409 Immigration: E Pluribus Unum? 	(4 cr. hrs.),"This course will examine the issue of U.S. national identity as found in our conceptions of citizenship and national boundaries. We will raise these questions: What does it mean to be an American? What should it take to enter the United States legally? What does it mean to acquire United States citizenship? The goal of this examination will be to understand how various conceptions of national identity, citizenship and national borders shape the current debates over immigration policy. After exploring the ethical, economic, biological and social issues regarding immigration, students will create an immigration policy. That policy will be assessed as to its internally consistency, fit with the U.S. Constitution, moral soundness and comprehensiveness in defining the bounds of legal immigration as well as consequences of illegal entry."
63,WilliamJewellSUPERTRIMMED,CTI 410 Private Solutions for,"Public Problems: In Billionaires We Trust 	(4 cr. hrs.)Increasingly, high profile individuals and corporations are using their dollars and influence to try to solve social problems. In doing so, they are effectively creating public policy despite their status as private citizens. This course examines the role of private philanthropy in solving public problems. The ethics and values of philanthropy rooted in the evolution of the third sector, primarily in the United States, will be analyzed. Attention will be given to legal and philosophical issues associated with philanthropic endeavors, including the social responsibility of the corporation, looking at how profit motive interacts with social causes. We will discuss models of philanthropic and charitable organizations, their operational practices and issues arising from their existence and activities. In order to frame our discussion on philanthropy, each semester a major global issue currently being impacted by private philanthropy will be addressed, such as climate change or the global AIDS epidemic."
64,WilliamJewellSUPERTRIMMED,CTI 411 Well-being by Design? 	(4 cr. hrs.) ,"This course will explore what structural attributes are needed to make a community strong and sustainable. We will survey some influential social justice philosophies while asking if it is possible to plan for the equitable, sustainable well-being of the members of an urban community. How can these philosophies be practically applied in actual communities in a way that protects individual happiness, community values and environmental capital? We will examine real-world proposals for community planning that attempt to answer questions such as: How are the values of that community translated into a healthy development plan for that community? What factors must be considered in designing the infrastructure that underlies healthy neighborhoods and communities within the urban context? "
